Attention All Conservative LGBT!,PurpleAngel23,1593455604.0,4546,self.Conservative,"'In light of Reddit’s new subreddit purge, we mods at r/Conservative would like to extend a big happy welcome to our friends and allies in the LGBT community. \n\nFirst and foremost, we want you to know that you have *always* been welcome in our subreddit. We welcome any and all Conservatives from many walks of life. Even our moderation team is highly diverse! \n\nFor those of you who might be confused as to what’s going on, this morning Reddit banned around 2000 subreddits for “hate speech”, aka wrong think. Among those banned was r/RightWingLGBT. \n\nBut fear not! You are not completely sub-less. We welcome you to find a new home in r/Conservative. Please, make yourself comfortable in our subreddit. You’re family!\n\nAs always, we ask all of our users—new, old, and flaired—to follow our rules. Send any and all questions to our mod team via mod-mail. Please and thank you. \n\nWe are so happy you’ve chosen to reddit with r/Conservative. We hope you enjoy your time here!\n\nSee you in the sub,\n\nPurpleAngel23'",hi5mwl,0.71,1601
Not an exaggeration,GimmeDatDaddyButter,1598809123.0,4551,i.imgur.com,'',ijgso6,0.6,854
"Ulysses S Grant Defeated the Confederacy & Blasted the KKK, But Rioters Just Destroyed His Statue",SaulStein,1592845307.0,4548,thefederalistpapers.org,'',hdw5g6,0.82,614
"Well, they ARE German cars...",Sword_of_Apollo,1591472389.0,4539,i.redd.it,'',gxxkbh,0.8,363
Debate me if you please,Qplus17,1592049363.0,4538,i.redd.it,'',h865zq,0.55,1992
"Dude I work with made this. Says it all, IMHO.",dan4daniel,1585254094.0,4537,i.redd.it,'',fpiv9x,0.91,161
Kamala Harris is a terrible VP pick but this is still so true. God bless this country!,broji04,1597191137.0,4527,i.redd.it,'',i83eeh,0.92,547
The divide between the media and the people illustrated perfectly:,Jonye1,1580950598.0,4526,i.redd.it,'',ezjzrv,0.89,393
Democrats for Biden!,tehForce,1588776133.0,4513,i.redd.it,'',gel9tg,0.9,146
Always there to help,,1589316889.0,4517,i.redd.it,'',gik6uo,0.62,692
Progression of cnn.... only 3 months late.,,1593800728.0,4508,i.redd.it,'',hko7hz,0.68,548
Liberal logic on boycotts,optionhome,1594722036.0,4492,imgur.com,'',hqz05e,0.57,927
America Ranked #1 Place In World Where You Can Get Rich By Writing About How Awful The Country Is,bitchimacow22,1598490337.0,4484,babylonbee.com,'',ihbjcr,0.83,254
Hmmm,Wonder10x,1578766721.0,4482,i.redd.it,'',enayqr,0.9,173
And more true words have never been spoken.,Tony-At-Large,1578021104.0,4478,i.redd.it,'',ej9936,0.86,158
"Sorry everyone, China is off limits",Round_Sun,1589409657.0,4479,i.redd.it,'',gj9lsj,0.74,301
Thank you.,Clatsop,1541948602.0,4470,i.imgur.com,'',9w4f0z,0.73,160
At least we ruined his life...,Jibrish,1587555923.0,4478,i.redd.it,'',g5zntv,0.73,559
"""We found no pattern of sexual misconduct aside from the sexual misconduct.""",-Kerosun-,1587130007.0,4472,i.redd.it,'',g31z0h,0.92,333
#BLEXIT,Clatsop,1596971109.0,4458,i.imgflip.com,'',i6hkve,0.67,154
Weird how that works.,1TARDIS2RuleThemAll,1591328356.0,4453,i.redd.it,'',gwx0d5,0.66,654
What CNN calls a “Peaceful” Protest,NotJoshhhhh,1596059465.0,4454,v.redd.it,'',i09jw5,0.77,297
Seattle mayor who defended CHOP is outraged after protesters showed up at her home,DanAdamsShow,1593516016.0,4455,theblaze.com,'',hilgnh,0.74,558
"""He penetrated me with his fingers"" - Tara Reade referring to Joe Biden",tehForce,1585316229.0,4458,i.redd.it,'',fpx235,0.89,299
Day After Biden Calls Trump 'Dangerous to Israel' He Announces Second Israel-Arab Peace Deal,0ldManFrank,1600031057.0,4455,trendingpolitics.com,'',is6qfm,0.83,287
"WALSH: When You Make A Hero Of George Floyd Instead Of David Dorn, You Get More George Floyds And Fewer David Dorns",MediaShatters,1598822863.0,4435,dailywire.com,'',ijkyfs,0.73,467
Let's Be Honest...,thatrightwinger,1593538919.0,4444,i.redd.it,'',his4zf,0.64,354
Hmm....,Jibrish,1592912943.0,4436,i.redd.it,'',hed659,0.55,1315
Some days it sure feels like it....,free_loading_z,1586914786.0,4437,i.redd.it,'',g1ijh0,0.9,133
My Favorite Venn Diagram,PhilosoGuido,1601125775.0,4443,i.redd.it,'',j05r4d,0.69,334
Selective Editing...,Jibrish,1592220696.0,4434,i.redd.it,'',h9eisw,0.59,947
How did he get Covid?,thatrightwinger,1595251311.0,4434,i.imgur.com,'',hul501,0.63,272
"High School Transgender Sprinters Win 1st and 2nd Place at Connecticut Girls Indoor Track Championships. “We all know the outcome of the race before it even starts; it’s demoralizing,” she said.",optionhome,1551087955.0,4422,thegatewaypundit.com,'',auji0m,0.76,537
"Lol, must suck to be white in lib lands.",ayonick,1584038186.0,4425,i.redd.it,'',fhl4gd,0.69,317
👍,Brf611,1573004998.0,4425,i.redd.it,'',ds9au4,0.88,80
44% Of Young People Say It's Okay To Fire People Who Support Trump,Winterhold2000,1596473542.0,4418,thefederalist.com,'',i30m4z,0.81,1106
A warning from a Hong Konger to the USA,ravoilator,1589232429.0,4419,self.Conservative,"'I don’t know whether this post will get a lot of traction or not, but hear me out. I am from Hong Kong and I am here to warn you guys about the dangers of ccp influence on the US politics. \n\n\n\nChina is a ruthless, power hungry dictatorship that wants to assert world domination through ways such as political influence, information warfare and economic power. Don’t believe me? Look at Africa and how they need to listen to the whims of ccp because the ccp lends them a lot of money to build infrastructures. As a result the chinese pretty much have full political and economical control as for now. \n\n\n\nWhat does that have to for the US? Well as you may heard many liberals are still hanging on the the idea of”China is our friend” or “Don’t hate china for the virus!” Truth is if you dont do something against China, they will have more and more political influence in the world and in the end you (no matter liberals/conservatives) will bow to China. Just look at how China has already influenced UK with the 5G networking deals and notice how the UK governent is so scared to say out anything agaist China (eg.the virus). Id say this to the liberals but they seemed to be too occupied with making friends with China and not even relising their freedom of speech they so enjoy will be taken away under China, China will use freedom of speech for its advantage and paint itself a good image. Just look at how many state run medias are broadcasting chinese propoganda on youtube already and how internet army speaks out against freedom fighters in HK and Tibet and of course Taiwan. They also seemed to be too occupied to say that saying out anything against China is RACIST. \n\n\nPlease, for the love of god be VERY clear a dictatorship like china is your enemy and you should at least try to convince the libs to be wary. And tell them Trump is the first president to really stood up agaist China, just look what obama did to make the evil ccp a world power. Stay vigilant conservatives, we have a common enemy to fight to defend liberty and freedom!                                  \n\n\n—From a Hong Konger\n\n\n\nUpdate: heres my second post https://www.reddit.com/r/Conservative/comments/gi59qr/advice_from_a_hong_konger_to_usa_2/?utm_source=share&utm_medium=ios_app&utm_name=iossmf check out how you can take part in destroying the ccp!'",ghwu2w,0.78,506
Twitter deletes video promoted by Trump on hydroxychloroquine use for coronavirus,Drunken_Priest,1595938755.0,4419,foxnews.com,'',hzdngf,0.68,1028
"WaPo claims Trump was wrong about all the most dangerous cities being run by Democrats: only 19 out of 20: the last was ""independent.""",thatrightwinger,1593316394.0,4408,pjmedia.com,'',hh7t5q,0.7,563
This... is CNN.,Clatsop,1592658003.0,4403,i.imgflip.com,'',hclwqq,0.6,1020
GrEtA wAs SnUbBeD fRoM tHe NoBeL pEaCe PrIzE,Murican_Freedom1776,1570886209.0,4402,i.imgur.com,'',dgv14t,0.6,648
National Media Silent After Black Man Executes 5-Year-Old White Boy In Front Of His House,SaulStein,1597262739.0,4401,thefederalistpapers.org,'',i8l2p8,0.8,986
"Emmanuel Macron: France Will Not Engage In ‘False Rewriting Of History,’ No Statues Are Coming Down",dhaunatello,1592270217.0,4400,dailywire.com,'',h9tfc0,0.81,408
"Red, White & Blue",Foubar,1593862750.0,4400,i.redd.it,'',hl1za0,0.69,451
Thanks Trump,notsurewhatiam,1585142622.0,4392,i.imgur.com,'',foq7aa,0.7,277
True Socialism,tehForce,1594349515.0,4394,i.redd.it,'',hoh40o,0.6,913
Capitalism can work for Everyone,optionhome,1592394356.0,4382,imgur.com,'',hapl9j,0.89,161
"""you complete walnut""",tehForce,1565479865.0,4384,i.redd.it,'',copd1y,0.72,448
"17-year-old conservative activist raises over $160,000 to assist black-owned businesses destroyed by riots",DH5650,1593009064.0,4375,disrn.com,'',hf20iq,0.93,159
BLM and DNC attack government funding for police meanwhile they ignore a multibillion dollar a year racket by the police that puts money directly in their pockets.,shitp0stmalone,1598119878.0,4382,i.redd.it,'',iend3z,0.7,541
But I was just following CDC guidlines :(,HarryBergeron927,1590416654.0,4380,i.redd.it,'',gqbt0b,0.9,156
I will not be told.,_TheJudge,1590231575.0,4364,i.redd.it,'',gp30a1,0.69,321
"JK Rowling: Children Being 'Shunted Towards Hormones and Surgery' Is A ""New Kind Of Conversion Therapy""",Ar509,1594057554.0,4361,breitbart.com,'',hmcc7r,0.7,781
Trump Adds 'Black Lives Matter' Sticker To SUV So Media Can't Claim He's Spreading COVID,JesusCumelette,1601911366.0,4353,babylonbee.com,'',j5lc8s,0.7,242
The State of Idaho Bans Transgender Girls from Playing Girl Sports,eunpiacere,1585669268.0,4355,xephula.com,'',fsf4y2,0.9,272
Reddit circa 2020...,Jibrish,1587555697.0,4350,i.redd.it,'',g5zm75,0.65,848
Antifa Attacks Journalist Andy Ngo,kgs1977,1561852207.0,4350,v.redd.it,'',c76dh6,0.71,730
The thought process of the Left.,Maconga18,1562776434.0,4346,i.redd.it,'',cbiydd,0.83,276
A penny for your thoughts,ChunkyArsenio,1599707055.0,4345,reviewjournal.com,'',ipv8dp,0.77,318
Antifa,Yosoff,1507728718.0,4336,i.imgur.com,'',75p2fy,0.56,423
Black Lives Matter?,tehForce,1597231219.0,4344,i.redd.it,'',i8bxe2,0.77,313
Liberals protesting in Minnesota be like,npoggi79,1590694205.0,4345,i.redd.it,'',gscyrr,0.69,657
Anyone else notice BLM disappeared after 2016 until election season?,Wonder10x,1591299112.0,4334,i.redd.it,'',gwodjb,0.61,589
Truth,PlymouthSock,1561471791.0,4322,i.imgur.com,'',c59476,0.87,189
Feminist Cafe That Charged 18% ‘Man Tax’ Goes Out of Business,Sola__Fide,1556049200.0,4312,pluralist.com,'',bgkumd,0.81,372
"Two women charged with stealing a Make America Great Again hat from a boy seated outside the Democratic National Convention in Wilmington have had their charges upgraded to hate crimes, the Delaware Department of Justice announced today",optionhome,1599606103.0,4306,wdel.com,'',ip48i9,0.53,1351
It really doesn't,tehForce,1585925528.0,4297,i.redd.it,'',fu9r8c,0.62,1033
This sign at a pizza shop by my house 😂,AKatt91,1581188250.0,4296,i.redd.it,'',f0vx0f,0.77,117
Found my favorite tweet,Lambiri72177,1588887243.0,4292,i.redd.it,'',gffqpp,0.73,463
Anti-Hero,tehForce,1588338051.0,4284,i.redd.it,'',gbho64,0.91,227
Hilarious and mortifying at the same time,Sola__Fide,1590375428.0,4285,i.redd.it,'',gq33dv,0.68,426
Oh my sides 😂,ETHNJCB,1563118833.0,4281,v.redd.it,'',cd4e45,0.64,833
China shouldn’t be allowed to rewrite history on COVID-19,salty8888,1584960431.0,4278,skynews.com.au,'',fnhy5p,0.87,250
"Three Female High School Athletes File Federal Lawsuit to Block Transgender Students From Competing in Girl's Sports. “Mentally and physically, we know the outcome before the race even starts. That biological unfairness doesn’t go away because of what someone believes about gender identity.""",optionhome,1581557438.0,4270,thegatewaypundit.com,'',f320hr,0.9,374
Be safe out there...,Clatsop,1562237176.0,4266,i.imgur.com,'',c915tb,0.86,161
Deloitte says Harvard grad who blamed Trump supporters for losing 'dream job' was only a two-week internship,Winterhold2000,1593804299.0,4274,dailymail.co.uk,'',hkp8wq,0.84,409
Tweet by the German 'WerteUnion',schliatzke,1585426358.0,4262,i.redd.it,'',fqrjos,0.77,281
Why we must never forget the victims of communism. Fight the misiformation!,IBiteYou,1588354741.0,4267,i.redd.it,'',gbmlss,0.87,254
Donald Trump Demands Death Penalty for 'Animals' Who Shot L.A. Deputies,cp3883,1600015007.0,4259,breitbart.com,'',is1ia2,0.65,1139
Barr: 'Peaceful Protesters Do Not Throw Explosives Into Courthouses',freedomhertz,1595945879.0,4261,thefederalist.com,'',hzfg20,0.8,524
Things every kid needs to hear,StopBeingPoor,1565287729.0,4260,i.redd.it,'',cnpj9t,0.9,154
Big government vs empowered individuals. It’s obvious who the MSM prefer to promote,Wonder10x,1576182768.0,4250,i.redd.it,'',e9t6as,0.75,293
The virtue signalling template,Andra_k,1591129694.0,4246,i.redd.it,'',gvf3us,0.89,279
The insanity known as political correctness has to end somewhere.,,1575340173.0,4251,i.redd.it,'',e5a3d0,0.88,189
Who could have seen this coming? How did this happen?,universalChamp1on,1600350829.0,4248,i.redd.it,'',iujwil,0.93,220
The NYPD Sergeants Benevolent Association says that THEY will organize the 9/11 Tribute in Light. Statement here.,IBiteYou,1597448135.0,4243,i.redd.it,'',i9wxfl,0.77,461
When Biden sees a black baby being born:,libermexitarian,1590499816.0,4246,i.redd.it,'',gqx359,0.78,255
Drew Brees says he doesn't understand kneeling for the flag: thrown into the volcano. DeSean Jackson (Eagles) literal says Farrakhan and Hitler are right about the Jews and proceeds to quote Hitler: crickets.,Dast_Kook,1594129881.0,4244,crossingbroad.com,'',hmuwez,0.73,604
"Ladies and Gentlemen, the UK",SuperCharged2000,1555854362.0,4243,external-preview.redd.it,'',bfoyb8,0.74,272
You hate to see it,thenatural134,1588654231.0,4228,i.redd.it,'',gdre7g,0.88,231
Prophet George Orwell,DumplingJ_,1593628000.0,4224,i.redd.it,'',hjfxuh,0.82,348
"""Give me your young"" Lenin...",Venus230,1573071642.0,4232,i.redd.it,'',dslwuz,0.76,213
☐ Not REKT ☑ REKT,CarolinaPunk,1458416433.0,4229,imgur.com,'',4b4ghc,0.79,152
Racist America,,1598896706.0,4218,i.redd.it,'',ik2yud,0.65,1235
"David Dorn’s murder draws ZERO coverage from CNN, MSNBC",undue-influence,1591188902.0,4218,noqreport.com,'',gvtf7e,0.71,712
"President Trump signs executive order to increase domestic product of minerals, lessen reliance on China",robble_c,1601854411.0,4211,breitbart.com,'',j58yvf,0.77,285
How to get the black vote,peeves91,1554909661.0,4218,i.imgur.com,'',bbn95y,0.72,422
HUGE: The UK Just Dumped China's Huawei in 5G Tech Roll-Out — Citing its Lies Over Coronavirus.,Qplus17,1587215569.0,4206,pjmedia.com,'',g3nasb,0.88,269
Enemy of the people,Sola__Fide,1600613202.0,4198,i.redd.it,'',iwf4iq,0.71,554
C̶o̶c̶a̶i̶n̶e̶ Mitch,tehForce,1600613370.0,4202,i.redd.it,'',iwf6b7,0.87,279
‘Boys Are Boys and Girls Are Girls’: Idaho Is First State to Bar Some Transgender Athletes,bobbyw24,1585823369.0,4192,nytimes.com,'',ftk0yn,0.83,353
Trump says he will ban TikTok from operating in the US,tenshon,1596250327.0,4197,thehill.com,'',i1ky5g,0.85,840
"Black Lives Matter Quietly Deletes Its ""What We Believe"" Page Calling for the Destruction of the Nuclear Family",JesusCumelette,1600712090.0,4188,redstate.com,'',ix5vs4,0.68,828
After Protest Leader Blocks California Highway With 300 People – She Gets Charged With Up To 15 Years In Jail,HolidayOther,1601808496.0,4179,proudamerican.site,'',j4x19y,0.73,413
Joe Biden checks in on the #BLEXIT meme...,Clatsop,1591550088.0,4181,i.imgflip.com,'',gyg8l1,0.78,106
Reddit moment,CrustySheen,1583950083.0,4177,i.redd.it,'',fh1hjc,0.66,506
"Radical feminist ""gender equality"" at work. This coward deleted their Twitter account.",Sola__Fide,1589292267.0,4182,i.redd.it,'',gibtrt,0.84,478
The only celebrity I’ve seen do anything concrete about this horrible situation...and yet a black man is still not allowed to have his own political opinion,lanceparth,1591307983.0,4176,i.redd.it,'',gwr9tc,0.65,767
Poor Bubba. When will it stop?,tehForce,1593047869.0,4171,i.redd.it,'',hfda8t,0.68,391
"Portland BLM Thug Who Kicked Innocent Man in the Face Arrested, Charged With 3 Felonies",allnamesaretaken45,1598044471.0,4165,amgreatness.com,'',ie5hfr,0.73,557
71% of Americans Say Political Correctness Has Silenced Discussions Society Needs to Have,PubliusVA,1509469802.0,4172,cato.org,'',79x6yd,0.73,436
"OK, then.",,1553371604.0,4171,puu.sh,'',b4nl71,0.76,209
"""Let me explain to you why you're wrong.""",TheChristinaAnne84,1564433264.0,4172,i.redd.it,'',cjh6i3,0.66,254
"NBA Won’t Sell Custom Jerseys That Say ‘FreeHongKong,’ Will Create Uniforms That Say ‘F**kPolice,’ According To Its Online Store System",Offermybrotherhesaqb,1594677401.0,4171,dailycaller.com,'',hqoqxh,0.89,266
If it weren't for double standards....,IBiteYou,1598833748.0,4155,i.redd.it,'',ijnz61,0.7,556
Privilege we should all try to give to the next gen.,1TARDIS2RuleThemAll,1592076988.0,4152,i.redd.it,'',h8e4hz,0.82,478
Love this ❤️,Thornsnrose,1580558731.0,4154,i.redd.it,'',ex57vm,0.74,297
"""I can't afford to buy Groceries""...",Jibrish,1587727342.0,4143,i.redd.it,'',g76oix,0.9,161
"Hmmm, interesting...",shamu2000,1582452803.0,4153,v.redd.it,'',f87p3f,0.87,250
FBI finds mail-in ballots discarded in Pennsylvania. All of them were cast for President Trump.,lolSnowy,1600971790.0,4143,breaking911.com,'',iz2pm9,0.63,909
BREAKING: Over 100 Police Agencies Pull Out Of Agreements To Guard DNC Convention,Foubar,1595973979.0,4145,dailywire.com,'',hzo63g,0.58,1473
James wood locked by twitter for naming police officers killed in the line of duty in 2020,blazing420kilk,1591737755.0,4138,twitchy.com,'',gzwjpw,0.81,405
Bruh,WEareINdanger,1590869959.0,4131,i.redd.it,'',gtl0ke,0.74,509
"Well, it's day 117",thatrightwinger,1595076368.0,4124,i.redd.it,'',htg1iy,0.57,870
Trump to designate Antifa and the KKK as terrorist groups.,Derpyykiin,1601067062.0,4133,nypost.com,'',izrrlj,0.9,617
President Trump Quietly Signs Largest Wilderness Preservation Bill in a Decade,,1552740354.0,4125,westernjournal.com,'',b1s2m6,0.78,423
Based woods as always,Velma18,1600894117.0,4120,i.redd.it,'',iyis92,0.8,405
Elon Musk says he plans to move Tesla out of California and sue county after coronavirus restrictions,Foubar,1589053582.0,4107,washingtonexaminer.com,'',ggm81z,0.79,517
State With No Electricity Orders Everyone To Drive Cars That Run On Electricity,knownbuyer3,1600966152.0,4100,babylonbee.com,'',iz0vt9,0.72,603
I’m a liberal and I finally quit r/Politics,pm_me_big_girls14,1588048059.0,4099,self.Conservative,"'I like to think I have an open mind. Even if I don’t agree with right-wing politics, I always find myself coming back to this subreddit to see what’s going on. And aside from the occasional Biden meme (which are funny), there’s a lot of good discussion over here.\n\nI cannot stand r/Politics. The ENTIRE purpose of that place is to bash Trump and to bash conservative thoughts. There’s no unbiased conversation. Hell, there’s hardly any sane liberal conversation.\n\nI may not agree with you guys on politics, but at least you guys can produce rational thoughts. I’m so tired of EVERYTHING boiling down to OrAnGe MaN BaD. \n  \nThank you guys for not sucking, that is all\n\nEdit: Thanks for the support folks. I made this post out of frustration before going to bed, and I wake up to this. I think I had like 300 karma before this post, so that’s cool I suppose.\n\nI still don’t like Trump as both a person and a politician, but at least we can be a bit more honest here and have adult conversations. It’s okay to disagree, politics is a matter of values.\n\nAnd of course, now I’m being attacked by liberals in my DM’s telling me I was never a liberal in the first place. Very classy move liberals, let’s see if it pays off'",g9gj64,0.65,996
Kamala Harris Destroyed,kgs1977,1564627709.0,4096,v.redd.it,'',ckihh9,0.79,775
Democrats Have High Standards,tehForce,1592172577.0,4100,i.redd.it,'',h92w7r,0.67,338
Trump orders stop to 'White privilege' diversity training in federal government,daddysgotya,1599312873.0,4101,m.washingtontimes.com,'',in171i,0.83,456
Breathe,PurpleAngel23,1581620537.0,4097,i.redd.it,'',f3exdm,0.8,210
DOJ Says Allowing Transgender Athletes To Compete Against Females Is ‘Fundamentally Unfair’,guanaco55,1592616262.0,4091,dailycaller.com,'',hcd7cl,0.89,365
Missouri governor says St. Louis couple 'had every right' to wave guns at protesters,One-Son-Of-Liberty,1594816510.0,4089,thehill.com,'',hrmqld,0.71,538
House bill would block Rioters from coronavirus Unemployment benefits,bobbyw24,1598695481.0,4089,foxnews.com,'',iipzz3,0.64,893
Must be a tough balancing act...,randomdudeinFL,1578186673.0,4086,i.redd.it,'',ek5p0o,0.84,385
The greatest troll in the history of mankind would be if...,alc59,1585577064.0,4077,i.imgur.com,'',frrdhk,0.79,171
Media’s Trump Derangement Syndrome summed up in a tweet,Wonder10x,1578605550.0,4079,i.redd.it,'',emgcmm,0.64,382
Steelers' Alejandro Villanueva covers name of police shooting victim on helmet with name of military veteran,Blanzblornch,1600212171.0,4071,cbssports.com,'',itk2nn,0.79,511
"“We’ve done it Patrick, we’ve saved the city”",1TARDIS2RuleThemAll,1590764896.0,4071,i.redd.it,'',gsuojo,0.82,435
Attorneys for Kyle Rittenhouse Prepare Defamation Lawsuit After Joe Biden Accuses Kid of Being White Supremacist in Post Debate Ad,JesusCumelette,1601481436.0,4061,thegatewaypundit.com,'',j2oth1,0.6,993
Google Refuses to Show Negative Search Suggestions About Black Lives Matter,Ziplocking,1598977522.0,4065,breitbart.com,'',iknfwm,0.69,773
Does... not... compute...,-Kerosun-,1591624015.0,4057,i.redd.it,'',gyzmja,0.78,418
President Trump Nominated for a SECOND Nobel Peace Prize by Swedish Lawmaker After Historic Kosova-Serbia Peace Agreement,undue-influence,1599837346.0,4063,thegatewaypundit.com,'',iqsf4h,0.79,592
"Is this a Bigfoot sighting, or a Progressive Leftist?",Sola__Fide,1601739559.0,4066,i.redd.it,'',j4h3nk,0.56,968
Election fund raising,tehForce,1583356963.0,4054,i.redd.it,'',fdk0ff,0.8,186
The ultimate fear of all Red States,optionhome,1567941500.0,4056,i.redd.it,'',d19otp,0.64,581
"Seattle business owners, residents sue city over ‘CHOP’ zone",bobbyw24,1593073310.0,4056,nypost.com,'',hfig8g,0.78,595
Know the Difference,Venus230,1598376262.0,4053,gab.com,'',iggnzb,0.7,441
Coming to a city near you - #walkaway rallies are being planned to counter the blm/marxist/antifa thugs who currently roam the streets.,theslimreaper2,1593717785.0,4055,i.imgur.com,'',hk3hnm,0.87,374
Bernie Tests Negative For President,el-aficionado,1586360654.0,4054,babylonbee.com,'',fx8rof,0.83,232
China should be sued £6.5 Trillion for Coronavirus damages says top conservative U.K. think tank,bananarama_jonesJr,1586132531.0,4052,smh.com.au,'',fvolzi,0.81,429
The creator of Minecraft lol,,1552434183.0,4044,i.redd.it,'',b0ex66,0.73,304
When they say RBG gave women the right to get a business loan with out a male co-signer they leave out that it never went before the Supreme Court and was signed into law by Ronald Reagan.,reasonablemethodist,1600620114.0,4041,thebalancecareers.com,'',iwh8o4,0.82,260
#BelieveSOMEwomen...,Moonthrower,1586616329.0,4047,i.redd.it,'',fz6odg,0.87,233
NBA Hypocrisy,ngoni,1571415381.0,4036,i.redd.it,'',djprt1,0.92,195
Despicable: BLM protesters chant ‘We hope they die’ and block ambulances after 2 LA officers are shot in the head,alc59,1599998415.0,4037,soopermexican.com,'',irx0h2,0.77,789
"Managing director for black lives matter does an AMA on Reddit, is asked multiple times “what BLM does with donated money?”..... she doesn’t answer the question once. Gets shredded for it as AMA turns into a disaster",Wonder10x,1591663707.0,4030,reddit.com,'',gzcdk4,0.74,720
BLM rioter who firebombed cop cars arrested after Apple gave up his iCloud pics,lickmydick609,1600292740.0,4030,mazainside.com,'',iu5jl9,0.87,440
Trump administration formally withdraws US from WHO,jgeorge20,1594145995.0,4035,thehill.com,'',hmzyar,0.76,791
"Florida Governor Pushes Crackdown on Rioting That Would Allow Drivers to Run Over ‘a Mob’ without Liability if that driver is “fleeing for safety from a mob."" DeSantis also declared it a third-degree felony to obstruct traffic during an “unpermitted"" protest",optionhome,1600735361.0,4027,lawandcrime.com,'',ixd5vp,0.69,1221
On This Day - 3/20/1854,SaulStein,1584730003.0,4026,i.redd.it,'',fm0c69,0.75,274
Dana Loesch destroys Alyssa Milano on death penalty,therockbs,1564261813.0,4020,i.redd.it,'',cin066,0.64,512
In the last 24hrs...,whrino,1593629581.0,4014,i.imgur.com,'',hjgh3k,0.79,764
Neutral,tehForce,1559221620.0,4009,i.redd.it,'',busxwg,0.77,235
"Tucker Carlson Advertiser Boycott backfired. He is now No. 1 in cable news advertising. Contrast this reality with the New York Times story of June 18, ""Advertisers Are Fleeing Tucker Carlson.""",optionhome,1599219075.0,4006,donsurber.blogspot.com,'',ime9cb,0.67,755
"Typical bullshit from Politial ""Humor""",Amadodomin,1586713056.0,4004,i.redd.it,'',g011tl,0.81,281
Man who led protest supporting Black Lives Matter arrested on child pornography charges,triggernaut,1594984672.0,4007,washingtonexaminer.com,'',hstwd4,0.74,502
"Alabama Senate votes to prohibit surgeries, puberty blockers for 'gender-confused' youth under 19",,1583800673.0,4003,twitchy.com,'',fg55kq,0.77,590
