These Jewish ladies showing off their white privilege tattoos /s,Wonder10x,1592321464.0,3620,i.redd.it,'',ha67si,0.71,610
Rose McGowan Calls Alyssa Milano A #MeToo Fraud For Supporting Joe Biden After Sexual Assault Allegation,Foubar,1586216367.0,3615,dailywire.com,'',fw9nk2,0.85,254
Backing the Blue: Over 80% of voters believe police deserve 'support and respect',Foubar,1599765159.0,3621,justthenews.com,'',iqa1ol,0.84,327
"Genius ""peaceful protesters"" yell ""Say her name!"" and threaten to kill Rand Paul. The guy who wrote the Breonna Taylor Bill to ban no knock warrants.",DXGypsy,1598658884.0,3611,youtu.be,'',iiiezg,0.8,429
Trudeaus ban on guns is extremely dumb,NeekoPat,1588427528.0,3611,i.redd.it,'',gc6t0z,0.63,776
NFL player covers name of police shooting victim on helmet in favor of Army vet killed in Iraq,JesusCumelette,1600268230.0,3616,theblaze.com,'',itx4fb,0.87,368
CNN is Fake News,CasualNoodle,1589338284.0,3608,i.imgur.com,'',giqf8n,0.79,290
The Virus Is Shooting At Us,troyjiff,1590686025.0,3611,i.redd.it,'',gsab12,0.89,143
The folly of gun control,Sola__Fide,1576502365.0,3609,i.redd.it,'',ebf1g7,0.71,250
I doubt you'll see this on the evening news,Qplus17,1582924515.0,3604,i.redd.it,'',fb1rfk,0.82,301
The modern left in a nutshell,Rational-Thinker,1559006637.0,3603,i.redd.it,'',bttykv,0.71,119
Governor McDreamy Strikes Again,icebawkz,1594822921.0,3597,i.redd.it,'',hrofwl,0.87,158
Pro-cop groups sue Mayor de Blasio for denying Blue Lives Matter mural,BruceCampbell123,1597163573.0,3600,nypost.com,'',i7uybz,0.83,270
Buy One Get One Free,tehForce,1596713715.0,3598,i.redd.it,'',i4q65d,0.84,281
"Harvard goes 100 percent online, still charges $50,000. This better be the beginning of the end of the college racket.",yakkattakk,1594058163.0,3596,nationalreview.com,'',hmcjo8,0.95,340
"Uber Eats’ Policy Favoring Black Businesses Is Illegal Discrimination, Says Law Professor",Foubar,1591884556.0,3594,spectator.org,'',h0zzxn,0.91,276
Justice: served,macmain534,1594091077.0,3594,i.redd.it,'',hmmied,0.88,319
Democrat Doug Jones becomes first Democrat in over 25 years to win an Alabama Senate race.,,1513135483.0,3589,articles.cbpolling.press,'',7jgecd,0.84,1071
Found this gem on a Yahoo article of all places,CSThr0waway123,1571254633.0,3588,i.redd.it,'',diuhxa,0.8,93
Riots destroy new $30M affordable housing project in Minneapolis,NoleFan723,1596028266.0,3593,disrn.com,'',i00g0p,0.85,438
"""You don't need 30 rounds to hunt."" Correct, but the 2nd amendment was not written in case the deer turn against us.",James_Smith1234,1497610345.0,3586,imgoat.com,'',6hlspd,0.57,864
'Y’all don’t come out when a kid gets shot!' — R​esidents of Chicago neighborhood drive out protesters who only come for anti-cop protests,optionhome,1597313182.0,3593,theblaze.com,'',i8x8bk,0.78,440
"The Smart Way to Put China in Its Place -- Don’t ask, “How can we force people to stop doing business in China?” Ask, “What obstacles can we remove to make it easier for people to do business in the U.S.?”",guanaco55,1588717041.0,3592,heritage.org,'',ge7h16,0.91,255
"As a vet, I am infuriated by this. This will be a unifying act, and not in the way Pelosi thinks.",obviousburner42,1592314996.0,3585,i.redd.it,'',ha496k,0.63,1192
Here in about 2 weeks,callmecern,1587489420.0,3586,i.redd.it,'',g5jbu2,0.73,561
Got removed from r/PoliticalHumor because apparently the transgender movement doesn’t apply to US politics. Surprised I wasn’t -155k by the time they removed it.,alphaw0lf212,1551747138.0,3580,i.redd.it,'',axevkn,0.83,308
"Stop hospitals from keeping their prices secret. “I received an EKG, chest X-ray, flu test, urine-pregnancy test and IV fluids. My diagnosis: potential COVID.”",optionhome,1596449819.0,3583,nypost.com,'',i2uild,0.89,373
This guy is obviously not a racist....or even homophobic,optionhome,1564577577.0,3578,speechable.s3.amazonaws.com,'',ck845l,0.73,392
Trump announces government 'must' again seek death penalty for Boston Marathon bomber,billgigs55,1596413630.0,3580,foxnews.com,'',i2mv2k,0.73,1428
Farming...,undue-influence,1592678597.0,3571,i.redd.it,'',hcrg9z,0.74,371
Trump Derangement Syndrome is real!,zihua_,1583165104.0,3575,imgur.com,'',fce7t5,0.77,522
President Trump signs the Farm Bill making dog and cat meat illegal in the United States,SuperCharged2000,1545830745.0,3568,wrdw.com,'',a9ojir,0.79,491
What does a CNN pre debate planning meeting look like?,optionhome,1571399821.0,3577,i.redd.it,'',djmflv,0.72,440
Democratic race in a nutshell,foodieondiet2019,1586748297.0,3570,i.redd.it,'',g0axoa,0.92,40
Michigan State Official arrested on charges of election fraud,Silverblade5,1572275687.0,3567,i.redd.it,'',doa71z,0.82,220
A Simple Guide,thatrightwinger,1562322176.0,3566,i.imgur.com,'',c9eduz,0.74,128
"Yes, minorities can be conservative",steamboat90,1576878515.0,3575,i.redd.it,'',edgm2u,0.76,308
Miracles happen: Chicago PD arrests woman who live-streamed herself looting stores (video),nobody65,1597877331.0,3569,hotair.com,'',icychy,0.9,203
Herschel Walker offers to send people who want to defund police to countries without them,HOMEBONERismyname,1592443689.0,3563,foxnews.com,'',hb4vo8,0.82,304
BLM,Foubar,1594650394.0,3566,i.redd.it,'',hqg6vd,0.86,282
For those who still don't understand how the MSM is the Ministry of Propaganda for the DNC,optionhome,1587044504.0,3565,imgur.com,'',g2f3xe,0.84,328
The best satire contains at least a grain of truth.,IBiteYou,1595805840.0,3567,i.redd.it,'',hyh3m1,0.8,461
#dyingwish,GreenTeaKitKat27,1600900587.0,3566,i.redd.it,'',iykw96,0.61,924
Mark makes a good point here,Beanconscriptog,1589040108.0,3558,i.redd.it,'',gghxyl,0.6,1078
Do you want to have 4 years of this? I don't.,SillyToni,1593876443.0,3554,i.redd.it,'',hl53gs,0.89,232
Black ESPN host tears into NBA star who targeted white player with racial slur: 'B**** a** white boy',billgigs55,1598211153.0,3553,theblaze.com,'',if9jzt,0.87,411
CNN is Fake News,Ch33mazrer,1588087827.0,3551,i.redd.it,'',g9paq6,0.89,216
"Imagine watching a televised funeral with hundreds in attendance after being told YOU CAN’T go to the funeral of someone in your own family, you can’t go to church, you can’t go to your kids graduation, etc.... imagine watching it and still not realizing you’re being played.",,1591791272.0,3548,twitter.com,'',h09or1,0.72,507
Satire: Motorcyclist Who Identifies As Bicyclist Sets Cycling World Record,DocRudy,1598630208.0,3544,babylonbee.com,'',ii9nt5,0.89,141
Successful People,optionhome,1581167310.0,3543,i.redd.it,'',f0rcxx,0.73,275
"ISIS Lays Down Arms After Katy Perry's Impassioned Plea To 'Like, Just Co-Exist'",bearwave,1495713695.0,3541,babylonbee.com,'',6d95u1,0.59,345
"Liberal here, want to apologize for my side",asijasd,1478873796.0,3537,self.Conservative,"'EDIT: OK, the title was incorrect\nI called myself a liberal. That is true, but I guess I should correct that to ""somewhat left of centre, but not very far out"". I guess I should just stick with ""these are my ideas. I have agreed with the Liberal party of Canada for most of my life, hence I call myself a liberal"". \n\n  I made this post because, as much as I disagree with the conservative ideology, I don\'t hate conservative people. And I want to show that the perception that no liberal can maintain a civilized ideological disagreement while not bashing the people who disagree with them is wrong. I do not mean to force my views on you.\n\n1) I want to apologize for the SJWs. I disagree with their ideology entirely, and hope to keep it out of the Canadian government.\n\n2) I do still disagree with many conservative points, but I don\'t hate conservatives as people. So this post doesn\'t mean that I am now a conservative - rather, it means that I am disillusioned with what ""liberal"" means today.\n\n3) I hope that, even though we disagree on many topics, we can come together as a common people.\n\n I will not lie - I had initially hoped for a Hillary presidency. As time went on, however, I decided that I liked neither candidate. But I am going to wait and see what Trump does, instead of immediately denouncing him.\n\nWhat I am for\n---------------\n1) Equal rights for all, regardless of skin colour, race, religion, etc.\n\n2) Freedom of speech. Even speech which I don\'t like.\n\n3) Peaceful protest.\n\n4) Freedom of religion. But subject to restrictions to maintain human rights. Eg. I don\'t care if you choose to wear a cross or a bindi or a yamuka or etc. out of choice, because of your religion. But I don\'t think that any religion\'s values should be forced on nonbelievers.\n\nWhat I am against\n--------------------\n1) Division into groups. Everyone should have equal rights. And while I think everyone should be able to be proud of their heritage, I think that, as with many other things, there is an acceptable limit. I.e., you shouldn\'t go around saying you are better than everyone else because of your heritage.\n\n2) Separation and echo chambers. I have to admit, I was guilty of this. I am now trying to make amends. I think that this has happened on both sides. \n\n3) Forcing your views on others.\n\nI don\'t know what ""liberal"" and ""conservative"" will mean in the future. I just want to apologize for SJWs and say that, even though we may disagree ideologically, I hope that we can work together in the future.\n\nI understand that you will disagree with some, or even all, of what I said. I think that\'s fine. Disagreement is healthy for discourse, and as long as it remains civil, I have no problem with it.\n\nI apologize if this comes across as posting in a sub where I shouldn\'t post. But I wanted to step out of the echo chamber.\n\nEDIT: Some rebuttals: \n\n1) No, I am not and never will be a conservative. I don\'t mind conservative people, but I am not a conservative. I am for a fully secular government, I want more liberal economic policies such as stimulus packages, etc. \n\n2) I do not mean to say that I disagree with all of the left. I was concerned that the protestors would make me look bad. I simply wanted to point out that I do not condone violence. Peaceful protest is perfectly acceptable. \n\n3) As my friends have pointed out to me, the electoral college exists for a reason. While I am sad that Hillary lost (although TBH, even though I preferred her to Trump, I was beginning to be unsure), I don\'t want to get involved in contesting a presidential victory. \n\n4) I do not want a fully liberal or a fully conservative government. I want a coalition or a centrist government, to prevent extremists on either side from setting policy. \n\n5) I acknowledge that by listening to only a few news sources, I was not being open minded. But I think that people on both sides were doing this. \n\n6) I support choice. I want people to have the freedom to do whatever they want, with reasonable limits. You and I disagree on the definiton of ""reasonable"", as shown by some comments below. This includes abortion. Disagreement is fine, but I strongly value this. \n\n7) As others have pointed out, I cannot claim to speak for all liberals. That was a mistake.\n\nSo no, I am not, and will never will be a conservative. I know that many of you will disagree with this, which as I said earlier, is perfectly fine. That was the main point of this post, one that got lost among my inept writing. '",5ceoir,0.62,627
NOW more than ever,THEPOSTMANFROMTX,1591732404.0,3538,i.imgur.com,'',gzunb1,0.67,518
Double standards,killerinthesky,1563921125.0,3542,i.redd.it,'',cgzk9o,0.82,164
Bernie teaching the younger generation,,1568725113.0,3539,i.redd.it,'',d5gm1v,0.74,202
"Lawyers who targeted NYPD with Molotov cocktails hit with new federal charges, face life in prison",ProudAmerican_MO,1592127722.0,3536,theblaze.com,'',h8qu6y,0.79,348
California Trail,PurpleAngel23,1597941371.0,3536,i.redd.it,'',iddozj,0.83,321
I Looked Up Every Case Of An Unarmed Black Man Shot By Cops In 2019. Here’s The Truth The Media And BLM Are Hiding.,deathwheel,1595624518.0,3529,dailywire.com,'',hxa0wd,0.81,499
American College of Pediatrics reaches decision: Transgenderism of children is child abuse,Venus230,1574203202.0,3535,frontlinesnews.com,'',dys70t,0.78,295
"Black Baltimore Republican's campaign ad savages Dems for mistreating black residents, shows unseen side of city. In less than 12 hours it gets millions of views.",alc59,1597758559.0,3539,theblaze.com,'',ic1by2,0.88,271
"This is vandalism, but this isn't?",Qplus17,1595422227.0,3530,i.redd.it,'',hvt7dy,0.57,1246
Funny how that works.,1TARDIS2RuleThemAll,1588974657.0,3527,i.redd.it,'',gg2ifx,0.63,564
Man Who Has Been In Government For Nearly 50 Years Promises To Fix Government,Metaljoetx,1597973801.0,3521,babylonbee.com,'',idnhu5,0.62,702
Joe Rogan says some celebrities too wrapped up in progressive ideology to see how 'dumb' they look,StarFuryG7,1592874302.0,3515,foxnews.com,'',he4w97,0.81,520
"""off topic"". more like ""Against the porpoganda narrative",Efficient-Football,1584213659.0,3522,imgur.com,'',finuf3,0.83,232
"Chicago prosecutor Kim Foxx dismissed over 25k felony cases - including murders, shootings, sexual assaults and Jussie Smollett's 'hoax' attack",undue-influence,1597088473.0,3521,dailymail.co.uk,'',i7bxtu,0.9,223
Tulsi Gabbard: 'Can You Imagine if Google's CEO Was a Conservative Republican Shutting Down Democrat Voices?',bearwave,1569327553.0,3511,thegatewaypundit.com,'',d8mcqe,0.68,723
how its designed!,jgriner,1553631976.0,3519,v.redd.it,'',b5user,0.8,253
'Mandalorian' Star Gina Carano Fires Back at BLM 'Cowards and Bullies' Smearing Their Critics as Racists,Winterhold2000,1596833112.0,3504,breitbart.com,'',i5lr3k,0.78,397
"Black Lives Matter Managing Director Roasted for Dodging Questions on Finances, Antisemitism",,1591826502.0,3506,breitbart.com,'',h0ldko,0.82,374
A firework almost killed me last year,TheOneTrueNeb,1593901578.0,3510,i.redd.it,'',hlbz18,0.91,207
"'Trump Might Not Accept The Results Of The 2020 Election,' Says Movement That Still Hasn't Accepted Results Of 2016 Election",Foubar,1595646087.0,3511,babylonbee.com,'',hxfjnf,0.64,716
"Former Princeton prof: BLM doesn't help black people, Dems using it to win votes -- ""Part of the cultural Marxist agenda against America.""",guanaco55,1598229971.0,3502,wnd.com,'',iff0dn,0.84,155
Women Harassed for Cleaning Black Lives Matter Vandalism Off Department of Veterans Affairs. They explained that they’re just trying to clean the building. “Not a great way to use your white privilege ladies.” “That’s disgusting.”,optionhome,1591274021.0,3502,districtherald.com,'',gwgl47,0.65,678
2020 is going to have a great start and an even greater finish.,PlymouthSock,1577030449.0,3504,i.redd.it,'',ee6fsl,0.85,147
"""I Hope He Dies"" - Former Obama Staffer and Hillary Clinton Spokeswoman Tweets Out a Death Wish for President Trump",JesusCumelette,1601649365.0,3498,thegatewaypundit.com,'',j3vm7h,0.8,553
"Kamala Harris’ father: ""She's playing identity politics. We wish to categorically dissociate ourselves from this travesty.""",SwampMidget,1597249306.0,3502,nypost.com,'',i8gr6t,0.9,206
What happens?,Clatsop,1579693205.0,3506,i.redd.it,'',esarcy,0.71,220
"‘F**K OFF’: Ricky Gervais Blasts Hollywood For Lecturing World, Politicizing Everything, Trolls Them Over Epstein",Spinnak3r,1578277386.0,3506,dailywire.com,'',ekn9ln,0.85,351
Chazistan has fallen! At least 13 arrested as Seattle police return to the East Precinct Wednesday morning,Foubar,1593610810.0,3505,king5.com,'',hjad3u,0.85,346
Democrats and MSM come up with new Magic Trick,optionhome,1588689317.0,3501,imgur.com,'',gdyuj2,0.95,83
Last choice,doubtfulshins,1586980272.0,3499,i.redd.it,'',g1zbrj,0.92,36
"Jim Jeffries and Comedy Central try to make Avi Yemini look like a racist by editing his interview. Avi Yemini secretly recorded the entire interview, which exposes Jim and Comedy Central as liars.",Fabalous,1553192134.0,3507,youtube.com,'',b3txoj,0.9,232
There is an important difference ...,Clatsop,1502802548.0,3499,i.imgur.com,'',6ttzg0,0.5,949
Why we have the electoral college,Brian1220,1576089901.0,3498,i.imgur.com,'',e9b623,0.76,227
They’re not even trying to be shy about their left wing motivations anymore.,Wonder10x,1594174112.0,3495,i.redd.it,'',hn8bvb,0.65,603
Lets be extra clear,alc59,1586275962.0,3494,i.imgur.com,'',fwn8ih,0.77,253
Pope Francis: It’s ‘terrible’ children taught they can choose gender,,1502112736.0,3489,catholicherald.co.uk,'',6s5j3b,0.73,572
"We have changed, and not for the better...",IBiteYou,1599854883.0,3487,i.redd.it,'',iqy7sv,0.59,732
Does anyone else think this new feature for Google Maps is blatantly racist and sexist? You can promote your business as female/black owned but there are no options for males or any other races.,indiegameplus,1596334746.0,3490,theverge.com,'',i24iux,0.72,763
Imagine,PurpleAngel23,1588693675.0,3486,i.redd.it,'',ge06ao,0.74,351
Shame on Yang?,patron_vectras,1565921613.0,3488,i.redd.it,'',cqzuww,0.86,485
"Just some redneck wearing a shirt that said ""the future is white"" and a gop senator smiling with him. Oh wait",madamechowder,1580728421.0,3479,imgur.com,'',ey5nfk,0.78,253
Trump Will Not Denounce Armed Americans Acting If Police Stand Down -- Defending your property with a gun if needed is as American as apple pie. Donald Trump will not denounce it.,guanaco55,1598966087.0,3483,thefederalist.com,'',ikk110,0.65,1342
AOC Suggests NYC crime surge due to residents needing to 'shoplift some bread' amid unemployment,thenetwrkguy,1594614043.0,3483,preview.redd.it,'',hq8ocp,0.93,262
"Two officers were shot and killed in my hometown yesterday after knocking on suspects door for a domestic disturbance call, one of the men’s daughter posted about it on Twitter and was attacked by BLM supporters who disregarded her dad’s death. My stomach feels sick.",cordeliacat__123,1594591671.0,3483,facebook.com,'',hq34aj,0.93,360
Nick Sandmann's Lawyer L. Lin Wood Offers to Represent 17-Year-Old Kenosha Shooter Pro Bono,optionhome,1598553082.0,3484,amgreatness.com,'',ihqkgm,0.74,1151
"President Trump Announces Creation of ""1776 Commission"" to Promote the Teaching of Patriotic History",Clatsop,1600425285.0,3483,redstate.com,'',iv3nc1,0.76,416
Biden Picked a Running Mate!!!!!,tehForce,1596821765.0,3483,i.redd.it,'',i5i721,0.58,643
"J.K. Rowling Doubles Down On Transgenderism: It Hurts Women -- We who have picked this hill to die on, who have chosen to speak out for the rights of women, girls, and boys who end up suckered into this fantasy that biological sex is mutable, salute Rowling.",guanaco55,1591807970.0,3482,thefederalist.com,'',h0eswk,0.63,791
"UK: Woke 'cancel culture' is a form of bullying and 'no platforming' an attack on free speech, pupils will be taught",pkarlmann,1601205262.0,3477,dailymail.co.uk,'',j0pf4d,0.66,509
Afro-Cuban Leader of the Proud Boys,CherryCokeNixon,1601484058.0,3483,i.redd.it,'',j2pobt,0.63,911
The Hypocrisy never ends in the main steam media,optionhome,1598702263.0,3478,imgur.com,'',iir6sz,0.83,471
"Former Ohio State professor arrested trying to flee to China with stolen laptops, USB drives",Expensive_Pop,1595165690.0,3478,thecollegefix.com,'',hu0kni,0.92,327
"Adam Schiff: If Trump wins, I’ll leave America",alc59,1593782245.0,3474,thehornnews.com,'',hkivxc,0.86,784
"Study Finds Easily Offended People Make Terrible Employees. Easily triggered people are less productive, are prone to view their organizations as “less fair,” and “consume a lot of time complaining about trivial matters.“ They also make terrible team players.",optionhome,1593983051.0,3479,headlinewealth.com,'',hlu71x,0.85,443
Kenosha shooting's suspect Kyle Rittenhouse receives $50G donation from gun rights group,,1600439032.0,3463,foxnews.com,'',iv70ho,0.71,1202
"What, you're telling me I can't go around throwing explosives and burning down Federal buildings? FASCISM!!!11!!!1",Luftwafflez4Brekfast,1596063058.0,3463,i.redd.it,'',i0akxv,0.8,190
Macy's says black man who punched white employee was 'unprovoked',JohnKimble111,1592759564.0,3477,washingtonexaminer.com,'',hdaipk,0.74,634
"""Some White People May Have to Die for Black Communities to Be Made Whole"" - Far Left UGA Teaching Assistant",scrubking,1592749273.0,3466,thegatewaypundit.com,'',hd7pbh,0.75,503
Portland Rioters Attempt to Murder Man Who Intervened In Their Robbery and Assault of a White Trans Person,LawVol99,1597657836.0,3461,districtherald.com,'',ibb65f,0.73,730
Jussie Smollett's bid to get charges thrown out rejected by Illinois Supreme Court,AntonPercivalVIIII,1583619611.0,3465,foxnews.com,'',ff2m7u,0.89,243
Believe in something. Even if it offends Colin Kaepernick,Roosterdude23,1562159909.0,3468,scontent-iad3-1.xx.fbcdn.net,'',c8nzrj,0.66,354
Video: BLM mob beats white driver unconscious,Horace_Mump,1597670174.0,3465,nypost.com,'',ibdxxh,0.83,693
Every time a public figure wants to take away the gun you have for your own protection...think of this,optionhome,1572786336.0,3469,i.imgur.com,'',dr04lu,0.68,419
Kenosha Store Owner Sobs While Watching Her 35-Year Business Burn After Rioters Set Blaze,DanAdamsShow,1598872029.0,3461,mrctv.org,'',ijvzan,0.82,507
Security vs Freedom,tehForce,1590058976.0,3470,i.redd.it,'',gnut6m,0.74,385
I guess he forgot,Clatsop,1568977461.0,3460,i.redd.it,'',d6t9x4,0.81,127
No Place For Racists! White Supremacists FORCED OUT Of A Rally by TRUMP SUPPORTERS and PROUD BOYS (Video) - Conservative US,ProudAmerican_MO,1601564578.0,3466,conservativeus.com,'',j3a9fq,0.82,625
Scott Walker To Kamala: You Visited Jacob Blake. How About Visiting Ambushed LA Deputies In Your Own State.,optionhome,1600094644.0,3460,dailywire.com,'',ism740,0.89,249
Dr. Fauci testifies that Trump’s Travel Ban saved lives,nptown,1596225746.0,3454,m.youtube.com,'',i1egg6,0.84,432
"Germany’s largest paper to China's president: You're endangering the world - ""You [Jinping], your government and your scientists had to know long ago that coronavirus is highly infectious, but you left the world in the dark about it.""",Foubar,1587255481.0,3447,jpost.com,'',g3y3z9,0.93,230
"Droney McPeaceprize, hahaha",randomdudeinFL,1578257486.0,3447,i.redd.it,'',ekiwuy,0.76,244
"When ""moving the goalposts"" is your party's platform",-Kerosun-,1589580474.0,3448,i.redd.it,'',gkiman,0.62,944
"Councilman Mike Bonin who voted to cut the city’s police budget by $150 million “called LAPD to his home 8 times since 4/4/20, including to provide extra patrols and protection from peaceful protesters at his house”",optionhome,1597055336.0,3450,breitbart.com,'',i72cin,0.77,503
There is nothing new under the sun,atacr416,1569949554.0,3446,i.redd.it,'',dbween,0.75,241
Thomas Sowell Shares Some Wisdom,GuitarWizard90,1592393050.0,3439,i.redd.it,'',hapb5a,0.88,318
"""The Gov't Should Run Healthcare"" Or...",irishmafiawku,1583256363.0,3440,imgur.com,'',fcxzin,0.85,190
The Train Wreck,ChunkyArsenio,1599122692.0,3445,reviewjournal.com,'',ilprma,0.67,532
Biden 2020,ultimatefighting,1588024374.0,3451,i.imgur.com,'',g9abro,0.8,206
Professor placed on leave after saying in class she hopes Trump supporters 'die before the election',tabbykat69,1600448129.0,3439,campusreform.org,'',iv9vfh,0.89,399
Think on That,PurpleAngel23,1596983528.0,3439,i.redd.it,'',i6ka5s,0.57,1036
They really went off the rails.,JeskaiMage,1575920893.0,3434,i.redd.it,'',e8exra,0.81,111
Debunking the lies about illegal immigration detention centers,PCmustDie,1562696369.0,3443,v.redd.it,'',cb4mt8,0.75,323
Here’s Why Joe Rogan Would Be An Excellent Debate Moderator -- Joe Rogan authentically represents an informed but perpetually curious everyman better than any interlocutor in the media.,guanaco55,1600191456.0,3437,thefederalist.com,'',itdkn1,0.89,267
They want to reduce the voting age to 16 for a reason.,EricRavenCZ75,1582929857.0,3432,i.redd.it,'',fb30m5,0.8,340
Burn,inFAM1S,1564880974.0,3426,i.redd.it,'',clqfpo,0.89,148
"Ben Carson: Society Needs To ""Grow Up"" And Stop Being Offended By Everything. It really gets to a point of being ridiculous after a while. And, you know, we’re going to have to grow up as a society.",optionhome,1592165942.0,3426,realclearpolitics.com,'',h90x17,0.76,397
"After Slamming Trump for Not Doing Enough, Pelosi Deletes Video of Herself Encouraging People to Visit Chinatown",Foubar,1587302794.0,3427,amgreatness.com,'',g47mwl,0.78,273
Tucker Carlson Is Most-Watched Host In Cable News For Last Week,Qplus17,1592393824.0,3426,forbes.com,'',haph6p,0.65,627
"Bill Clinton, 1996: 'The Public Has a Right to Know the Condition of the President's Health.'",propshaft,1473673127.0,3427,nationalreview.com,'',52dj18,0.84,124
Sounds like something George would do.,Noremacam,1568493692.0,3415,i.redd.it,'',d4apyt,0.76,213
The Torch Has Been Passed,thatrightwinger,1593875722.0,3415,i.redd.it,'',hl4wqo,0.81,204
Tom Sowell on a growing class of parasites,optionhome,1581952962.0,3414,i.redd.it,'',f5a7wa,0.78,237
Kyle Rittenhouse To Sue Biden Over 'White Supremacists' Campaign Ad,SaulStein,1601503122.0,3414,zerohedge.com,'',j2vogz,0.61,879
EVERY NBA MILLIONAIRE Knelt for the National Anthem at Season Opener — EVERY SINGLE NHL HOCKEY Player Stood for Anthem at Opener,MakeAmerica80sAgain,1596203526.0,3410,thegatewaypundit.com,'',i17uxj,0.87,759
Using Stats for Politics,optionhome,1586710068.0,3415,imgur.com,'',g004d0,0.91,352
"Mother of Jacob Blake unloads on violent rioters, apologizes to President Trump on CNN",FlyingAmbassador,1598461027.0,3407,theblaze.com,'',ih2m3l,0.86,350
Castle Doctrine. But I’m the bad guy for explaining why this is important...,kidwrx,1598759412.0,3409,i.redd.it,'',ij6c91,0.59,1800
