"BREAKING: Washington Post to pay Covington student Nick Sandmann after $250 million lawsuit - The Post Millennial - News, Politics, Culture, and Lifestyle",,1595604368.0,5554,thepostmillennial.com,'',hx3qxv,0.66,961
"""False Information""",Jibrish,1590145567.0,5546,i.redd.it,'',gohc74,0.74,504
Jedi Mind Tricks to win 2020!,joeyt214,1599177539.0,5528,i.redd.it,'',im58x6,0.59,870
Apparently,10gauge,1478961466.0,5515,i.imgur.com,'',5ckmys,0.5,903
Antifa will be a designated Terrorist Group,gsfilmer,1590942582.0,5515,i.redd.it,'',gu22hz,0.56,1281
"For Thee, But Not For Me",PurpleAngel23,1581526575.0,5502,i.redd.it,'',f2u732,0.7,388
Wouldn’t be surprised if CNN retweeted this,macmain534,1590535078.0,5500,i.redd.it,'',gr80ho,0.71,420
Japan not taking in refugees; says it must look after its citizens first,IIRC,1486293595.0,5474,foxnews.com,'',5s6x3x,0.64,1066
We don't get a lot of love,Penguinwithaknife,1587691269.0,5466,i.redd.it,'',g6z95l,0.66,409
I am once again...,Jibrish,1586364630.0,5444,imgur.com,'',fxa0w1,0.78,289
Greta the expert.,christianskak,1591960423.0,5425,i.redd.it,'',h7isrt,0.66,633
Supreme court rules 7-2 that the trump administration’s ‘expedited removal’ of unauthorized immigrants is constitutional,Lionhearted09,1593099151.0,5419,wsj.com,'',hfo4qr,0.78,588
Professor who threatened to fail student for not trashing Trump has been removed from teaching,Foubar,1601010241.0,5413,thecollegefix.com,'',izdhew,0.81,329
GoFundMe Blocks Candace Owens From Fundraising for Conservative Business that was Destroyed During the Riots,Samantha8669,1591538022.0,5409,starpolitical.com,'',gycsbl,0.61,1410
Hit the nail on the head,NineteenEighty9,1590236308.0,5395,i.redd.it,'',gp3yoq,0.9,355
78% percent of Americans said they’d be willing to pay more for products if they are not made in China,bobbyw24,1589967576.0,5397,bloomberg.com,'',gn8dvd,0.92,296
Sounds Credible...,ultimis,1599322110.0,5384,i.redd.it,'',in3pqz,0.7,376
Kowtowing to China...,Clatsop,1586516959.0,5359,i.imgflip.com,'',fydzei,0.77,171
#BearWithBiden,FarsideSC,1598895699.0,5352,i.redd.it,'',ik2naa,0.79,284
Most Qualified VP in history,TheFundamentalFlaw,1597245321.0,5354,i.redd.it,'',i8fj3y,0.68,894
"Elon Musk responds to Robert Reich calling him a modern-day robber baron: ""All Tesla workers also get stock, so their compensation increased proportionately. You are a modern day moron.""",Winterhold2000,1599758710.0,5335,twitchy.com,'',iq7v03,0.73,814
Gropin' Joe finally got that endorsement from Obama,IBiteYou,1586896953.0,5339,i.redd.it,'',g1dgh9,0.75,296
Best Billboard Ad of 2020?,SCtheWizard,1600918994.0,5332,i.redd.it,'',iyppi5,0.74,495
Ben Carson defends Terry Crews' Black Lives Matter critique: 'We are putting everything in context of color',BudrickBundy,1594207194.0,5329,foxnews.com,'',hnf9q1,0.75,444
Gervais: 'People Will Call You Hitler if You're Mildly Conservative on Twitter',Foubar,1594563759.0,5324,breitbart.com,'',hpv5la,0.71,534
In Elon we Trust,jackthepizzaman,1590067369.0,5323,i.redd.it,'',gnwrey,0.78,395
"Jordon Peterson explains dealing with the ""Mob""",optionhome,1594383689.0,5314,imgur.com,'',honym0,0.63,754
/socialism bans people for being white. They're not even trying to be subtle anymore,swiet,1556575264.0,5306,i.redd.it,'',bivdii,0.69,633
Seriously? Come on Media!,SCtheWizard,1588519975.0,5306,i.redd.it,'',gcsiya,0.8,352
"California Black Lives Matter Leader Charged with Five Felonies, Faces 15 Years in Prison",huckingfoes,1597258075.0,5309,thegatewaypundit.com,'',i8jk4z,0.82,396
Remember that other time?,tehForce,1597400510.0,5301,i.redd.it,'',i9jg5l,0.81,524
Handy Chart for determining if a White Person is Really racist,optionhome,1593995688.0,5287,imgur.com,'',hlxn8k,0.84,275
So have y'all heard?,79camaroZ28,1586813981.0,5271,i.redd.it,'',g0s9j3,0.72,360
Trump awards Medal of Honor to military hero who freed more than 75 hostages in Iraq,Drunken_Priest,1599857438.0,5274,foxnews.com,'',iqz0m5,0.84,266
Trump Tells RNC Attendees To Look Under Their Seats For A Free MyPillow And Can Of Goya Beans,ngoni,1598406719.0,5253,babylonbee.com,'',igpxrz,0.84,305
Forcing your kids to wear something against their will to combat gender stereotypes...,PureOkra1,1572525940.0,5258,i.redd.it,'',dpn0l8,0.8,336
Where’s the lie though?,NConservative919,1583699942.0,5253,i.redd.it,'',ffiq4o,0.6,636
"Trump Says He’s Blocking Increased Post Office Funding to Stop Universal Mail-In Voting: “They want $3.5 billion dollars for something that will turn out to be fraudulent, election money basically … the mail-in votes, okay, universal mail-in ballots.”",guanaco55,1597336857.0,5256,nationalreview.com,'',i93bgj,0.77,1478
This man is a national treasure,Wonder10x,1591028520.0,5236,i.redd.it,'',gunki4,0.71,406
What did you think would happen - Open Letter to Bill De Blasio et al,undue-influence,1595105507.0,5232,i.redd.it,'',htny83,0.72,452
I believe the Huffington Post may be a Trump supporter...,Zypton,1575045313.0,5228,i.redd.it,'',e3gzyw,0.83,237
"So anyway, I started blasting",sorrysalesman,1591366406.0,5230,i.redd.it,'',gx5c6w,0.9,317
All hail Marxism,Forensicoptions,1571593038.0,5217,i.redd.it,'',dkmtq4,0.78,162
"Black (21F) here, just wanted to send a virtual hug to you all on this sub.",throwitallawaydude_1,1591116557.0,5221,self.Conservative,"'I don’t really even know where to start... But everything that is going on, it’s too much and overwhelming. I’m being called a racist and a traitor by my family constantly because I think everyone rioting/protesting/looting, etc. is acting off of emotions, what happens when you act off of emotion? You do stupid shit.. and I think blaming ALL white people and ALL cops for the death of a black man is utter bullshit. The difference it would make if people started thinking logically, would be beautiful.. \nSending hugs to the good cops, first responders, and everyone else out there affected by everything going on.. I hope someday black people will realize that this is just a setup to keep them from ever advancing in life and having a ‘victim mindset’...\n\n\nEDIT; I took a short nap after posting this and woke up feeling so much love after seeing all of the sweet comments and all of the awards. Thank you guys, so much for sending so much love during such a dark time and helping me feel less alone when my own family is pretty much disowning me. ❤️'",gvavuh,0.62,980
"Justice Department finds Yale biased against Asian, white applicants",zroxx2,1597351554.0,5213,nhregister.com,'',i97xig,0.84,563
Fixed it!,Jibrish,1594724607.0,5205,imgur.com,'',hqzh5t,0.8,297
Leftist logic on full display,Wonder10x,1597250208.0,5190,i.redd.it,'',i8h1hq,0.6,1167
And the winner is... Terry Crews,Clatsop,1595030695.0,5189,self.Conservative,"""**[The community has voted](https://www.reddit.com/r/Conservative/comments/hozr4o/its_time_for_our_community_choice_contest_who/)** and Terry Crews shall grace the sidebar position of honor for the next week. Special thanks to **/u/gt4674b** for the winning submission.  \n\nOn behalf of the mod team, thanks to everyone who contributed and voted. We were impressed by all of the outstanding suggestions and will be using several of them in the future.  \n\nWe have these 'Community Vote' sidebar selections every few months, so you will get another chance.\n\n***** \n\n#Terry Crews\n\n>**Are all white people bad?**\n\n>**No.**\n\n>**Are all black people good?**\n\n>**No.**\n\n>**Knowing this reality- I stand on my decision to unite with good people, no matter the race, creed or ideology.**\n\n>**Given the number of threats against this decision-**\n\n>**I also decide to die on this hill.**""",ht6yma,0.83,134
"North Korean defector ‘shocked’ by kindness, racial diversity of US",knownbuyer3,1596199439.0,5154,foxnews.com,'',i16v71,0.75,608
Reddit right now.,IdkWhatIwant895,1586364709.0,5153,i.redd.it,'',fxa1pe,0.63,782
Video of Biden touching girls removed by Twitter as 'child sexual exploitation' -- Scenes of Democratic nominee violate policy,guanaco55,1600127975.0,5136,wnd.com,'',isxbxn,0.74,555
Just Respect,undue-influence,1593474206.0,5147,i.redd.it,'',hibr28,0.74,297
"Tulsi Gabbard is positioning herself as the last sane Democrat: ""Banning ballot harvesting is not a partisan issue. It's been used and abused in states like North Carolina and California, and is ripe for fraud. That's why I introduced the Election Fraud Prevention Act with Republican Rodney Davis.""",tabbykat69,1600693910.0,5135,americanthinker.com,'',ix04yq,0.74,569
"South Dakota Republicans introduce bill banning puberty blockers, transgender surgeries on minors",thatrightwinger,1579470326.0,5132,disrn.com,'',er2v7p,0.79,456
"Bernell Trammell, Trump Supporter was gunned down a few hours after doing a Pro-Trump video",Clatsop,1595715461.0,5116,i.imgflip.com,'',hxve68,0.78,271
He’s got a point you know...,LastExit95,1585958713.0,5108,i.redd.it,'',fujkay,0.74,375
Biden,TheCousinOliver,1587816323.0,5100,i.redd.it,'',g7sfkh,0.79,246
Democrats are all hypocrytes,winklord,1591121398.0,5086,preview.redd.it,'',gvcg8l,0.68,867
Yes you do Joe. Yes. You do.,tehForce,1586545624.0,5084,i.redd.it,'',fymd8y,0.86,130
"Nearly 3 in 4 US adults say social media companies have too much power, influence in politics",tenshon,1595464113.0,5088,thehill.com,'',hw5pjy,0.94,246
"When we say that the media race-baits and doesn't report fairly, this is what we mean.",IBiteYou,1597709458.0,5081,i.redd.it,'',ibq9pg,0.57,962
"Trump supporter or not, conservative or liberal you must admit this is some top tier hypocrisy",InvincibleV,1591789926.0,5085,i.redd.it,'',h09cv2,0.59,1389
Ben tells it like it is.,nautical_nigel,1597236816.0,5063,i.redd.it,'',i8d7aw,0.56,1187
Biden getting ready for a piblic appearance,PuddleJumper1021,1599044011.0,5059,j.gifs.com,'',il4l5e,0.79,246
Trump Bans U.S. Government From Doing Business With Those Who Promote Critical Race Theory,Winterhold2000,1600817946.0,5055,dailywire.com,'',ixz08w,0.63,1452
California “High Capacity Magazine” ban struck down as violation of 2nd Amendment,walter_r_kovacs,1597426125.0,5064,apnews.com,'',i9qaaj,0.84,466
"Thanks NBC, im glad we cleared that up..",ultimate_poster,1476069106.0,5056,i.reddituploads.com,'',56pycg,0.82,250
The Leftist Guide to Racism,Yosoff,1506780837.0,5054,i.imgur.com,'',73f448,0.51,531
"Liberals To Remove Rodin's ""The Thinker"" Statue - Offensive to Their Way of Life",SillyToni,1592146475.0,5048,cdn.britannica.com,'',h8v8c3,0.7,381
"Father of 19-year-old killed in CHOP says he got condolence call from President Trump, but not Seattle&amp;#x27;s mayor",ASB76,1593780639.0,5032,q13fox.com,'',hkihrq,0.63,749
Tuesday: Chris Cuomo mocks Republicans for claiming that crime is rising in American cities claiming that they are just trying to scare people into voting for Trump. Wednesday: Chris Cuomo claims crime is rising and criticizes Trump for inaction.,Winterhold2000,1594405817.0,5034,foxnews.com,'',houbcn,0.78,359
Atta boy Joey B!!,EnzoGorlami42,1590075430.0,5028,i.redd.it,'',gnz313,0.89,129
DNC reveals Presidential Election Campaign strategy patterned after Hillary's campaign but with a significant addition,optionhome,1584578563.0,5016,media.thedonald.win,'',fl0pkh,0.84,145
The only asian left,,1581716858.0,5014,i.redd.it,'',f3ze0d,0.69,299
The New York Times is like a self-parody that keeps delivering,Sola__Fide,1598566720.0,4987,i.redd.it,'',ihuw0d,0.61,983
ironic,Firetesticles,1594727945.0,4991,i.redd.it,'',hr067x,0.88,295
Its actually Socialism.,hallah_sausage,1564882702.0,4986,i.redd.it,'',clqpxy,0.7,333
Ideology comes in contact with reality,Wonder10x,1591049682.0,4986,i.redd.it,'',guucjb,0.72,632
"New York Times paid $0 federal taxes in 2017, despite earning $111 million that year.",-mylankovic-,1601774251.0,4976,newsroom.fedex.com,'',j4qk8j,0.84,589
"Two issues, one logic",mpyles10,1576075649.0,4979,i.redd.it,'',e97zwi,0.84,287
Standoff of the Century,PurpleAngel23,1594351999.0,4973,i.redd.it,'',hohpcy,0.64,941
Dwight Eisenhower,PurpleAngel23,1589892150.0,4963,i.redd.it,'',gmnt7a,0.73,520
It always puts a patriotic smile on my face when I see a British man getting upset over Americans right to bear arms. Thanks for the good news Piers.,Wonder10x,1593696223.0,4953,i.redd.it,'',hjwxe4,0.89,526
Basically most subs on Reddit,,1565656975.0,4950,i.redd.it,'',cplepk,0.74,283
Biden's America,tehForce,1599740886.0,4930,i.redd.it,'',iq2c88,0.65,419
Trump Bans Federal Money From Funding “critical race theory” and “white privilege”,Cyyyyk,1599306495.0,4939,citizenfreepress.com,'',imzsp0,0.67,1068
"Black woman is asked to stop blocking isle on flight, goes on anti-white privilege rant, gets hauled off the flight and to jail",johnpershing,1599834170.0,4931,vidmax.com,'',iqrffd,0.66,1390
"MSNBC's Rachel Maddow: 'If you pray, please pray for the speedy recovery' for Trump, first lady",Winterhold2000,1601654958.0,4924,thehill.com,'',j3xdk1,0.89,410
“Convenient” for the party of Jim Crowe to want to erase their own history,Wonder10x,1593192609.0,4924,i.redd.it,'',hgbz2v,0.73,695
Sarah Palin posted this on her Facebook page.,Yosoff,1439898924.0,4922,i.imgur.com,'',3hfpiv,0.8,748
They Don't Want You To Know: Reddit Mods Remove Viral GP Article About Woman Murdered for Saying 'All Lives Matter',ba_sing_bae,1594599335.0,4927,thegatewaypundit.com,'',hq55p2,0.78,526
"Biden says ""unlike the African-American community,"" Latinos are ""diverse"" and have ""different attitudes about different things""",Son_of_the_Roman,1596726935.0,4906,disrn.com,'',i4tm33,0.69,1200
Hate Hoax: Texas A&M Student Caught on Video Posting Racist Notes on His Own Car,JesusCumelette,1594474610.0,4899,thegatewaypundit.com,'',hpa3hb,0.77,509
"Chicago’s most violent day in 60 years: 18 murders in 24 hours. So far this year, 245 people in Chicago have been murdered. 0% were by police. Chicago has a Democrat Mayor, a Democrat Governor, two Democrat Senators, and 50 Democrat City Council members. Why don't Democrats care about Black Lives?",Theorymeltfool1,1591821730.0,4892,chicago.suntimes.com,'',h0jqgv,0.72,695
Kanye states the truth...,Clatsop,1573043590.0,4884,i.redd.it,'',dsfo1w,0.77,146
This is real. This isn’t some ‘funny meme’. This is the actual truth...,DeceptionDice,1584751833.0,4880,i.redd.it,'',fm6de3,0.63,608
When Californians Think About Moving to Texas,thatrightwinger,1589917279.0,4878,pjmedia.com,'',gmvnz8,0.69,556
Salesman of the Month,AppleTerra,1569155678.0,4867,i.redd.it,'',d7ptnp,0.8,117
Someone finally calls out the intellectual dishonesty of lumping illegal aliens with legal immigrants under the same terminology.,Mamemoo,1565539646.0,4866,i.redd.it,'',coyk04,0.74,302
What media bias?,russiabot1776,1581448484.0,4863,i.redd.it,'',f2daaa,0.72,290
95% of Reddit right now,tehForce,1586442604.0,4850,v.redd.it,'',fxteu3,0.6,1108
White privilege isn’t everywhere folks,,1566179133.0,4858,i.redd.it,'',csaeqg,0.82,396
"Puzzling, no?",IBiteYou,1597420328.0,4861,i.redd.it,'',i9ogcb,0.64,753
Isn't it ironic?,Jibrish,1590232253.0,4849,i.redd.it,'',gp34xv,0.76,364
Trump Said 'Good Morning.' Here's How 12 Different News Outlets Covered His Controversial Claim,ngoni,1588164809.0,4843,babylonbee.com,'',ga8w14,0.66,359
RESPECT!!!,AntonPercivalVIIII,1585892813.0,4834,i.redd.it,'',fu2r5e,0.83,200
"Reddit took $150m investment from the Communist Chinese, so these bans and the pivot away from freedom should not be a surprise to anyone. Reddit is not only purging thousands of communities from the site, but they are also banning users who “upvote” content that breaks their new “hate speech” rules",optionhome,1593478664.0,4814,news.gab.com,'',hicyrt,0.88,323
Why no one takes New York Times seriously anymore.,Noreaga,1586875746.0,4822,i.redd.it,'',g16v7w,0.88,249
“Journalists”,KingSolomon1027,1590761122.0,4819,i.redd.it,'',gstlqu,0.75,336
Politifact is listed as a “independent fact checker” for FB & YouTube.,Wonder10x,1590255563.0,4813,i.redd.it,'',gp91pl,0.87,144
Biden Slips Again: ‘Poor Kids Are Just As Bright And Just As Talented As White Kids’,bobbyw24,1565347965.0,4813,dailycaller.com,'',co0q70,0.81,572
So who's joining?,krayhayft,1547669071.0,4803,scontent.fagc3-2.fna.fbcdn.net,'',agp4sg,0.78,290
Always avoid wrongthink!,freebirdls,1587781203.0,4797,i.redd.it,'',g7lp8l,0.69,480
Just more fear mongering...,pm_me_ur_gaming_pc,1570545897.0,4794,i.redd.it,'',df0xrp,0.71,302
"Steelers Stephon Tuitt Says He Won't Take A Knee For Anthem: ""My grandmother was a(n) immigrant from the Carribean (sic) and age worked her ass off to bring 20 people over the right way. She had no money and educated herself to be a nurse. She living good now.""",Winterhold2000,1595873542.0,4791,937thefan.radio.com,'',hyxjmn,0.7,525
Trump thinks Scientology should lose its tax-exempt status,bullbour,1510279155.0,4791,thehill.com,'',7by3sm,0.91,438
...but that's none of my business...,IBiteYou,1588804561.0,4779,i.redd.it,'',geu8uz,0.65,764
Everyone Agrees,tehForce,1599967988.0,4776,i.redd.it,'',irqyms,0.82,290
FLASHBACK: Morgan Freeman on Ending Racism: ‘Stop Talking About It’ -- Black History Month is 'Ridiculous',guanaco55,1596646211.0,4768,cnsnews.com,'',i48x6m,0.81,486
Former Sheila Jackson-Lee Staffer Is Sentenced To 4-Years In Prison For Doxing Republicans,Venus230,1593612717.0,4762,thepoliticalinsider.com,'',hjaxsg,0.88,339
"Illinois General Assembly, with no money coming in and unemployment topping 16%, stay after midnight and vote themselves a pay raise. Our media will not report this.",playblu,1590413434.0,4766,charliemeier.net,'',gqazqb,0.87,299
In Hong Kong,Nergaal,1565053833.0,4764,i.imgur.com,'',cmjvzp,0.81,301
"Police arrest woman for driving 6 children around upstate New York to rip down Trump campaign signs. The woman was charged with 6 counts of endangering the welfare of a child, criminal possession of stolen property, petit larceny, marijuana possession and seat-belt violations.",optionhome,1601550823.0,4757,theblaze.com,'',j36kp3,0.8,456
"Happy 4th, everyone!",WipeHypeGaming,1593876670.0,4753,i.redd.it,'',hl55n5,0.86,154
"DOJ accuses Yale University of discriminating against Asian, white applicants: The two-year investigation concluded that Yale ""rejects scores of Asian American and white applicants each year based on their race.""",StarFuryG7,1597353855.0,4743,abc7news.com,'',i98n52,0.92,289
Hypocrites,Foubar,1588691520.0,4744,i.redd.it,'',gdzin5,0.86,210
"CNN disguises lobbyist interns and democratic politicians as ""mothers, voters, and students.""",DeviatoricStress,1551276531.0,4749,i.redd.it,'',avdv0u,0.75,302
🇺🇸🇺🇸,Forrest75,1583204429.0,4748,i.redd.it,'',fco337,0.74,376
A&E Sees Viewership Drop 49% After Canceling Live PD,IamnotValiantThor,1598195778.0,4738,forbes.com,'',if4wto,0.83,348
A picture is worth a thousand words!,Foubar,1597000264.0,4739,i.redd.it,'',i6p404,0.59,475
Radio host mocks Trump by claiming Seattle is peaceful. then rioters torched his apartment building,reddittttttt2,1595805320.0,4741,forums.somd.com,'',hygyuo,0.74,378
Classic power hungry democrats,scowrer,1564322889.0,4739,i.redd.it,'',ciw7v8,0.74,151
"NYTimes Admits WHO's Decision Not To Close Borders At Start Of Pandemic Was Based On ""Politics"", Not Science. ""not being seen to be racist and preventing people’s feelings from being hurt was more important than stopping the spread of the pandemic.""",optionhome,1601637309.0,4726,zerohedge.com,'',j3sn6g,0.78,588
Store owner sobs after business of 40 years is burned down during Kenosha riots,yourmotherisepic,1598469417.0,4723,nypost.com,'',ih5cp7,0.68,1005
‘He's gone full black supremacist’: Nick Cannon blasted for saying white people are a ‘little less’ and ‘closer to animals’,EdwardHolidayWriting,1594770650.0,4723,rt.com,'',hrcwbh,0.81,552
Piers Morgan out of all people recognize how silly it is.,StevenMcphearson,1572368778.0,4708,i.redd.it,'',doss7t,0.73,322
Terry Crews sparks outrage with Black Lives Matter tweet: ‘White people can have you’,billgigs55,1593562880.0,4698,m.washingtontimes.com,'',hizp8q,0.83,785
"Former Barack Obama Deputy Chief of Staff Alyssa Mastromonaco ""going high""",Jabbam,1598450543.0,4698,i.redd.it,'',igzegy,0.68,691
Reason #51 why I’m leaving the Democratic Party,,1589466919.0,4699,i.redd.it,'',gjnilv,0.63,627
Who else remembers this?,Wonder10x,1596062752.0,4699,i.redd.it,'',i0ahve,0.57,844
There's a reason the lights are on in only one half of the Korean peninsula. That reason being brave American soldiers that fought for liberty on foreign soil. Their sacrifices will never be forgotten.,Scipius20,1598618547.0,4688,calebmaupin.com,'',ii6bro,0.86,508
"This police officer was caught on camera on a family's lawn at 3 a.m. – picking up their fallen American Flag. ""To me, [the flag] is inclusive of everyone who lives in this country, and represents my family, who are immigrants,"" Officer Shelly Montes",nycsellit4me,1601072378.0,4686,v.redd.it,'',iztege,0.77,368
BLM supporter screams at Asian boba tea employees for cultural appropriation. She felt Boba tea is black culture. When a black man in line behind her spoke up she called him a slur.,bigwinniestyle,1598284652.0,4680,twitter.com,'',ifrowf,0.69,801
Black Man Erupts At BLM For Blocking Road: ‘I Got To Go To Work. I Got Bills. I Got Kids. Get The F*** Out My Way.’,munchkinfear,1596377070.0,4678,dailywire.com,'',i2ck8l,0.75,429
It is not enough,ngoni,1594835024.0,4676,i.redd.it,'',hrs6db,0.57,1278
"Charles Barkley is Not Happy About Anti-White, Anti-Semitic Comments From Black Celebrities -- ""Listen, DeSean Jackson, Stephen Jackson, Nick Canon, Ice Cube - Man, what the hell are y'all doing?""",guanaco55,1595088978.0,4671,townhall.com,'',htj7in,0.82,274
WHO Screw-up,Foubar,1586699748.0,4678,i.redd.it,'',fzx5hl,0.79,161
Confirmation bias is real,universalChamp1on,1598998737.0,4669,i.redd.it,'',ikuam2,0.57,1204
UFC fighter calls out Lebron James virtue signaling,Wonder10x,1598541183.0,4664,i.redd.it,'',ihmt13,0.61,1025
Portland Killer Michael Reinoehl shot dead by police - Reinoehl fired off 40 to 50 rounds before being killed by members of U.S. Marshals task force,Cyyyyk,1599212122.0,4656,citizenfreepress.com,'',imcy8h,0.68,1405
I'm Joe Biden and I ...you know. the thing.,tehForce,1594754310.0,4649,i.redd.it,'',hr7xe9,0.77,240
The Media is a joke,oclotty,1588267922.0,4635,i.redd.it,'',gb0748,0.74,473
Democrat debates in a nutshell,Efficient-Football,1584373214.0,4648,imgur.com,'',fjmwwj,0.71,473
Ted Cruz introduces Constitutional amendment for term limits in Congress,IndefinitePresent,1546613669.0,4642,breitbart.com,'',acivhh,0.86,301
A Winning Proposition,tehForce,1592803971.0,4640,i.redd.it,'',hdm4rh,0.75,508
"Floyd's brother demands end to violence: ""If his own family and blood is not doing it, then why are you?""",Foubar,1591053810.0,4634,hotair.com,'',guvlgw,0.8,487
Good advice I wish Reddit would take,ch3000,1586289033.0,4628,i.redd.it,'',fwrbg5,0.87,360
"blacks receive a ""bonus” of 230 points on SAT, Hispanics received a bonus of 185 points, while Asians LOSE 50 points on SAT ALL BECAUSE OF THEIR RACE. screw affirmative action",RonPaul2020plz,1500685740.0,4629,latimes.com,'',6os7u7,0.64,870
The struggle is real!,WeLeanRight,1579279558.0,4617,i.redd.it,'',eq2vfe,0.7,206
"Dr. Fauci Confirms ""No Reason We Can't Have In-Person Voting"": Live Updates",bearwave,1597349865.0,4617,zerohedge.com,'',i97esp,0.74,1011
Bakers vs Tweeters,tehForce,1566499688.0,4613,i.redd.it,'',cu1raq,0.71,374
Black Lives Matter summarised,kreginald,1592380265.0,4611,i.redd.it,'',hamt2g,0.77,455
Honor the fallen by living for the America they died for,Alpha741,1568185483.0,4610,i.redd.it,'',d2m69p,0.84,174
Who's Tax Return Do You Want To See?,NarcSlayerGirl,1594389431.0,4609,i.redd.it,'',hopdoe,0.77,513
I don't get it...,bustinjustin,1589761535.0,4609,i.redd.it,'',glqvsc,0.8,495
"Way to go, CHAZ!",FelixFuckfurter,1593453852.0,4608,i.redd.it,'',hi50zm,0.89,243
"Dolph Lundgren versus everyone's favorite Left-wing ""scientific authority""",Sola__Fide,1588456888.0,4606,i.redd.it,'',gcev7v,0.66,479
MAGOYA,tehForce,1594668517.0,4600,i.redd.it,'',hqlz0g,0.79,329
I applaud her courage...,Jibrish,1588335346.0,4599,imgur.com,'',gbh0hx,0.78,462
Elon Musk says he WON'T get a coronavirus vaccine because he's 'not at risk' and says the pandemic has 'questioned my faith in humanity' because people have become 'irrational' - as he defends keeping Tesla factories open amid the crisis,Foubar,1601350790.0,4595,dailymail.co.uk,'',j1rnye,0.68,1486
Spot the Difference Challenge : Level 1000,Corelier,1553478786.0,4580,i.redd.it,'',b54ncd,0.73,230
'#SayHisName' trends after mainstream media's silence on the atrocious killing of 5-year-old Cannon Hinnant,billgigs55,1597380108.0,4573,theblaze.com,'',i9fl7q,0.72,1753
UC Berkeley students be like,Tiger_2K02,1589938288.0,4568,i.redd.it,'',gn1ziz,0.8,342
"So far, I have not heard any liberal response to this. They are literally ignoring the allegations.",SarcasticaFont,1588558882.0,4564,i.redd.it,'',gd34y3,0.67,865
Joe Knows Swing States,tehForce,1592707372.0,4563,i.redd.it,'',hcz8wt,0.82,166
