China is paying reddit to take down pictures of this. I entrust this to you,ManualRockBot,1585780615.0,47736,i.redd.it,'',ftaazt,0.77,1317
Terry Crews articulates everything wrong with “woke culture” & doesn’t back down,Wonder10x,1593962289.0,29142,i.redd.it,'',hlo9os,0.71,1643
Trump calls for delay to 2020 US election,NoleFan723,1596114842.0,21337,bbc.com,'',i0ltok,0.73,6125
Never Forget,tehForce,1599816877.0,20050,i.redd.it,'',iqncit,0.65,2073
So let me get this straight...,Clatsop,1481981258.0,19572,i.imgur.com,'',5iugd6,0.52,3184
"RESUBMITTED: Behold: reddit after they received $300 million from China's company, Tencent",SwampMidget,1585597327.0,18972,i.redd.it,'',frxodq,0.76,781
"NY Times: Trump paid $750 in US income taxes in 2016, 2017",pookamatic,1601245443.0,18315,apnews.com,'',j106fp,0.64,4330
"Justice Ruth Bader Ginsburg, Champion Of Gender Equality, Dies At 87",psstein,1600472062.0,17998,npr.org,'',ivh84e,0.67,11117
"Bloomberg pays fines for 32,000 felons in Florida so they can vote",tenshon,1600782053.0,17906,thehill.com,'',ixnlcy,0.76,2752
Sen. Hawley Introduces Bill To Fine American Companies Relying On Chinese Slave Labor,Farmwife64,1595331288.0,15811,thefederalist.com,'',hv5sje,0.87,772
Why we won,Rupispupis,1478727664.0,15257,pbs.twimg.com,'',5c3xah,0.62,1638
"Trump knew the coronavirus was 'deadly stuff' but chose to downplay it, according to recordings revealed in new Woodward book",Stewart987a,1599674598.0,15142,usatoday.com,'',ipl3jd,0.66,2936
It's OK To Be All Three,ngoni,1591222279.0,15093,imgur.com,'',gw3yjx,0.68,1308
"Group of men form circle around outnumbered cop, protecting him from angry mob.",Beano101,1590881121.0,15068,i.redd.it,'',gto8ul,0.8,878
Joe Rogan Offers to Moderate Trump-Biden Debate -- President Trump Accepts the Invite,LimeSugar,1600097485.0,14364,thegatewaypundit.com,'',isn4av,0.65,1759
Donald Trump and wife Melania test positive for coronavirus,cats-are-amazing,1601614821.0,14087,news.sky.com,'',j3oh32,0.68,6827
70k+ Upvotes on a Post Claiming Trump Supporter Waves Nazi Flag at Michigan Rally. Man Is Actually a Bernie Bro at Boise Bernie Fest 2020.,IronWolve,1587155881.0,13777,imgur.com,'',g39zx3,0.67,1423
I Love Poland,knownbuyer3,1597759557.0,12625,i.redd.it,'',ic1m52,0.75,1292
House impeaches Trump for abuse of power,Bowens1993,1576718797.0,12595,thehill.com,'',eclxrz,0.69,2293
Relevant,Venus230,1591191693.0,12574,i.redd.it,'',gvu57x,0.68,1788
"""If China knew of the outbreak way before they told WHO and covered up things, this is a crime against humanity"" - says Italian politician Matteo Salvini",cottoncandy240,1585227622.0,12512,adnkronos.com,'',fpb34w,0.84,792
"I'm Joe Biden, and I... what?",Jibrish,1583325691.0,12416,imgur.com,'',fdcfnk,0.79,556
"Well, she's a guy, so...",mithrandir1314,1490051632.0,12073,i.redd.it,'',60k0bb,0.65,1426
For some reason people don’t understand the difference of these two pictures.,SCtheWizard,1590682844.0,11860,i.redd.it,'',gs9ark,0.63,2090
Reddit Admin u/spez Admits of Editing Users Comments,10gauge,1479950989.0,11303,i.redd.it,'',5el3n6,0.63,601
Forget Trump. Let's do what Obama said.,xcat11onetee,1563450735.0,10726,v.redd.it,'',cerhdc,0.72,1101
The_donald - as well as 2000 other subs - have been banned.,Jibrish,1593451087.0,10562,self.Conservative,"""We're seeing a few submissions about this. As it's big news, this will be an open thread for discussion of the ban waves.\n\nThe announcement: https://www.reddit.com/r/announcements/comments/hi3oht/update_to_our_content_policy/\n\nThe list of banned active subs:\nhttps://www.redditstatic.com/banned-subreddits-june-2020.txt\n\nWe're talking about this on the /r/Conservative  discord.\n\nhttps://discord.com/invite/conservative\n\nWe've also opened a thread for this on Parler:\n\nhttps://parler.com/profile/rConservative/posts""",hi426n,0.66,4386
Trump vs. Clinton,,1457019272.0,10553,i.imgur.com,'',48sgkc,0.82,1143
Trump says he is considering pardon for leaker Edward Snowden,BlahChemistryBlah,1597576389.0,10549,reuters.com,'',iaqm34,0.78,1813
Bill Would Ban Gender Reassignment Procedures on Minors,LimeSugar,1598362617.0,10360,dailysignal.com,'',igcc7h,0.71,1420
Trump Signs Law Making Cruelty To Animals A Federal Crime,Dan-In-SC,1601047150.0,10036,npr.org,'',izlcw7,0.71,1339
Anyone remember this?,welcometoezgames,1597179557.0,9747,i.redd.it,'',i7zzw2,0.68,948
Trump considering banning all Chinese Communist Party members and their families from US,MuniPal,1594997194.0,9735,americanmilitarynews.com,'',hswxo7,0.79,1077
I think they might have figured it out...,IS-2-OP,1586415499.0,9575,i.redd.it,'',fxnnhf,0.73,900
"“The media isn’t biased, it’s all in your head”",universalChamp1on,1600367621.0,9549,i.redd.it,'',iupg0x,0.68,662
Disgusting,Venus230,1597408627.0,9361,i.redd.it,'',i9l5nz,0.62,1948
PragerU giving NY times a reality check about cancel culture,Wonder10x,1593716771.0,9332,i.redd.it,'',hk3688,0.66,875
"Lindsey Graham is quietly preparing a bill trying to destroy End-To-End Encryption(As a believer in conservative values of small government, this is abhorrent)",Ch33mazrer,1584308519.0,9201,gizmodo.com,'',fj94jn,0.94,456
Reddit Accepted $150 Million From Chinese Firm,brokeassmogul,1594088007.0,9162,thesaintlouistimes.com,'',hmlqrt,0.87,483
There Has Been Pushback on Mentioning the Names of Active Shooters. This Young Man’s Name Deserves to be Known,PurpleAngel23,1557360352.0,9149,i.redd.it,'',bmcvnq,0.85,299
Marco Rubio spitting facts,SickyM,1590945640.0,9077,i.redd.it,'',gu2xy1,0.75,663
"""US passes China in confirmed cases...""",Moonthrower,1585517058.0,9012,i.redd.it,'',frdml9,0.81,468
"""Woke""",tehForce,1597070379.0,8964,i.redd.it,'',i760sg,0.63,788
Sowell asks about society,HNutz,1592048537.0,8852,i.imgur.com,'',h85zf8,0.76,307
You can't fix stupid,floatonadoor,1589380014.0,8734,i.redd.it,'',gj01z2,0.8,515
The ultimate commitment to free speech.,_TheJudge,1589543639.0,8528,i.redd.it,'',gk7pvv,0.67,1042
Biden responds to Trumps' positive coronavirus tests: 'Jill and I send our thoughts... for a swift recovery',alc59,1601648075.0,8461,foxnews.com,'',j3v8nv,0.84,1102
China committing crimes against humanity,UnusedSheep,1595208481.0,8455,reddit.com,'',huccky,0.93,733
"Melbourne street artist behind racy Hillary Clinton mural has Instagram account deleted - “It’s fine to go on and do a mural on Trump, but when I go and do one on Hillary Clinton, my account is gone.”",Ser_Davos_Cworth,1469875808.0,8406,9news.com.au,'',4vbmhb,0.76,355
This is my favorite Seminole. Great man. Great human being,NoleFan723,1592667458.0,8395,i.redd.it,'',hco9ye,0.86,363
Leftist hypocrisy at its finest,Future401,1596911255.0,8329,i.redd.it,'',i64306,0.63,819
"CNN and the MSM are the scum of the earth, change my mind.",c_halls_,1587889616.0,8317,i.redd.it,'',g8auvg,0.79,725
Trump Bans TikTok After His First Video Gets 0 Views,Lil_H00,1596307605.0,8210,babylonbee.com,'',i1xbez,0.85,411
"Trump speaks on Ghislaine Maxwell: ‘I wish her well, frankly’",aggie1391,1595380290.0,8090,nypost.com,'',hvk5ie,0.78,1835
If Twitter marketing was honest.,aptlyautistic,1594582884.0,7966,i.redd.it,'',hq0l8l,0.76,517
Damn it Bloomberg,Wrestler1620,1583179257.0,7959,i.imgur.com,'',fchxyf,0.91,229
Spot on,pm_me_ur_gaming_pc,1567089902.0,7966,i.imgur.com,'',cx1vil,0.78,804
Nike hyprocrisy,,1573805792.0,7951,i.redd.it,'',dwnr54,0.8,507
Is there really a difference?,dyldyl9,1597185538.0,7946,i.redd.it,'',i81ugp,0.76,658
This is ‘the cognitive test Trump didn’t pass’: Internet reacts to president’s ‘shocking’ Axios interview,Twilight_Realm,1596566342.0,7911,marketwatch.com,'',i3ozke,0.7,1754
"The Harvard graduate who said in a TikTok video that she would “stab” anyone who told her “All Lives Matter” lost her job today. “The job that I’d worked really hard to get and meant a lot to me has called me and fired me""",optionhome,1593651596.0,7826,nypost.com,'',hjn9y7,0.69,1399
People are calling out Terry Crews for saying that leaving white people out of conversations about race can create 'black supremacy',bobbyw24,1591613214.0,7793,yahoo.com,'',gyx2jw,0.69,965
Don’t break an arm jerking yourself off.,giobbistar21,1599246454.0,7747,i.redd.it,'',imm6fq,0.66,570
Never forget,meister2a,1584122451.0,7748,i.redd.it,'',fi3u81,0.78,254
Jeffery Epstein found dead in his jail cell. from apparent suicide.,,1565442585.0,7742,google.de,'',cohu1k,0.88,1141
Big tech is the new authoritarian government,Wonder10x,1593176614.0,7715,i.redd.it,'',hg76g3,0.81,415
Every single post,ElongatedMuskrat122,1568082162.0,7697,i.redd.it,'',d21a11,0.75,336
"""Fiery, but mostly peaceful protests"" - CNN",Jibrish,1598536954.0,7666,i.redd.it,'',ihlkgc,0.66,738
Terry Crews Cites Nick Cannon’s Racist Anti-White Comments: I Told Ya So,DarthBalls5041,1594915588.0,7620,dailywire.com,'',hscb4c,0.77,711
Spelling it Out for the Left,thatrightwinger,1599064455.0,7609,pjmedia.com,'',ila6nw,0.62,488
BLM turned me into a conservative.,TedricDaBored,1593715632.0,7606,self.Conservative,"""I grew up in Northern Illinois my father is black and my mother is white. For the longest time I thought I was a liberal. I thought liberals cared about people and were logical, that's not the case in my experience. As soon as George Floyd died any piece of logic the liberal party had left was thrown into the wind. These people don't want to solve problems they want to blame people. My father's dad was a  black man who grew  up in Arkansas, he encountered racism and it never slowed him down, he never used it as an excuse. He was a Korean war veteran and after his duty, he worked and provided for his family. He made enough to buy a house and send my father to private school. He made something for himself during the time when it was hard as a black man to do so.\n\nWhen I see black people today crying racism,  it mocks my grandfather, my grandmother and every single person who worked to show America that blacks are equal. Now being equal isn't enough. We demand special treatment from the police i.e. Nothing should happen to us if we try to escape arrest because racist cops! Corporations and celebrities treat us like small brain proto-humans who can't take a blackface joke and even the Democratic Presidential nominee feels he can decide who is black or not based on who they vote for in the election. I am so sick of this BS. Black people have it better than ever before, but we continue to play victim and ask for handouts that destroy us. Single parent homes are the number one threat that is tearing the black community apart. No one says this on television no one wants to be viewed as a racist. It's sad. The men  in my life taught me to work for things, to never make excuses and to critically think. If I didn't have them in my life I probably would be marching and living a lie. 73% of black kids are born out of wedlock. Kids need adults in their life to teach them morals and values. People praise single mothers but should we be? These are adults who make decisions and then we as a country have to pay for these decisions not in just taxes, but our societal foundation. We enable single moms to keep having kids, those kids grow up without moral character and they perpetuate the cycle.\n\nEDIT\n\nThanks for the comments and medals. I wrote this in a burst of frustration after months of feeling more than a little irritated about BLM. Wish I worded it a bit better, explained somethings, but I'm not going to, thanks guys and gals. I appreciate it.""",hk2tia,0.7,1027
I'm sick and tired of these ignorant protesters,tehForce,1591503895.0,7577,i.redd.it,'',gy5te5,0.67,1128
"Remember: All politics aside, at the end of the day, we are ALL Americans. Happy 4th! 🇺🇸",mike_steele,1593888366.0,7570,i.redd.it,'',hl8eym,0.75,678
Good move by the UK government to ban trans surgeries for under 18s,ItsRaw18,1587582868.0,7551,i.redd.it,'',g67d33,0.73,985
Nothing to see here,mikejclark,1591471151.0,7492,i.redd.it,'',gxx6de,0.65,728
Stephen Bannon Charged With Fraud by New York Prosecutor,thorvard,1597931324.0,7473,bloomberg.com,'',idalys,0.86,1033
Injustice anywhere is a threat to justice everywhere.,LibertyPanda,1579622336.0,7454,i.imgur.com,'',erwip0,0.92,207
The Left and Their Double Standards,Lionhearted09,1596197482.0,7430,i.redd.it,'',i16fhe,0.72,797
Choices,PurpleAngel23,1601308670.0,7412,i.redd.it,'',j1eofp,0.62,742
Oh no!,Jibrish,1593004620.0,7391,i.redd.it,'',hf0u9v,0.73,361
Is the biggest online racebaiter dropping red pills?,Wonder10x,1591383647.0,7375,i.redd.it,'',gxap0s,0.62,883
Dragging Joe Along,thatrightwinger,1588086637.0,7368,imgur.com,'',g9oxzw,0.79,335
Only in the twisted world of the Left is this a bad thing,Sola__Fide,1599490017.0,7316,i.redd.it,'',io8prw,0.56,2660
"POTUS calling out antifa in Seattle while complimenting himself, classic Trump move 😂",Wonder10x,1592513323.0,7314,i.redd.it,'',hbmp3b,0.6,923
Have any of you who use reddit mobile app noticed it as well? 🤔,CultistHeadpiece,1590947606.0,7285,i.redd.it,'',gu3ist,0.87,302
Full Bodycam Footage of George Floyd Arrest,CherryCokeNixon,1597098950.0,7268,youtube.com,'',i7fdo8,0.58,2109
Report: China Stopped Testing for COVID-19. That's Why There Are Zero New Cases.,ThePoliticalHat,1584895502.0,7182,pjmedia.com,'',fn2mg8,0.84,424
San Francisco gym owners livid after discovering gyms in government buildings have been opened for months,LizardsThicket,1599431300.0,7142,washingtonexaminer.com,'',invfxf,0.71,802
"No, Tax-Evading Cruise Lines Shouldn’t Get Handouts From Uncle Sam -- American taxpayers don’t love handouts to American corporations, but they really hate handouts to foreign companies — especially when they're only foreign to avoid U.S. taxes and laws.",guanaco55,1586176226.0,7091,thefederalist.com,'',fvxw07,0.95,324
This is how Chinese owned Reddit is influencing the 2020 US Election,Qplus17,1593173398.0,7075,i.redd.it,'',hg6d2a,0.59,1316
Jesus had no gun rights,briandefl,1583429619.0,7014,i.redd.it,'',fdyr7t,0.82,346
Words to live by...,Clatsop,1596626561.0,6995,i.imgflip.com,'',i43iw5,0.75,374
"Minimum wage, Joe...",Jibrish,1589280307.0,6984,i.redd.it,'',gi8v8l,0.78,349
....worst Hitler ever.,undue-influence,1599996178.0,6936,i.redd.it,'',irwk4h,0.62,866
This is extremely relatable,Empty-Nectarine,1587390014.0,6918,i.redd.it,'',g4syq4,0.86,488
Fighting fascism with fascist tactics.,-Conservative-,1601127879.0,6876,i.redd.it,'',j069ug,0.68,765
Hes a hero in the lefts eyes.,-Conservative-,1598805250.0,6855,i.redd.it,'',ijfllu,0.64,1682
Tulsi Gabbard Condemns Netflix for Releasing 'Cuties': 'Child Porn' That 'Will Whet the Appetite of Pedophiles & Fuel Child Sex Trafficking',guanaco55,1599920110.0,6844,breitbart.com,'',irdc0y,0.81,456
If there's one thing Americans have learned during this pandemic,alc59,1590763604.0,6784,i.imgur.com,'',gsuaqj,0.83,342
Infographic,Future401,1599408688.0,6761,i.redd.it,'',inonwn,0.65,538
Fake news ABC... Xpost,Ignesias,1573226578.0,6739,i.redd.it,'',dtgvm7,0.85,265
You Mean Like This?,PurpleAngel23,1596576626.0,6725,i.redd.it,'',i3s9nd,0.84,278
"Rand Paul introduces Justice for Breonna Taylor Act to ban ""no-knock"" warrants",-Kerosun-,1591919030.0,6703,axios.com,'',h79h8o,0.91,607
"Happy Birthday, America!",rosaryrattler,1593901189.0,6653,i.redd.it,'',hlbvfr,0.72,430
Because role models are important...,KingOfTheP4s,1485450405.0,6652,i.imgur.com,'',5qbcev,0.65,499
Ted Cruz ruining Baby Yoda,mtgheron,1575467827.0,6646,i.redd.it,'',e5zktf,0.85,326
"""You won't be spared""...",Jibrish,1595161367.0,6638,i.redd.it,'',htznur,0.59,872
This pandemic is hitting everyone very hard,Lionhearted09,1584665269.0,6637,i.redd.it,'',fllin7,0.88,136
"To all men: Stop objectifying women. Signed, Gillette",elvisjulep,1547732258.0,6621,i.pinimg.com,'',agxu3z,0.63,469
"Girl starts harassing the McCloskeys outside of a print shop, so they hand her a greeting card they had made.",gsfilmer,1600880508.0,6612,i.redd.it,'',iye4ow,0.6,1051
This aged well. “You ain’t black” lmao,Weinstein312,1590444192.0,6585,i.redd.it,'',gqkc7j,0.77,293
Trump denies Minnesota governor's request for $500M to repair damage from riots,HoneyPot-Gold,1594507939.0,6565,washingtonexaminer.com,'',hpjj7v,0.65,1225
How it feels being a Republican in college...,byrne206,1485587724.0,6557,imgur.com,'',5qmgl5,0.57,1319
It is kinda true tho,JoshDaBoiOnReddit,1597671258.0,6548,i.redd.it,'',ibe88u,0.66,718
Friendly chart to help you decide who you should vote for in November,MurkDollaSign,1590182151.0,6507,i.redd.it,'',gos0g3,0.69,379
CNN’s highest paid employee.,Skelley818,1598581545.0,6456,i.redd.it,'',ihytbq,0.65,691
"Yale University trying to get ahead of cancel culture, edits the Wiki article about its namesake in an effort to change his history as a slave trader.",,1593547626.0,6450,i.redd.it,'',hiv4g5,0.89,377
This old bag...,,1586966826.0,6444,i.redd.it,'',g1uvxt,0.75,455
Navy Seal who killed Osama bin laden sets the record straight,Wonder10x,1591490019.0,6442,i.redd.it,'',gy2gkn,0.66,677
"Terry Crews Declares He'll 'Die on This Hill,' Uniting With 'Good People, No Matter the Race, Creed or Ideology'",Foubar,1593995530.0,6442,redstate.com,'',hlxlub,0.76,391
The face of one of the Police Officers shot in this week’s protests,Yeetdembabies,1600973320.0,6427,i.redd.it,'',iz37yx,0.8,660
Black Police Chief killed by looters in St. Louis while attempting to defend Pawn Shop,Rextab,1591148905.0,6423,abcnews.go.com,'',gvkpub,0.75,1057
Protesters in HK burn the CCP flag,inFAM1S,1570112868.0,6423,i.redd.it,'',dcrnc9,0.91,384
Cenk's smear against Dave Rubin backfiring.,ItsRaw18,1588909140.0,6414,i.redd.it,'',gflo61,0.87,394
Trump signs order banning federal agencies from firing U.S. citizens to replace them with foreigners,Foubar,1596472935.0,6410,justthenews.com,'',i30f6f,0.8,483
The Left's Hypocrisy,welcometoezgames,1597193549.0,6403,i.redd.it,'',i84112,0.86,481
Incredibly people think this is a news organization,optionhome,1574676240.0,6396,i.redd.it,'',e1dzeg,0.8,230
"In Major Deal, The Babylon Bee Purchases Competing Satire Site CNN",Qplus17,1598617096.0,6391,babylonbee.com,'',ii5zv6,0.71,311
Veterans! Thank You!,undue-influence,1573475173.0,6398,i.redd.it,'',durp8p,0.79,344
Experiment: Let's split a country into half Communist and half Capitalist and see which does better. 70 years later...,Yosoff,1588367000.0,6360,i.redd.it,'',gbqd6b,0.78,424
What the SJW really does,optionhome,1501931235.0,6358,pbs.twimg.com,'',6rr7nn,0.56,520
INADMISSIBLE: Trump Bans Chinese Communist Party Members from Immigrating to America,Foubar,1601764951.0,6340,thenationalpulse.com,'',j4ob5x,0.68,1014
"An Unexpected Coalition, A Formidable Opponent",youngchriii,1593633971.0,6320,i.redd.it,'',hjhxa6,0.77,360
"It’s been a pleasure, fellas",WSBidiot,1593328412.0,6304,i.imgur.com,'',hha6qi,0.71,1298
"Nick Cannon calls white and Jewish people “the true savages,” claims they are “closer to animals”",Son_of_the_Roman,1594747723.0,6248,disrn.com,'',hr5sh2,0.72,1445
A liberal echo chamber,noblearcher95,1589132587.0,6235,i.redd.it,'',gh5urf,0.59,1239
Terry Crews addresses Nick Cannon supporters: 'I was never afraid of the KKK ... it was people like you',Cyyyyk,1595189819.0,6238,bizpacreview.com,'',hu7b2g,0.73,513
Officer Jakhary Jackson of the Portland Police Bureau reveals the truth about the racism he's witnessed from white Antifa/BLM activists,WrongxThinker,1601769438.0,6222,v.redd.it,'',j4pfbp,0.76,660
"Petition to have racist Cambridge University Professor fired for tweeting ""Abolish Whiteness"" and ""White Lives Don't Matter""",Kappaexpose123,1593020692.0,6211,change.org,'',hf5kpz,0.75,623
....but that's none of my business....,royalecheez,1591693599.0,6189,i.redd.it,'',gzjheg,0.87,372
Seattle is fine!,Jibrish,1593689873.0,6136,imgur.com,'',hjvfcv,0.66,550
I'M NOT SORRY: Girl Who Wore Chinese Dress For Prom Says She'd Wear It Again After SJW Outrage,tfriend87,1525270773.0,6134,dailywire.com,'',8ghr38,0.73,716
Remember that time?,tehForce,1597320245.0,6112,i.redd.it,'',i8ynxu,0.68,730
"State Senator Katrina Robinson (D) indicted on 48 counts of theft, embezzlement, and wire fraud. Faces 20yrs in prison",LawVol99,1596160661.0,6102,wmcactionnews5.com,'',i0z08h,0.77,702
Political corruption at its worst,PlymouthSock,1583523299.0,6056,i.redd.it,'',feita1,0.86,274
Dr. Carson reminds us who are real enemies are,optionhome,1591364284.0,6034,imgur.com,'',gx4q64,0.7,559
Rioters only know “orange man bad”,Wonder10x,1592233791.0,6014,i.redd.it,'',h9i6kx,0.58,1404
Larry the Cable Guy blasts 'clueless' celebs for singing 'Imagine' as LA's homeless suffer amid coronavirus,Farmwife64,1584798426.0,6006,foxnews.com,'',fmf7at,0.79,353
"Trump nominated for Nobel Peace Prize by Norwegian official, citing Israel-UAE peace deal",Murican_Freedom1776,1599644965.0,6005,foxnews.com,'',ipcy59,0.64,1554
Orange man good.,Ssj5Pepe,1574856308.0,5986,i.redd.it,'',e2f588,0.71,543
Poll: 62% of Americans Say They Have Political Views They’re Afraid to Share,sendintheshermans,1595435248.0,5975,cato.org,'',hvwvf2,0.64,1806
Bob and Sally,Yosoff,1530884286.0,5960,i.imgur.com,'',8wk4tn,0.69,1192
The Epitome of Narcissism.,MichaelPollock2020,1582002002.0,5933,i.redd.it,'',f5mfhm,0.76,388
"Poll: More Than 8 In 10 Americans Say Media Is Biased, To Blame For Political Division",guanaco55,1596555234.0,5930,thefederalist.com,'',i3lg8w,0.83,555
"Japanese PM tells the United Nations to shove it, will not take in any Muslim ‘refugees’",10gauge,1499646277.0,5905,jewsnews.co.il,'',6mb22g,0.64,1060
Get in...,Jibrish,1587727603.0,5904,i.redd.it,'',g76qb3,0.76,377
Mike Rowe nails it...,Clatsop,1480673300.0,5883,i.imgur.com,'',5g2je7,0.81,294
Biden the Dementor,tehForce,1596860902.0,5871,i.redd.it,'',i5syuo,0.68,530
lmao,fundedbyyourmom,1592080506.0,5867,preview.redd.it,'',h8f9co,0.64,599
It's a repost but we must spread the word!,nathanseaw,1570724663.0,5864,i.redd.it,'',dg0gb8,0.95,228
I'm a liberal. But I find Reddit's new anti - hate speech policy very dangerous.,ninefortyfourPM,1593483223.0,5867,self.Conservative,"'I identify more closely with the left, but I spend a lot of time on r/conservative just to hear different perspectives. I am shocked by Reddit\'s new policy.\n\nAs a strong free speech advocate, I believe this has gone too far. I completely understand banning subreddits dedicated to hate, but banning a subreddit simply due to a few offensive individuals is absurd. However, what concerns me most about the policy is this: \n\n""While the rule on hate protects [marginalized or vulnerable] groups, it does not protect all groups or all forms of identity. For example, the rule does protect groups of people who are in the majority or who promote such attacks of hate."" \n\nSince when is so called ""hate speech"" limited only to marginalized groups? I understand that some groups are more vulnerable, but ALL groups can be targets of hate. \n\nThis is not equality.'",hie76j,0.64,1539
"Hagrid Actor Robbie Coltrane Defends J.K. Rowling's Transphobic Tweets: ""There's a whole Twitter generation of people who hang around waiting to be offended.""",Winterhold2000,1600197214.0,5849,consequenceofsound.net,'',itfgon,0.65,1227
"Democrats can have Cardi B & AOC , I’d much rather have Candace Owens on my side.",Wonder10x,1599661964.0,5809,i.redd.it,'',ipgz8e,0.74,639
#Math,Yosoff,1554139556.0,5793,i.imgur.com,'',b85f93,0.7,538
Every communist ever,dankkush6969420,1598718183.0,5783,i.redd.it,'',iiv92c,0.61,699
This is the best one yet!,crispyTacoTrain,1580841513.0,5758,i.redd.it,'',eyuogt,0.72,299
Damage Control Mode Activated,tehForce,1598013697.0,5744,i.redd.it,'',idvzbt,0.77,391
China lied - people died!,Foubar,1587435986.0,5744,i.redd.it,'',g56rzn,0.87,220
about sums it up,BabaSherif,1563495952.0,5736,i.redd.it,'',cf0klk,0.78,350
Substitute “Reddit” for any political sub such as r/politics.,Ninjameerkat212,1582686120.0,5727,i.redd.it,'',f9mhyy,0.85,323
Change my mind...,Jibrish,1600349902.0,5711,i.redd.it,'',iujmlf,0.68,496
Oh no Joe. ...just...no.,tehForce,1594432621.0,5708,i.redd.it,'',hp1txh,0.76,398
I can’t be the only one that does this,IJustSayOof,1596038161.0,5693,i.redd.it,'',i032q5,0.63,823
Any questions?,yakkattakk,1591788242.0,5681,i.redd.it,'',h08yh5,0.85,341
Dog Faced Pony Soldier,tehForce,1592417987.0,5664,i.redd.it,'',haww4z,0.65,524
Sounds About Right,PurpleAngel23,1575600270.0,5661,i.redd.it,'',e6sbg0,0.79,362
Joe Biden is a...,Jibrish,1589713763.0,5662,i.redd.it,'',gldnaa,0.62,906
When your hypocrisy knows no bounds...,PhilosoGuido,1591642175.0,5658,i.redd.it,'',gz5aag,0.62,480
Fair is Fair,thx3158,1588954633.0,5648,i.redd.it,'',gfw4bg,0.77,319
Just Try Harder Comrades!,ngoni,1588355556.0,5652,i.redd.it,'',gbmupm,0.79,271
2018 vs 2020,CoryB23,1588297752.0,5648,i.redd.it,'',gb983a,0.75,350
"Reddit’s very own secret police on Drone Strike Bama. These people are nuts, no innocents killed cause the narrative must be protected.",-Conservative-,1592919463.0,5630,i.redd.it,'',heer70,0.71,710
Is r/enlightenedcentrism ... based?,star7500,1590332182.0,5614,i.redd.it,'',gpqzo9,0.85,275
Free Speech Matters | Change My Mind,TheBarberOfFleetSt,1570756024.0,5595,i.imgur.com,'',dg7o2z,0.95,132
"Confused, Biden announces he is dropping out of the race...",Jibrish,1583410314.0,5589,i.redd.it,'',fducke,0.8,232
Joe Biden expresses his gratitude,tehForce,1586952328.0,5581,i.redd.it,'',g1qnhs,0.77,195
Kanye West: ‘It’s ‘Racism and White Supremacy to Say All Black People Need to Be Democrat’,Enzo_SAWFT,1594219634.0,5566,breitbart.com,'',hnicae,0.72,645
