"Hillary Clinton: This presidency, summed up: While the country hit 154,000 COVID-19 deaths, the jobless rate soared, and an eviction crisis loomed, Trump went golfing this weekend at a course he still owns.",dolphins3,1596501174.0,1548,twitter.com,'',i397yo,0.93,143
Michael Cohen reportedly gives Congress documents showing Trump's lawyers edited his false statement,progress18,1551963449.0,1549,theweek.com,'',ayccck,0.96,58
Elizabeth Warren just introduced a bill that would defund Trump’s border wall and direct the money toward the coronavirus response in the U.S.,realplayer16,1582827157.0,1540,warren.senate.gov,'',fag7qa,0.95,73
Poll: Voters in Georgia view Pelosi more favorably than Trump,progress18,1547863298.0,1538,thehill.com,'',ahhoy1,0.95,18
"President Trump impeached for abuse of power, obstruction of Congress",progress18,1576720276.0,1533,cnbc.com,'',ecm8lh,0.94,154
Mayor Myrick: “Fuck Mitch McConnell. Every Senator needs to do this one thing. Come down here and look a 30 year employee in the eye. Who makes public sector wages to serve needy children. And tell them they're being furloughed because the cruise industry bailout added too much to the debt”,BlueEagleFly,1587771253.0,1537,twitter.com,'',g7j6by,0.98,57
"Heckler: ""Excuse me, Mr. Biden! Excuse me, Mr. Biden -- how much money did you make in Ukraine with your son?"" Joe Biden: ""I released 21 years of my tax returns. Your guy hasn't released one. What's he hiding?""",realplayer16,1577708260.0,1537,twitter.com,'',ehle1q,0.94,143
Lindsey Graham Is the Saddest Story in Washington: His fight for Brett Kavanaugh completed his transformation into Donald Trump’s slobbering manservant.,therecordcorrected,1538865385.0,1534,nytimes.com,'',9m093s,0.88,81
Scientific American Endorses Joe Biden; We’ve never backed a presidential candidate in our 175-year history—until now,progress18,1600180474.0,1533,scientificamerican.com,'',it9yo9,0.96,55
DNC Says It Will Exclude Fox News From Televising 2020 Debates,cybersecp,1551898156.0,1528,huffpost.com,'',ay2cbq,0.91,134
US Senate report says the aluminum mill that Mitch McConnell pushed for is actually a proxy for the Kremlin,giantyetifeet,1598012859.0,1527,courier-journal.com,'',idvs1h,0.98,57
"I'm a Truck Driver and I am a proud liberal (I will never support Trump). His claim that the truckers honking are ""supporting him"" are actually protesting him.",,1589581737.0,1526,self.democrats,'',gkizfn,0.95,78
Trump Flips Out After Biden Ad Rips Him For Golfing Amid Growing Death Toll,jonfla,1590412106.0,1523,huffpost.com,'',gqao7w,0.95,89
Bounce the Bunker Baby.,Popular-Way,1592051430.0,1526,i.imgur.com,'',h86njs,0.95,31
We owe an apology to the rest of the world.,michdawson,1531359676.0,1524,i.redd.it,'',8y5jcz,0.85,162
"Robert Mueller Will Indict a Lot of People in the Next 60 Days: ‘They Will Be Quite Familiar to the Average American,’ Says Former CIA Director",progress18,1548506502.0,1513,newsweek.com,'',ak0jg9,0.95,85
Former Trump advisor Steve Bannon arrested on charges of defrauding donors in fundraising scheme,progress18,1597931116.0,1517,cnbc.com,'',idak0t,0.97,110
Tumps Banana Republick of USA!,Hai_xlI,1596372129.0,1517,i.redd.it,'',i2bfnn,0.93,35
Because... greed?,VegaThePunisher,1506988144.0,1518,i.redd.it,'',73wq7p,0.75,145
The Republican-Fox News plot to have Mueller fired is gathering steam,jonfla,1513432463.0,1515,talkingpointsmemo.com,'',7k73wz,0.85,74
Poll: 60 percent say Trump bears responsibility for shutdown,progress18,1548332990.0,1510,thehill.com,'',ajby77,0.96,84
Rudy “Zombie Teeth” Gargamel today said Mueller should “stand up and be a man”.,VegaThePunisher,1533008535.0,1505,i.imgur.com,'',93b1s4,0.93,135
"Matthew Miller on Twitter: ""If Trump was running his charity as a sprawling, multi-year criminal enterprise, perhaps that’s a small clue about how he ran his business, his campaign, and now the country.""",therecordcorrected,1529118901.0,1511,twitter.com,'',8rgo3s,0.93,32
#trumpresign,ivanissac,1545581798.0,1501,i.redd.it,'',a8vuy0,0.93,31
Brett Kavanaugh Offers to Pay for Wall by Recycling His Empties,therecordcorrected,1547223556.0,1495,newyorker.com,'',aewy3x,0.93,64
Virginia will eliminate a state holiday honoring Robert E. Lee and Stonewall Jackson. It'll make Election Day a day off instead,mepper,1581091971.0,1495,cnn.com,'',f0cm62,0.98,110
CNN to Trump: You incited this,progress18,1540467573.0,1489,washingtonpost.com,'',9r9hh4,0.88,175
"Peter Daou on Twitter: ""Republicans steal babies, from breastfeeding mothers, retweet Nazis, and support bigots, attack allies, to coddle dictators, slam US law enforcement, to protect Russia... AND THE MAINSTREAM MEDIA SCREAM THAT DEMOCRATS ARE MOVING ""TOO FAR LEFT""""",therecordcorrected,1530620990.0,1480,twitter.com,'',8vrsxh,0.88,124
"The seven discarded Pennsylvania ballots Trump keeps harping about were (1) in the June primary and (2) lacking secrecy envelopes. The Trump campaign was the one that sued to require secrecy envelopes and won. Therefore, the ballots were discarded because of Trump's lawsuit.",wenchette,1601057147.0,1481,washingtonpost.com,'',izojm3,0.97,47
Obama on Trump: How hard can it be to say 'Nazis are bad'?,progress18,1536344827.0,1485,thehill.com,'',9dx3ou,0.92,164
Trump apparently didn't read Mattis' resignation letter until cable news made a big deal of it,progress18,1545922514.0,1479,theweek.com,'',a9zu5w,0.95,41
"As He Exits the House, It's Worth Noting That Paul Ryan Has Failed Spectacularly",wenchette,1545232262.0,1473,nbcnews.com,'',a7n8cv,0.97,31
The right-wing sliming of Douglas High students can’t be ignored. It’s too disgusting for that.,UWCG,1519233041.0,1468,washingtonpost.com,'',7z75mp,0.86,58
Donald Trump's unhinged press conference proved he is the most unfit person ever to be US president,ZmajLee,1487351193.0,1465,telegraph.co.uk,'',5un9lo,0.78,77
It’s Time for Joe.,SofaKingVote,1593749264.0,1467,i.imgur.com,'',hkccb6,0.93,115
9 Black Employees Are Now Suing Fox News For Racial Harassment,anutensil,1493034413.0,1460,mediamatters.org,'',678j1d,0.8,37
Top U.S. Marine orders all Confederate symbols be removed from Corps bases,progress18,1582890796.0,1456,newsweek.com,'',fatkyo,0.99,89
The one thing we can do to address gun violence -- It’s simple and straightforward. Are you ready? Here it is: Don’t vote for Republicans.,therecordcorrected,1518738310.0,1457,washingtonpost.com,'',7xunoo,0.83,165
"Kamala Harris: Trump inherited the longest economic expansion in history from @BarackObama and @JoeBiden. And then, like everything else he inherited, he ran it straight into the ground.",dolphins3,1597293933.0,1462,twitter.com,'',i8tlbk,0.95,130
BLOOOOOOMMBEEERRRRG!!!!,wokebass,1583193632.0,1458,media.discordapp.net,'',fclnyd,0.98,42
"Adam Schiff: ""It happened again. Trump insulted the press, egging on the frenzied crowd, and someone took it as license to assault a cameraman. Journalists take risks to cover the news every day. They shouldn't have to risk their safety to cover the President of the United States of America.""",therecordcorrected,1550109178.0,1454,twitter.com,'',aqegwa,0.95,58
Trump Won Because Of Lower Democratic Turnout. No Matter Who Wins The Nomination... Vote!,Anticipator1234,1565554180.0,1452,forbes.com,'',cp1nth,0.95,325
"Mark Hamill: ""Can the media PLEASE stop citing the ""conclusions"" of the Mueller Report when, in fact, we only have a three-and-a-half page interpretation by the biased Mr. Barr, who argued it's impossible for a President to obstruct justice?""",skepticalspectacle1,1553935466.0,1448,twitter.com,'',b790xw,0.91,87
Roy Moore Banned From Mall After Locals Were Troubled by His Interactions with Teen Girls,wenchette,1510617376.0,1455,newyorker.com,'',7crhng,0.91,23
"Donald Trump called asbestos poisoning a mob-led conspiracy, now his EPA won’t evaluate asbestos already in homes: The EPA will not consider the health risks of asbestos already in the environment Scott Pruitt quietly announced. Nearly 15,000 Americans die each year from asbestos-related diseases",therecordcorrected,1528382747.0,1446,newsweek.com,'',8pavck,0.95,67
"Chris Hayes: ""The alleged wannabe mass murderer in the Coast Guard googled ""civil war if Trump impeached."" Where could he possibly get such an insane idea? Oh"" - Media Matters: ""Frequent Fox News guest tells Laura Ingraham ""we are in a civil war"" suggests everyone buy guns to prepare for ""total war""",therecordcorrected,1550869642.0,1450,twitter.com,'',atmukp,0.95,124
Jimmy Carter: Kavanaugh is 'unfit' to be a Supreme Court justice,BlankVerse,1539972537.0,1448,thehill.com,'',9pmcpz,0.92,79
Hypocrisy Hits Home: Trump’s Allies Suddenly Care About Decorum And Unity After Pelosi Tears Up SOTU Speech,jonfla,1580920181.0,1440,talkingpointsmemo.com,'',ezc3hd,0.96,171
"Jon Favreau on Twitter: ""The crowd at Trump’s rally chanting “send her back” after the President viciously and dishonestly attacked Ilhan Omar is one of the most chilling and horrifying things I’ve ever seen in politics.""",therecordcorrected,1563457727.0,1447,twitter.com,'',cesq1p,0.95,114
Sen. Jeff Merkley on Twitter: Republican leaders gave away $4 billion dollars of Wisconsin taxpayers' money to a foreign company… and all they got was a stupid red hat.,progress18,1548939856.0,1446,twitter.com,'',alp8p2,0.97,25
:O,paddycukor,1542393195.0,1437,i.redd.it,'',9xotqv,0.94,62
"Rep. Joe Kennedy III: ""Last week HouseDemocrats funded intel agencies, strengthened electoral security, gave over 30 million workers a raise & rejected racism. Meanwhile Senate GOP blocked a vote to get 9/11 first responders medical care. Tell me again which party gets to claim mantle of patriotism""",therecordcorrected,1563831509.0,1438,twitter.com,'',cgjfiq,0.96,69
McConnell Challenger Amy McGrath (D) Raises Record $2.5 Million on First Day of ‘Ditch Mitch’ Campaign,progress18,1562764227.0,1435,mediaite.com,'',cbgir5,0.97,64
Pete Buttigieg on twitter-- The president is threatening to veto funding for the U.S. military unless it honors men who went to war against the U.S. military.,1000000students,1595514478.0,1439,mobile.twitter.com,'',hwglg3,0.96,67
Cult 45,CosmicPerspectiveATX,1533868344.0,1436,i.redd.it,'',9630o1,0.95,65
"If you’re in Texas, remember to vote Beto!!!",Otaku-Gurl,1541463819.0,1439,self.democrats,'',9ujbic,0.86,69
"Trump mocks Senator Feinstein following reports an alleged Chinese spy worked for her -- 5 years ago, the FBI informed her that her driver might be a spy for China, and she fired him. Meanwhile, 40% of Trump's original foreign policy advisors are suspected of spying for Russia. Literally 40%.",skepticalspectacle1,1533487962.0,1427,usatoday.com,'',94t99e,0.95,26
"My sister is running for office in Glynn County, GA, where Ahmaud Arbery was killed. She won her primary on Tuesday, and will face the Republican candidate in the fall. I just wanted to say how proud I am of her. She's 27",TheThiege,1591995709.0,1431,self.democrats,'This is her website if you are interested: https://www.taylorforglynn.com/',h7t2qw,0.98,34
Just Sealed My Vote For Biden! Let’s Go Joe!,airplanesarecool30,1601930822.0,1430,i.imgur.com,'',j5rjgg,0.93,54
"How Rep. Katie Porter, at a COVID-19 hearing, may have saved your life - 'The congresswoman had the head of the CDC in front of her & she wouldn’t let up.'",anutensil,1584069072.0,1431,azcentral.com,'',fht2wr,0.98,52
"Trump campaign chief of staff was arrested, charged with campaign-finance violations in 2016",1000000students,1591589408.0,1424,businessinsider.com,'',gyrnfa,0.98,72
The Most Racially Divisive Member of Congress Just Lost His Primary; Rep. Steve King defeated in GOP primary,progress18,1591155096.0,1419,vice.com,'',gvm7lz,0.98,79
It's on: Nobody Is Above the Law—Mueller Firing Rapid Response,Autodidact2,1541633618.0,1422,trumpisnotabovethelaw.org,'',9v4on1,0.91,65
"Paul Krugman on Twitter: ""If there's one thing that is absolutely clear after the past 2 years on health care, it is that Rs have no alternative to the ACA, and never will. Their plan is for people to get sick, go bankrupt, and die.""",therecordcorrected,1545190688.0,1414,twitter.com,'',a7io8v,0.95,148
Pete Buttigieg: It feels good to visualize the moment when Vice President Mike Pence is replaced by Vice President Kamala Harris.,dolphins3,1597250224.0,1413,twitter.com,'',i8h1my,0.94,49
Shock Fox News Poll: 56 Percent of Americans Blame Trump Rhetoric for Mass Shootings,progress18,1565879023.0,1416,mediaite.com,'',cqqi1f,0.96,43
I miss when our elected officials actually governed,SketchesFromMidgard,1595775881.0,1413,i.imgur.com,'',hy8fek,0.93,157
"There must be a reckoning: President Trump committed another grotesque violation of the Constitution on his trip to Scotland, when he used $70,000 in public money to pay for rooms at a hotel he owns. This kind of bald corruption is chewing at the roots of the United States as a functioning nation.",therecordcorrected,1532053888.0,1409,theweek.com,'',90c5qi,0.92,61
That man got murdered in live TV. 400 mil wasted,coffeepi,1582174421.0,1402,youtu.be,'',f6nw21,0.97,278
ACLU says planned national emergency declaration is 'clear abuse of presidential power',progress18,1550231004.0,1398,thehill.com,'',aqvrcy,0.97,66
"Justice officials say AG Sessions spoke with Russian ambassador during presidential campaign, may have lied about it",Anticipator1234,1488421807.0,1393,washingtonpost.com,'',5x0l35,0.83,107
Trump Threatens Protesters With Violence If They Appear At Oklahoma Rally,Learach,1592577260.0,1385,i.redd.it,'',hc1rc3,0.96,222
Jimmy Carter: U.S. Is an ‘Oligarchy With Unlimited Political Bribery’ – Rolling Stone,data2dave,1533167066.0,1392,rollingstone.com,'',93uamg,0.94,66
Donald Trump dared Nancy Pelosi to cancel his State of the Union speech. So she did.,therecordcorrected,1548280819.0,1392,cnn.com,'',aj53r0,0.95,76
"This is why I say f*ck your civility, Republicans.",Goose_in_the_Gallows,1530133614.0,1388,i.redd.it,'',8udddt,0.87,259
GOP senators come out and say it: The Trump administration is covering up Khashoggi’s killing,progress18,1544013368.0,1387,washingtonpost.com,'',a3bwfu,0.96,33
Barack Obama dons a Santa hat and hands out gifts in surprise visit to D.C. children’s hospital,skepticalspectacle1,1545275525.0,1389,i.imgur.com,'',a7tr11,0.97,63
"James Comey on Twitter: ""This Republican Congress has proven incapable of fulfilling the Founders’ design that “Ambition must ... counteract ambition.” All who believe in this country’s values must vote for Democrats this fall. Policy differences don’t matter right now. History has its eyes on us.""",therecordcorrected,1531888920.0,1387,twitter.com,'',8zsew7,0.9,97
"BREAKING: Democrats have officially flipped 450 state leg seats since Trump was elected! From Medicaid expansion to LGBTQ rights to raising the minimum wage, these Democrats are improving people’s lives every day. Keep the blue wave rolling!",GettingPhysicl,1589940832.0,1379,twitter.com,'',gn2ojl,0.96,53
Who Paid?,skepticalspectacle1,1538705490.0,1384,i.imgur.com,'',9li9j5,0.9,87
A political cartoon: GOP strategy - distract their voters,vrphotosguy55,1525227148.0,1383,i.imgur.com,'',8gdy9n,0.92,57
"The US is losing its world superpower status due to its failure to lead on the Covid-19 crisis – and this time, it might not recover",LisaMck041,1585400587.0,1380,independent.co.uk,'',fqjsm9,0.93,111
"In Scathing Letter, More Than 80-Percent of Faculty at Bill Barr’s Law School Call for His Censure and Resignation",paone22,1593027223.0,1382,lawandcrime.com,'',hf7pni,0.97,31
"Bette Midler on Twitter: ""NY Attorney General has ordered the Trump Foundation to dissolve. It’s always SAD to see a charitable organization fold, especially one that gave so much to the children— Ivanka, Eric, and Don Jr.""",therecordcorrected,1545316853.0,1377,twitter.com,'',a7yjnx,0.96,22
"Kamala Harris on Twitter: ""Remember that this president is an unindicted co-conspirator in a felony criminal investigation and should not have the ability to appoint someone to a lifetime position on the Supreme Court. Kavanaugh's hearing should be delayed until the investigation is resolved.""",therecordcorrected,1535946360.0,1379,twitter.com,'',9ci6ac,0.93,71
Just saying,tonyjcole94,1527261365.0,1372,i.redd.it,'',8m2j1d,0.91,113
Democrat Jaime Harrison again outraises GOP incumbent Lindsey Graham in SC Senate race,wenchette,1595263930.0,1374,postandcourier.com,'',huos96,0.98,49
Republican Strategist Rick Wilson shares some truth,jtdusk,1496069549.0,1372,i.redd.it,'',6e0oan,0.88,92
"Most Americans think Trump blew coronavirus response and now fear the country will reopen too quickly, poll reveals",JLBesq1981,1587138664.0,1372,independent.co.uk,'',g34kv6,0.97,67
And Now a Message About Sacrifice,wenchette,1590353268.0,1369,i.imgur.com,'',gpx3jh,0.94,81
Democrats raise more money Sunday than during every 2020 primary debate or election,,1591047383.0,1367,theweek.com,'',gutmhj,0.97,106
Trump Has Spent 278 Years Of Presidential Salary On Taxpayer Funded Golf Trips,discocrisco,1566089238.0,1362,politicususa.com,'',cruj9t,0.96,102
Poseidon For Biden!,PersnickeyPants,1599443176.0,1357,i.redd.it,'',inyjnp,0.95,58
"Joe Biden on Twitter: Let me be very clear: No one is expendable. No matter your age, race, gender, religion, ethnicity, sexual orientation, or disability. No life is worth losing to add one more point to the Dow.",progress18,1585142689.0,1362,twitter.com,'',foq7tq,0.83,157
Nancy Pelosi says House will vote to limit Trump's war powers on Iran as tensions grow,progress18,1578313946.0,1359,usatoday.com,'',ektk3t,0.97,63
"Pentagon concerns mounting about Trump’s proposed parade - The parade could cost anywhere between $3 million to $50 million, the first official said. ""We don't have troops & units sitting around waiting to do a parade,"" a defense official directly familiar with initial planning efforts said.",anutensil,1519048859.0,1361,thehill.com,'',7ymtf1,0.91,90
This is a reminder.,SofaKingVote,1596866097.0,1358,i.imgur.com,'',i5u1ae,0.96,52
Biden tells teachers they have 'the most important' job on same day Trump says they teach children to ‘hate their country’,,1594037560.0,1358,independent.co.uk,'',hm6iew,0.97,74
"AOC: ""After I forced myself into a cell w/ women&began speaking to them, one of them described their treatment at the hands of officers as “psychological warfare” - waking them at odd hours for no reason, calling them wh*res, etc. Tell me what about that is due to a “lack of funding?”""",therecordcorrected,1562093874.0,1357,twitter.com,'',c8d7d0,0.94,84
"Cheri Jacobus: ""You marked rental applications with a ""C"" for ""colored"" to deny them apartments. DoJ sued you for racial discrimination twice. You settled twice. You refused to denounce the KKK. You tweeted fake black crime stats from a white supremacist site. SIT DOWN!"" - Donald J. Trump: ""Afri...""",therecordcorrected,1549902062.0,1360,twitter.com,'',aphux0,0.96,47
Hillary Clinton: Is anyone surprised that the man who criticized John McCain belittles those who serve our country? You know who honors our military? @JoeBiden.,dolphins3,1599229599.0,1355,twitter.com,'',imgwan,0.93,58
Trump Livid After California Allows Statewide Mail-In Voting: ‘These Votes Must Not Count’,jonfla,1589199138.0,1348,talkingpointsmemo.com,'',ghmdxq,0.97,129
"Chris Hayes on Twitter: ""They literally ran an entire campaign about their opponent’s supposedly sloppy handling of classified material."" -- Josh Dawsey on Twitter: ""It's not just Rob Porter. 13 months in, dozens at White House lack permanent security clearances, including Jared Kushner. """,therecordcorrected,1518188214.0,1356,twitter.com,'',7wdxyq,0.89,35
Trump said he would take on the drug companies. He lied. Trump said he would provide health insurance to everyone. He lied. Trump said he wouldn't try to cut Social Security like Paul Ryan. He lied. Enough of Trump's lies. Let's end Republican control of Congress on Nov. 6.,,1540249730.0,1352,twitter.com,'',9qj3pw,0.94,60
Kamala Harris is Joe Biden's pick for vice president,dolphins3,1597178527.0,1340,latimes.com,'',i7zoj8,0.9,570
A trend emerges. He can finally take credit for something.,VegaThePunisher,1515846916.0,1347,i.imgur.com,'',7q48bc,0.82,166
"LOL: ""Moscow Mitch"" is Taking Over McConnell's Life -- KEEP IT UP!",skepticalspectacle1,1565647676.0,1343,youtu.be,'',cpjgab,0.96,67
Trump’s failed shutdown strategy produced an even worse deal than he started with: The fact that Republicans signed off shows how little leverage they have.,therecordcorrected,1550062810.0,1346,washingtonpost.com,'',aq6ceb,0.95,76
"Republican voters don't see racism, sexism, climate change or gun violence as big problems in the U.S.",therecordcorrected,1539648196.0,1344,newsweek.com,'',9oic0a,0.86,165
Republicans who held 33 hearings on Benghazi complain that Cohen’s testimony was a waste of time,madam1,1551403546.0,1347,thinkprogress.org,'',avysq1,0.97,49
"Weeping Nazi started off as a “men’s rights activist,” which is no huge surprise - Christopher Cantwell's trajectory from ""men's rights"" to white supremacy is sadly typical of the alt-right",anutensil,1503052494.0,1336,salon.com,'',6ugzhc,0.62,181
GOP Women In South Carolina Are 'Embarrassed' By Lindsey Graham And Flocking To Democrats,everetterice,1576955367.0,1335,politicususa.com,'',edtwxf,0.97,134
"Disapproval of Donald Trump climbs higher as coronavirus death toll nears 100,000 in U.S.",,1590511693.0,1335,newsweek.com,'',gr0nsq,0.97,168
An absolute travesty. He will get voted out in November,sweetrebel88,1599490895.0,1332,i.redd.it,'',io8z3c,0.94,47
This Is the Moment of Truth for Republicans: The GOP can either defend the United States or serve the damaged and defective man who is now its president.,therecordcorrected,1531830713.0,1328,theatlantic.com,'',8zkpzj,0.93,61
"Regarding Politics in General, & Political Discussion -",VegaThePunisher,1522246123.0,1334,i.imgur.com,'',87s6eb,0.88,611
Trump’s Niece Helped NYT Expose His Massive Tax Fraud Schemes,jonfla,1592224532.0,1332,talkingpointsmemo.com,'',h9fgz3,0.98,46
And just like that... I have a new favorite quote,tb1649,1541552135.0,1334,i.redd.it,'',9uuffv,0.93,12
Leaked report suggests millions could lose coverage under GOP health proposal,dangzal,1488112360.0,1332,vox.com,'',5w9wm9,0.86,68
How far we’ve come...,EggfooVA,1599873855.0,1328,i.imgur.com,'',ir3iwl,0.95,61
"Elizabeth Warren: ""We need to call it out: Fox News is a hate-for-profit machine that gives a megaphone to racists and conspiracists.""",skepticalspectacle1,1565138009.0,1335,twitter.com,'',cmypki,0.92,70
Michelle Obama Launches Voter Registration Campaign,wenchette,1532002131.0,1330,people.com,'',9059va,0.91,126
Confidence in the U.S. President.,VegaThePunisher,1530972919.0,1332,i.imgur.com,'',8wtge0,0.9,220
Who else misses these two bros?,Benjynn,1536434309.0,1325,i.redd.it,'',9e6po6,0.94,38
Could Kanye West Be Charged With Electoral Fraud? Two states have determined the majority of signatures on the rapper’s presidential petitions are invalid.,wenchette,1597100211.0,1323,vanityfair.com,'',i7fri3,0.98,92
"The wife of one of Donald Trump’s sons and the girlfriend of another one are each receiving $180,000 a year from the president’s reelection campaign. But that’s none of our business.",walter1950,1587224681.0,1329,self.democrats,'But that money isn’t being handed out in the open. They’re each getting paid through the company run by Trump’s campaign manager in order to avoid the public disclosure',g3pkn0,0.97,66
WATCH: Tucker Carlson Tells Dutch Historian To “Go Fu*k Yourself” – Meltdown Interview Leaked,JimHeathTV,1550709667.0,1322,jimheath.tv,'',aswbfo,0.97,58
"""Ever wonder why Trump supporters ignore his countless lies? Because they think like 5 year olds""",notpreposterous,1587826668.0,1319,youtube.com,'',g7utwo,0.94,254
President Trump’s reelection campaign is threatening legal action against television stations in key battleground states if they continue airing an ad cut by the liberal super PAC Priorities USA alleging that the president called the coronavirus a “hoax”,DoremusJessup,1585183324.0,1317,thehill.com,'',fp1wwz,0.96,196
Quantum racism,PsychologicalGlass1,1593399741.0,1312,i.redd.it,'',hhs3d8,0.94,53
"In Texas, where 750 polling places have closed since 2012, voters wait in line for hours; ""This is what voting in Texas looks like after Supreme Court gutted the Voting Rights Act.""",progress18,1583332025.0,1310,theweek.com,'',fddqwy,0.98,86
Good Idea,Jovi_Grace,1596759443.0,1305,i.redd.it,'',i53lgi,0.94,32
Mueller getting a shout out on Jeopardy today,skepticalspectacle1,1545985743.0,1306,i.redd.it,'',aa8j44,0.96,26
Treason of the Hour: Trump offered to stay quiet on Hong Kong protests if China went after Biden.,njmaverick,1570146741.0,1312,twitter.com,'',dczehx,0.96,59
"Donald Trump is Not 'Unwitting Agent' to Russia, 'Knows Exactly What He is Doing' Says House Intelligence Democrat",progress18,1547643688.0,1313,newsweek.com,'',agkwx4,0.95,44
Macron wins,BerryBomB101,1494180406.0,1303,bbc.co.uk,'',69spjx,0.78,107
"GOP strategist admits: House Dems look ""like America & our future"" but House Republicans look ""like Board meeting of 1950s corporation... basic law of politics: be for the future not past.""",wenchette,1546696462.0,1302,twitter.com,'',acubjw,0.96,43
"New Jersey Governor Signs Bills Restoring Voting Rights To More Than 80,000 People",,1577120329.0,1296,npr.org,'',een620,0.98,89
