"This is President Barack Obama. He did not sell Americans out to the telecom lobby, but instead called upon on the FCC to take up the strongest possible rules to protect net neutrality, which they did at his instruction in 2015.",BumBiddlyBiddlyBum,1512175468.0,54440,upload.wikimedia.org,'',7gzh5a,0.68,441
Join The Battle For Net Neutrality! Don't Let The FCC Destroy The Internet!,skepticalspectacle1,1511296493.0,30251,battleforthenet.com,'',7ekych,0.91,19
Republican ‘pro-life’ congressman slept with patients and paid for their abortions: ‘God has forgiven me’,skepticalspectacle1,1515245659.0,19737,nova-magazine.net,'',7oj9cv,0.85,861
It would not be polite to ask the President to walk farther than 100 feet without a golf cart.,VegaThePunisher,1521594128.0,19072,i.imgur.com,'',85y5ja,0.75,80
"Brian Klaas: ""The President is openly attempting to go after the owner of a private business because that person also owns a newspaper that accurately reports unflattering stories about the White House. This is literally what Erdogan & Putin did. Republicans in Congress are enabling this too.""",therecordcorrected,1522761451.0,17383,twitter.com,'',89dmy7,0.81,467
Man who fueled Trump's voter fraud conspiracy is registered in 3 states,PrestoVivace,1485828752.0,15332,businessinsider.com,'',5r5c79,0.72,336
He will stop at nothing.,VegaThePunisher,1504731416.0,14957,i.redd.it,'',6yigso,0.77,433
What a REAL President Looks Like.,dr_isk_16,1518322248.0,14053,i.redd.it,'',7wqnk6,0.64,810
"Tell them, Mr. President!",VegaThePunisher,1536532535.0,12537,i.imgur.com,'',9eh6xn,0.81,214
House Dems vs House GOP: Diversity on Display,Tribat_1,1546539514.0,11691,i.redd.it,'',ac8fg7,0.79,565
Sean Spicer admits to White House coordination with Fox News on DNC murder conspiracy reports,anutensil,1501599547.0,11516,rawstory.com,'',6qwrmn,0.78,313
A photo that will go down in history,,1538084233.0,10871,i.redd.it,'',9jgzdi,0.8,365
"Why is it easier to blame 150,000,000 Americans being 'lazy' rather than 400 Americans being greedy.",skepticalspectacle1,1512787882.0,10604,i.redd.it,'',7ik4sm,0.84,217
"Thank you, Mr. President.",VegaThePunisher,1503749615.0,10314,i.redd.it,'',6w589t,0.54,386
"Lawrence O'Donnell on Twitter: ""The president who did NOT run toward the sound of the guns in Vietnam 50 years ago, now labels an officer with a handgun a ""coward"" for not running toward the sound of an AR15. Trump is by far the most cowardly president in history.""",therecordcorrected,1519478533.0,9767,twitter.com,'',7zwjmf,0.8,252
I want everyone to take a good hard look at this and realize that our president is doing everything he can to destroy free press.,,1487456170.0,9512,i.reddituploads.com,'',5uuz60,0.71,426
"Trump: Texas shooting result of ""mental health problem,"" not US gun laws...which raises the question, why was a man with mental health problems allowed to purchase an assault rifle?",squidzula,1509970631.0,9404,cnn.com,'',7b4roi,0.78,1279
"Stephen King on Twitter: ""Fuck your wall. Split that 5 billion between at-risk children who don’t have lunches and vets who can’t get proper medical and psychological treatment. Fuck your vanity project. Do something good for once.""",therecordcorrected,1544711351.0,9157,twitter.com,'',a5tyhd,0.84,192
"Trump Has Spent More Than Three Months This Year At His Properties, Adding to Ethics Concerns - ""Americans, on average, get 15 paid vacation days a year, but use only 12. Trump has taken more than 100.""",anutensil,1514289544.0,8548,commondreams.org,'',7m7eqi,0.85,206
"White House claimed Trump had a day full of meetings, but the truth emerges with a swamp selfie: One problem for POTUS and his staff. The Newsmax CEO tweeted a photo and it became clear Trump was not in high-level meetings, he was playing golf.",therecordcorrected,1490000459.0,8147,dailykos.com,'',60fg8m,0.8,81
Democrat Doug Jones wins election to US Senate from Alabama,progress18,1513135930.0,8107,apnews.com,'',7jgg41,0.84,169
Can we at least agree on this?,halal_and_oates,1531238196.0,8042,i.redd.it,'',8xqhk5,0.82,740
Democrats offer amendment to tax plan to ensure corporations use savings to increase employee wages; every Republican votes no,zodar,1512082903.0,7166,twitter.com,'',7gqgrb,0.89,443
Can we take a break from Donny for a sec and acknowledge how stupid this is?,defnotbot,1601574680.0,6836,i.redd.it,'',j3djx8,0.85,855
"Adam Schiff: ""If the President wanted to know what happened, which was self-reported by the NSA, he could ask. Instead he watches TV and tweets nonsense, as if he’s a Fox pundit, and not head of the Executive Branch. Another day. Another false claim. Wake up, GOP. Silence is complicity.""",therecordcorrected,1530759052.0,6491,twitter.com,'',8w74z3,0.86,77
Trump bans American-born man from reentering US who testified against him in Russia investigation.,KubrickIsMyCopilot,1508710948.0,6306,nationalreview.com,'',783fij,0.85,136
‘We are stronger than you’: VA governor blasts ‘pretend patriot’ white supremacists for Charlottesville violence,anutensil,1502579631.0,6194,rawstory.com,'',6tbo3z,0.85,181
"Weak Treasonous Rat. Never forget which party elected this traitor, and never let the press whitewash how much he and he's party has betrayed this country",,1531768683.0,5805,i.redd.it,'',8zdv8e,0.79,320
"Remember when people like Sarah Palin shit their pants when Obama traveled on the taxpayer's dime? Trump is about to ""bankrupt"" the U.S. Secret Service. Where are those complaints now?",Anticipator1234,1503369670.0,5796,washingtonpost.com,'',6v859r,0.86,346
The Press Conference,jaydawg69,1541726223.0,5749,i.redd.it,'',9vg0i0,0.82,103
American Disasters.,VegaThePunisher,1508095298.0,5735,i.redd.it,'',76l1hc,0.73,310
The Democrat Economic Curve.,VegaThePunisher,1515531210.0,5564,i.imgur.com,'',7pa5r3,0.76,554
The situation summed up.,VegaThePunisher,1531614612.0,5432,i.imgur.com,'',8yxtxa,0.78,682
House Republicans pull health care bill,wenchette,1490384675.0,5154,cnn.com,'',61b632,0.82,245
"On tape: GOP Leader ""I think Putin pays [...] Trump"". Paul Ryan ""What’s said in the family stays in the family""",zryn3,1495061593.0,5131,washingtonpost.com,'',6bs97g,0.83,200
"No President facing criminal indictment for violation of Federal laws, potentially including treason, should be allowed to nominate a Supreme Court Justice",jonfla,1530199909.0,5112,talkingpointsmemo.com,'',8ukhf3,0.85,231
"""This is not Fox."" Joy Reid shuts down Trump adviser who implies Clintons killed someone",anutensil,1516022369.0,5106,shareblue.com,'',7qjm8m,0.79,336
Proud to be a Liberal!,jaydawg69,1537028946.0,4976,i.redd.it,'',9g2sqt,0.78,561
"Trump 'likely obstructed justice' in Comey firing, could be impeached, Brookings Institute says",progress18,1507640580.0,4952,cnbc.com,'',75gw1x,0.77,109
Stephen Miller,CosmicPerspectiveATX,1533762659.0,4844,i.redd.it,'',95q3yh,0.84,169
"Oprah for President – another billionaire pseudoscience pusher looking for a job: Ms. Winfrey has been a strong supporter of Jenny McCarthy, who is simply a member of the anti-vaccine religion. Oprah foisted onto the world Dr. Mehmet Oz, one of the most reprehensible pushers of scientific nonsense.",therecordcorrected,1515679219.0,4724,skepticalraptor.com,'',7po8ty,0.89,428
"It’s Not Just Jeff Sessions: The FBI Must Investigate Scott Pruitt for Lying to Congress. The new EPA head used private email to conduct government business in his prior job, but he didn’t say that when asked by the Senate. If Hillary Clinton was investigated for lying, he should be too.",monsoony,1488545226.0,4661,thedailybeast.com,'',5xa54i,0.77,112
My wife being sworn in as first woman of color to serve on our NJ town’s council,ISayISayISitonU,1546612271.0,4483,i.redd.it,'',acio6v,0.93,160
Trump Already Had His Parade. It Was In Charlottesville.,Mynameis__--__,1518111865.0,4399,i.redd.it,'',7w6kzn,0.78,292
More Americans would be alive today if Hillary were President.,SofaKingVote,1595379956.0,4334,i.imgur.com,'',hvk2au,0.82,191
Nordstrom drops Ivanka Trump-branded clothing and shoes,CharlieDarwin2,1486120084.0,4221,washingtonpost.com,'',5rtc9c,0.75,103
The GOP in a nutshell,k_meme,1598199009.0,4127,i.redd.it,'',if5trg,0.87,141
ShickenChit.,VegaThePunisher,1535409839.0,4077,i.imgur.com,'',9atjxa,0.88,281
“Obama golfed too much.”,VegaThePunisher,1532479943.0,3957,i.imgur.com,'',91n6f6,0.9,210
Rednecks for biden! Let's make Nc blue!!,Notorious-Meszaros,1594252575.0,3919,i.redd.it,'',hnsjlk,0.88,184
Authoritarianism has come to America.,VegaThePunisher,1541856580.0,3864,i.imgur.com,'',9vuaqr,0.86,246
Magic Mittens was before his time; now he’s a Renaissance Man.,BidenMobile,1594482750.0,3775,i.imgur.com,'',hpc95g,0.96,120
Gen Z here voting in the midterm because fuck the GOP,unknownM1,1539898238.0,3727,i.redd.it,'',9pdh8h,0.81,269
That was a close one.,Gammont360,1601656350.0,3677,i.redd.it,'',j3xtid,0.96,115
That didn’t age well,ALostPaperBag,1517809050.0,3660,i.redd.it,'',7vcosk,0.91,104
"George Takei: ""Folks are acting as though we had no choice but to use tear gas at our border. But we have known about this group approaching for weeks. We could have had buses and agents ready to process people in an orderly and humane way. Instead, Trump closed the border and gassed them.""",therecordcorrected,1543237862.0,3550,twitter.com,'',a0j7hv,0.83,267
I weighed all the options and in conclusion,miraclej0nes,1599689400.0,3524,i.redd.it,'',ipqe0u,0.92,226
"Dan Shapiro: ""Yes, Obama congratulated Putin in 2012. That was before Russia invaded Ukraine, before Russia deployed to Syria to back Assad's genocide, before Russia interfered in US elections, before Russia launched a CW attack in the UK. Pay attention: Trump's own people know he blew this.""",therecordcorrected,1521677214.0,3504,twitter.com,'',86782s,0.89,91
Why is this so hard for people to understand?,mb83,1598898590.0,3496,i.redd.it,'',ik3lfa,0.89,363
Honestly!,letstalkaboutit24,1601761942.0,3494,i.redd.it,'',j4niml,0.91,277
"""These Titanium legs don't buckle.""",TRMact9,1594418192.0,3489,i.redd.it,'',hoy3k0,0.96,164
Department of Homeland Security.,VegaThePunisher,1540659880.0,3423,i.imgur.com,'',9rvuet,0.9,204
At Indiana University today.......,DarkBlue222,1600902719.0,3388,i.redd.it,'',iyljfq,0.93,147
He also attacked law enforcement over a case on air without disclosing the suspect was his lawyer.,VegaThePunisher,1523909125.0,3345,i.imgur.com,'',8cqke5,0.88,190
America has never seen a party less caring than 21st-century Republicans,wenchette,1491047718.0,3333,theguardian.com,'',62sa3w,0.75,96
BREAKING NEWS: Donald Trump makes tremendous and historic recovery,Bite_Tricky,1601825952.0,3272,i.redd.it,'',j50wzl,0.94,76
Donald Trump’s Plan to Replace Obamacare Does Not Exist,CharlieDarwin2,1484917426.0,3234,slate.com,'',5p3r24,0.74,135
"Clara Jeffery on Twitter: ""Those 5,000 troops sitting on the border waiting for a few hundred bedraggled migrants to show up a month from now could be digging fire lines and helping to evacuate people and livestock from California instead.""",therecordcorrected,1542041911.0,3151,twitter.com,'',9wfpy4,0.91,132
"Bill Clinton banned assault weapons in 1994, & mass shooting deaths declined by 43%. Republican’s purposely let the bill expire in 2004, and as a result mass shootings increased 239%. I didn't know this until just 10 minutes ago. A little ashamed, a little more angry as well!",worldgoes,1564950236.0,3091,twitter.com,'',cm145b,0.93,160
"""If you ain't first, you're last.""",RDay,1540604382.0,3083,i.redd.it,'',9rqlcv,0.91,89
Conservatives Shocked To Discover That Milo Yiannopoulos Is A Terrible Human Being,anutensil,1487632802.0,3040,mediamatters.org,'',5v7yop,0.78,100
Senator Kamala Harris Announces Her Bid for President in 2020,griffinhazzard,1548076100.0,3017,i.redd.it,'',ai9xph,0.82,642
Changing a light bulb?,backpackwayne,1599069545.0,2978,preview.redd.it,'',ilbuiw,0.95,69
"Kaitlan Collins on Twitter: ""With President Trump seated before him, French President Macron says, ""Patriotism is the exact opposite of nationalism. Nationalism is a betrayal of patriotism. By saying 'our interests first'...we erase what a nation hold dearest...its moral values.""""",therecordcorrected,1541947134.0,2938,twitter.com,'',9w48mi,0.9,93
Spread it like wildfire,progress18,1591353514.0,2921,i.redd.it,'',gx25s5,0.92,73
"‘Worst start of any Presidency in history’: Dan Rather says Trump is a disaster without precedent, as he has faced both significant legal and legislative defeats, and has also been dogged by constant scandals and controversies.",therecordcorrected,1490625092.0,2917,rawstory.com,'',61sh36,0.81,115
Trump Will Require All EPA Science to Be Screened by Political Staffers - Reminder: This is the guy who thinks climate change is a Chinese hoax.,anutensil,1485434795.0,2898,motherjones.com,'',5q9y6f,0.87,99
Trump is ‘furious’ with New York Gov. Cuomo because his pandemic press conferences are overshadowing him,realplayer16,1585505150.0,2890,rawstory.com,'',fra7fn,0.94,161
"Mark Hamill: ""I get a real sense of satisfaction that due to your Russian-backed election, you haven't had a single moment to enjoy your ""victory"". Not a day goes by w/out your paranoid panic over being exposed as the illegitimate fraud you are."" – Donald J. Trump: “@FoxNews Poll numbers plummet..”",therecordcorrected,1529803468.0,2858,twitter.com,'',8teh5f,0.86,150
Thank you President Obama for making unpopular decisions at the time that made our economy what it is now,Anthonym82,1538744998.0,2847,imgur.com,'',9lm4z7,0.82,56
"The coronavirus is on its way to kill 10 times more people than H1N1, in 6 months. Both parties are not the same.",syafalexander,1592489563.0,2845,i.redd.it,'',hbfcjw,0.96,110
Where’s Mitch?!? 😤🤬,berryskye,1597426865.0,2818,i.redd.it,'',i9qirw,0.97,154
RNC Concerned for Kyle Rittenhouse,ggbuttstead,1598488755.0,2811,i.redd.it,'',ihb4ln,0.88,358
The Notorious R.G.B.,VegaThePunisher,1545531845.0,2811,i.imgur.com,'',a8qzoi,0.89,115
Keep in mind that both parties are not the same.,VegaThePunisher,1520261289.0,2801,i.imgur.com,'',826f9s,0.93,104
When an orange baboon tries to embarrass you on camera but you flip it on him and make him meltdown on national television.,VegaThePunisher,1544560122.0,2712,i.imgur.com,'',a5an14,0.89,268
Dems win the house!,thebobbuttons,1541598763.0,2683,i.redd.it,'',9uzlb6,0.87,212
Time for a Fact Check.,VegaThePunisher,1529277766.0,2686,i.imgur.com,'',8rux9t,0.9,94
"Yeah. How ""weird.""",DonyellTaylor,1600032391.0,2655,i.redd.it,'',is75f2,0.96,112
A hill worth dying on.,RabackOmama,1591529176.0,2652,i.redd.it,'',gyam1g,0.97,116
Sign if you agree: All 50 states should include a vote-by-mail option for November's election.,everetterice,1585010134.0,2642,dailykos.com,'',fnvi7v,0.96,46
"Trump literally called cameras into the Oval Office last month and said ""if we don't get what we want...I will shut down the government,"" and then it happened, and the mainstream press is still #bothsidesing it.",worldgoes,1546911664.0,2600,twitter.com,'',adp0ox,0.93,92
Found this on Etsy,lib2tomb,1599340312.0,2596,i.redd.it,'',in93az,0.96,35
"Mark Warner on Twitter: ""Every member of Congress, Republican and Democrat, needs to speak up in defense of the Special Counsel. Now.""",therecordcorrected,1521300454.0,2592,twitter.com,'',854erz,0.92,54
"An Irish view of the US: ""Donald Trump has destroyed the country he promised to make great again | The world has loved, hated and envied the US. Now, for the first time, we pity it.""",KubrickIsMyCopilot,1588557410.0,2583,irishtimes.com,'',gd2sia,0.94,122
When class trumps Trump.,MrDollyLlama,1594132014.0,2581,i.redd.it,'',hmvihx,0.95,114
This is a picture of NRA President Wayne Lapierre with a confessed Russian Spy,skepticalspectacle1,1546746727.0,2566,i.redd.it,'',ad203z,0.92,117
"This is Congresswoman Ruth Buffalo, the first Native American Democratic woman elected to the North Dakota legislature, who was sworn in yesterday.",,1543946131.0,2566,i.redd.it,'',a331sa,0.95,34
Never forget. We're in this mess because the right lost their minds when America elected a black man as president.,ArbysKnights,1592623825.0,2559,i.redd.it,'',hceyb4,0.89,256
Always remember how good of buddies they really were,Xfiles1987,1593872420.0,2536,i.redd.it,'',hl41wo,0.94,42
Mrs. Thomas' last wish 😬,definehappyness,1596904817.0,2526,i.redd.it,'',i626cu,0.96,84
Wall of racists,SoLoDas,1546797541.0,2520,i.redd.it,'',ad7w5r,0.9,140
This is somehow Obama's faulti,_foxyboy68,1595563984.0,2523,i.redd.it,'',hwv0ny,0.96,100
VOTE!,jaydawg69,1537973008.0,2513,i.redd.it,'',9j33uv,0.91,124
"Starve the beast, unless it’s a beast.",Popular-Way,1592391708.0,2500,i.imgur.com,'',hap0kf,0.96,168
OBAMA: 'There's a pattern' of Republicans running the economy 'into the ground' and Democrats having to 'come back and clean things up',BlankVerse,1540309982.0,2496,businessinsider.com,'',9qq9aw,0.84,165
"Tammy Duckworth on Twitter: ""We don't live in a dictatorship or a monarchy. I swore an oath—in the military and in the Senate—to preserve, protect and defend the Constitution of the United States, not to mindlessly cater to the whims of Cadet Bone Spurs and clap when he demands I clap""",therecordcorrected,1517894083.0,2482,twitter.com,'',7vl4gs,0.9,136
"BREAKING: The Secret Service just signed an “emergency order” to rent $45,000 worth of GOLF CARTS this weekend in Sterling, Virginia, home of Trump National Golf Club, in case you were wondering what Trump will be up to while thousands of Americans die.",walter1950,1585797413.0,2468,self.democrats,"'No surprise,  doesn’t even pretend to show leadership'",ftew7h,0.96,130
"Anyone not voting this year should never claim to be interested in politics again, and certainly should never ever call themselves Democrat, liberal, progressive, moderate, independent or perhaps even American.",VegaThePunisher,1517598292.0,2448,i.imgur.com,'',7utmys,0.74,24
"You decide, Alabama.",aditseth03,1513102045.0,2443,i.redd.it,'',7jcn9e,0.87,99
"Nancy Pelosi Says it's Fair Game to Go After Ivanka Trump, Jared Kushner: 'They Are Advisers to the President... Not Their Children at Home'",therecordcorrected,1552081234.0,2434,newsweek.com,'',ayvpjj,0.95,81
Orange Standards.,VegaThePunisher,1508587898.0,2419,i.redd.it,'',77t0k4,0.81,144
"GOP strategist admits he colluded with Russian hackers to hurt Hillary Clinton, Democrats",brownears,1495766291.0,2411,salon.com,'',6de9ws,0.83,63
BREAKING: Democrat Jaime Harrison is virtually tied with Trump puppet Lindsey Graham in the latest polling of the Senate race in deep-red South Carolina! RETWEET if you support Harrison as he fights to beat Graham and take back the U.S. Senate! https://t.co/mvoRTDTYA3,4AtlanticCityCasinos,1577056659.0,2394,twitter.com,'',eebycv,0.96,39
Alabama Republican voters' dilemma,vrphotosguy55,1510884760.0,2385,i.imgur.com,'',7dhj42,0.83,106
Please Vote,Mr-Incredible-,1599958132.0,2373,i.redd.it,'',irojqa,0.96,39
A fair point,LiteralOops,1598304335.0,2365,i.redd.it,'',ify9od,0.94,79
Republicans think so low of men!,,1538160541.0,2351,i.redd.it,'',9jpnte,0.9,97
A gay pornstar is trying to out anti-LGBT senator Lindsey Graham for hiring male escorts then forcing them to sign NDAs.,GFYS2025,1591403581.0,2351,womenofweed.com,'',gxgpto,0.97,257
Trump: James Clapper said I have no Russia connections. Clapper: No I didn’t.,delafayette,1494634103.0,2335,vox.com,'',6auy6u,0.86,129
"Portland, Maine yesterday.",LoveMeSomeGoodLife,1599819365.0,2314,i.redd.it,'',iqnt2e,0.95,72
NADA.,VegaThePunisher,1520521556.0,2295,i.imgur.com,'',82y4kj,0.85,32
A great perspective on Joe Biden,rhino910,1593707965.0,2284,i.imgur.com,'',hk0dyf,0.92,243
I made a sign,journoprof,1601326256.0,2285,i.redd.it,'',j1kmr4,0.96,63
81% of Americans disagree with right-wing anti-quarantine mobs,jonfla,1587476693.0,2253,vox.com,'',g5fh46,0.95,169
[Discuss] Is congress in on it?,perse2018,1532096723.0,2247,i.redd.it,'',90gf2j,0.94,63
Do Not Become Comfortable Expecting A Biden Win. Vote.,PandaMondayz,1595193735.0,2220,self.democrats,"""I just wanted to mention that I would seriously not take Biden's likelihood of becoming president for granted.\n\nThe same pattern of 2016 is repeating and no one is listening. Everyone basically thinks of Biden now as Mr.President, but be careful.\n\nPeople are getting too comfortable. If we know one thing, it is that Trump's supporters will not change their votes. He's become their last standing identity and they will hold on to him as strongly as a mother holds onto her child.\n\n**VOTE.**""",hu8fus,0.95,159
Only if We Vote.,Popular-Way,1591686720.0,2215,i.imgur.com,'',gzi381,0.96,70
McConnell Received $3.5M In Campaign Donations From Russian Oligarch-Linked Firm,skepticalspectacle1,1542160115.0,2188,mavenroundtable.io,'',9wvit9,0.95,62
"A photo of the terrible weather in Portsmouth, NH that led to the cancelled Trump rally.",woogychuck,1594571234.0,2181,i.redd.it,'',hpx67r,0.98,49
"Thanks, Obama.",VegaThePunisher,1539339029.0,2181,i.imgur.com,'',9nj00l,0.87,126
Just walkin',ShellsBe11s,1598584776.0,2176,i.redd.it,'',ihzlgm,0.91,127
We’ve evolved a bit since 2016,StrykrSeven,1596797514.0,2169,i.redd.it,'',i5boc9,0.96,153
Message from God,VegaThePunisher,1496493686.0,2168,i.redd.it,'',6f0zvh,0.77,94
Even Stranger Things didn’t have as much of an Upside Down.,VegaThePunisher,1523667502.0,2170,i.imgur.com,'',8c44ts,0.85,352
Kermit is always so sarcastic.,VegaThePunisher,1542333335.0,2153,i.imgur.com,'',9xhpai,0.91,125
Here’s an idea...,VegaThePunisher,1542501997.0,2150,i.imgur.com,'',9y1pk6,0.83,367
Trump has been president for over three years. Blaming Obama for a shortage in the N95 mask stockpile is like someone discovering their fridge is empty and then trying to blame it on the person who previously owned the home.,CycleSoCal,1585061613.0,2151,self.democrats,'',fo6ef4,0.96,85
"Gotta be honest, I was not an Obama fan when he was in office. Recent years have made me reconsider past positions.",TomServo1993,1595008497.0,2145,i.redd.it,'',ht0elm,0.95,132
"Denizcan Grimes on Twitter: ""Republican Chuck Grassley, with a net worth of $3.3 million, has applied for Trump’s Farmer bailout. Grassley pushed for this bailout. He's already accepted over $400,000 in farming subsidies. These people are the worst.""",therecordcorrected,1538478914.0,2143,twitter.com,'',9kppir,0.93,98
What Year Is It?!?,VegaThePunisher,1534121048.0,2148,i.imgur.com,'',96tw9j,0.94,302
Divider,TRMact9,1592138147.0,2133,i.redd.it,'',h8t23i,0.93,109
100 Days Until the Most Important Election in Your Lifetime.,SofaKingVote,1595801857.0,2139,i.imgur.com,'',hyg1ll,0.92,107
Like a Boss,progress18,1548446630.0,2124,i.redd.it,'',ajszia,0.89,132
Requiem for Innocence,StrykrSeven,1599745119.0,2112,i.redd.it,'',iq3g9a,0.96,77
"Nancy Pelosi: ""Mexico said NO. Voters said NO. Congress – armed with the exclusive constitutional power of the purse – said NO. Trump is trashing our Constitution by abusing his executive power with #FakeTrumpEmergency. This is a naked power grab that “didn’t need” to happen. It won’t work.""",therecordcorrected,1550381920.0,2110,twitter.com,'',arhmve,0.96,65
"Stephen Colbert on Twitter: ""Why is anyone surprised that Trump's willing to shut down our government when it's clearly not the one he works for?""",therecordcorrected,1545438481.0,2109,twitter.com,'',a8g3da,0.92,63
Honor RBG by voting,punkissleepy,1600476469.0,2102,i.redd.it,'',ivifpc,0.93,95
"Scott Dworkin: ""Trump didn’t even respond to Putin’s threat against the US yesterday. He didn’t condemn the terrorist who was planning an attack on Democrats. He did take the time to attack Democrats, the press, FBI and DoJ. Trump will be the greatest threat to America, until he leaves the WH.""",therecordcorrected,1550766735.0,2103,twitter.com,'',at54sg,0.95,40
Brennan responds to the Censorship & Intimidation.,VegaThePunisher,1534419523.0,2087,i.imgur.com,'',97rizm,0.93,192
"Joe Biden on Twitter: I don't care who you're supporting, attacks like this against a man who could be the first Jewish President are disgusting and beyond the pale. Hatred and bigotry have no place in America — and it's up to all of us to root out these evils wherever they're found.",progress18,1583532959.0,2082,twitter.com,'',fel9ub,0.95,240
A quote for the history books.,,1542645398.0,2079,i.redd.it,'',9yicnk,0.93,95
Now being projected onto San Francisco Federal Building.,VegaThePunisher,1529440802.0,2072,i.imgur.com,'',8sca3d,0.92,64
"Thanks again, Obama.",VegaThePunisher,1532876602.0,2069,i.imgur.com,'',92vcpa,0.9,365
DO. NOT. LET. REPUBLICANS. GO. BACK. ON. THIS. DAY. This is a precedent being set. We need to remind them of this every single day they try to oppose a woman’s right to choose.,IdealHusband,1600735925.0,2064,i.redd.it,'',ixdba9,0.93,68
Only Caravan is the Republican One of Fools.,VegaThePunisher,1544889882.0,2061,i.imgur.com,'',a6ga07,0.9,141
USS Roosevelt Captain's brutal choice,backpackwayne,1585923209.0,2054,stripes.com,'',fu94ir,0.98,67
When Even Fox News Can’t Cover for Mushroom Mussolini Anymore.,SofaKingVote,1598735984.0,2051,i.imgur.com,'',ij0g0c,0.96,106
Fox News refuses to run ad for Oscar-nominated anti-Nazi documentary because it would offend its Republican viewers.,KubrickIsMyCopilot,1550157679.0,2052,crooksandliars.com,'',aqktrn,0.95,108
Makes u think what Republican job is..,Arriveria,1547059648.0,2044,i.redd.it,'',ae9wqi,0.87,130
