Trump is a butthurt little bitch who got corrected in public by Twitter XD,,1590625869.0,1055,self.democrats,"""I noticed that one of Trump's tweets (I was scrolling to see his usual insane self tweeting stupid stuff) and I happen to notice [this](https://twitter.com/realDonaldTrump/status/1265255835124539392). \n\nThe Twitter Team issued this warning: **Get the facts about mail-in ballots**""",grvviq,0.92,125
Sounds like a good idea to me,basically-a-sloth,1601168081.0,1053,i.redd.it,'',j0hmsi,0.95,46
Trump Has Created 1.5 Million Fewer Jobs Than Obama,Gsteel11,1569007369.0,1053,forbes.com,'',d6zs6s,0.98,168
Amy McGrath says she will take on Mitch McConnell in 2020 US Senate race,progress18,1562672553.0,1051,courier-journal.com,'',cazris,0.98,59
Nazis separated me from my parents as a child. The trauma lasts a lifetime: I know from experience that the Trump-sanctioned brutality at the US border with Mexico will scar its child victims for life,skepticalspectacle1,1529340033.0,1049,theguardian.com,'',8s0yaz,0.92,131
"Demands for Workers-First Stimulus Grow as Senate GOP Fails to Ram Through $500 Billion Corporate 'Slush Fund' - ""No more slush funds or no-strings-attached handouts. Real relief for the American people.""",anutensil,1584964916.0,1054,commondreams.org,'',fnisub,0.97,85
The FBI served a search warrant on Sen. Richard Burr Wednesday as an investigation pushes forward on whether or not the senator violated a law that prevents members of Congress from trading insider information they learn from their work,DoremusJessup,1589422697.0,1054,thehill.com,'',gjdbv5,0.99,53
"Get In, Time to Save America. Together.",SofaKingVote,1595885981.0,1041,i.imgur.com,'',hz1ijy,0.87,125
Joe Biden on Twitter: President Obama and I left a playbook for President Trump on how to fight pandemics. He flat-out ignored it. And we're all paying the price every day.,progress18,1594986870.0,1045,twitter.com,'',hsucmf,0.97,45
"Jonathan Van Ness: ""What kind of piece of shit speaks ill of a veteran war hero 7 months after his death? All while saying he’s not at fault for the rise in white terrorism as he defends Carlson & Pirro who are blatantly racist and Islamophobic. You are as vile as you are orange @realDonaldTrump""",therecordcorrected,1553098086.0,1043,twitter.com,'',b3du6p,0.97,42
"If guns were as dangerous as a woman’s uterus, maybe Congress would do something.",VegaThePunisher,1518657185.0,1045,i.imgur.com,'',7xmyc7,0.82,274
"Adam Schiff on Twitter: ""Trump is resisting every Congressional request for testimony and documents related to our oversight responsibility. Like an aspiring autocrat, he doesn’t recognize the co-equal branches of our government. He has lived his entire life without accountability. That ends now.""",therecordcorrected,1556123952.0,1048,twitter.com,'',bgwu5c,0.96,79
Colbert: 'So the wall is a metaphor for Trump's manhood? No wonder he's having a problem erecting it',therecordcorrected,1544619286.0,1039,rawstory.com,'',a5hw0k,0.92,17
Trump Checks In With His Boss,elbunts,1540902387.0,1042,i.redd.it,'',9sncrd,0.91,41
Attention Texas Democrats -- Today Is Primary Day -- Your Vote Is Critically Important!,wenchette,1520341675.0,1046,ballotpedia.org,'',82exn3,0.92,33
"Dan Rather: ""Trump disinvites Eagles from White House - while millions of Americans hurt. Puerto Rico suffers. Allies fret. The planet warms. He uses our National Anthem to sow disunity in what's supposed to be the UNITED States of America. I think history will mark it as akin to McCarthyism.""",therecordcorrected,1528265066.0,1037,twitter.com,'',8oy9ov,0.95,40
"Charles M. Blow on Twitter: ""Let this sink in: There are tanks in the nation’s capital and concentration camps at its border. The drift to toward the unimaginable is unmistakable.""",therecordcorrected,1562206410.0,1044,twitter.com,'',c8wwa0,0.95,133
James O’Keefe's Project Veritas tried to dupe The Washington Post with a fake Roy Moore story; The Washington Post turned the tables on O'Keefe's group and exposed their fraud,wenchette,1511822006.0,1042,washingtonpost.com,'',7fz4jx,0.9,37
Trump laundering money from Putin,dakandy,1599414478.0,1036,i.redd.it,'',inqfmj,0.96,49
Head of Virginia GOP resigns rather than run 'vicious campaign' for Trump-loving pro-Confederate US senate candidate,therecordcorrected,1530405760.0,1036,rawstory.com,'',8v6b69,0.94,35
"Mike Pence just showed why Trump can’t be trusted with pardon power: VP Pence yet again disgraced the White House by saying he was “honored” to be joined by Joe Arpaio, because Arpaio is a “champion” of “the rule of law.” It was a complete inversion of the truth, turning reality upside down.",therecordcorrected,1525282663.0,1039,washingtonpost.com,'',8gjadu,0.93,56
McConnell's likely Democratic challenger raises $10.7 million In three months,resnica,1570754250.0,1031,cnn.com,'',dg7ay2,0.97,53
Trump is blaming Democrats for separating migrant families at the border. That is a LIE. He and his administration are enforcing his OWN policy.,wenchette,1527512730.0,1035,washingtonpost.com,'',8mpwta,0.92,71
The guy is a walking sugar cookie.,VegaThePunisher,1508504241.0,1034,i.redd.it,'',77lw2z,0.83,113
"Ted Lieu: ""Dear Attorney General Bill Barr: I see you have a number of interesting investigations happening at @TheJusticeDept. Can you do your witness depositions in public? Can I sit in on your interviews? Of course not. Because investigations are not done in public. #FactsMatter""",therecordcorrected,1572079568.0,1035,twitter.com,'',dnba8a,0.98,21
'We Should All Be Alarmed': McConnell to Bring Senate Back Not to Fight Covid-19 But to Confirm More Trump Judges,JLBesq1981,1588294545.0,1036,commondreams.org,'',gb8esm,0.97,75
Here's what Ivanka Trump still doesn't get about her email problems: The truth here is that Ivanka Trump is guilty of the same entitlement mentality that her father and his surrogates accused Clinton of.,therecordcorrected,1543461772.0,1027,cnn.com,'',a1dk4m,0.96,63
Impeachment trial should remove any lingering doubt: Republicans are beyond redemption,Maddoktor2,1579863014.0,1029,salon.com,'',et8slf,0.95,118
Russian spam accounts are still a big problem for Reddit; At least 89 subs have been targeted by Russian propaganda.,progress18,1549733545.0,1025,engadget.com,'',aoufg3,0.96,52
Millions Of Americans Are About To Be Homeless Due To Republican Refusal To Extend Eviction Moratorium,jonfla,1596028209.0,1025,huffpost.com,'',i00fhn,0.95,105
"Dems ignore Trump’s ultimatums, advance investigations into scandals",progress18,1550665436.0,1026,msnbc.com,'',asnq70,0.98,20
Ruth Bader Ginsburg says she is cancer free,progress18,1578520435.0,1025,politico.com,'',elzl83,0.98,41
"Judge Restores Wisconsin Governor's Powers, Strikes Down GOP Laws",madam1,1553210881.0,1024,npr.org,'',b3xn2i,0.98,31
Trumps a little lost,MrTeddyFTW,1542256130.0,1026,i.redd.it,'',9x7u08,0.95,51
White House May Have Broken Federal Law by Doctoring Trump-Putin Video,skepticalspectacle1,1532548369.0,1024,lawandcrime.com,'',91v7ba,0.94,44
"It would be very embarrassing if the mugshot of Donald Trump's Campaign Chairman made it to the front page and triggered Trump supporters, please don't let that happen.",skepticalspectacle1,1531432222.0,1019,np.reddit.com,'',8ye327,0.93,24
"Over 157,000 Americans dead. ""It is what it is"" - Donald Trump",TRMact9,1596654298.0,1020,i.redd.it,'',i4bizu,0.95,43
"Lindsey Graham challenger raises $270,000 within 24 hours of announcing Senate bid",wenchette,1561904773.0,1020,salon.com,'',c7er7g,0.98,46
Trump has granted more lobbyist waivers in 4 months than Obama did in 8 years,Manny12,1496332895.0,1019,vox.com,'',6enosb,0.91,23
"Rachel Fine on Twitter: ""Hey, everyone who silver-lininged the trump presidency with a ""hey, but how about that 401k?"", how ya feeling today? Were the caged kids still worth it? Just curious.""",therecordcorrected,1545791508.0,1013,twitter.com,'',a9kney,0.94,62
Trump personally met with Russian ambassador during campaign,CharlieDarwin2,1488913300.0,1021,thinkprogress.org,'',5y2mvs,0.76,65
"William Barr Is Turning U.S. Into Dictatorship, Says Ex-Labor Secretary",jonfla,1582729367.0,1015,huffpost.com,'',f9ui0y,0.96,18
"House Democrats’ 1st bill targets big donors, voting access.",Ghdust2,1543595853.0,1012,bostonglobe.com,'',a1u06t,0.95,58
"Kyle Griffin on Twitter: ""Trump has arrived at Trump National Golf Club in Sterling, VA, according to the pool report. This is Trump's 154th day at a Trump property as president and his 112th day at a Trump golf club as president.""",therecordcorrected,1526221407.0,1009,twitter.com,'',8j43qr,0.93,53
"Democrat John Bell wins Virginia State Senate race in Loudoun, Prince William counties; The projected win is now likely to deliver Democrats control of the Virginia State Senate, a crucial development as Democrats hope to shift the balance of power.",progress18,1573003870.0,1014,wusa9.com,'',ds92gs,0.97,24
Only 30 Days Out.,VegaThePunisher,1538821129.0,1014,i.imgur.com,'',9lux8w,0.86,344
"Booker defies GOP warning, releases another batch of 'confidential' Kavanaugh docs",progress18,1536412618.0,1010,thehill.com,'',9e49qd,0.95,59
"Trump, GOP challenge efforts to make voting easier amid coronavirus pandemic",Gonzo_B,1586100915.0,1009,washingtonpost.com,'',fvfmbp,0.97,47
John Oliver Rages Over Trump’s ‘Pathological’ El Paso Visit: ‘Struggles to Do the Bare Minimum of Being a F*cking Person’,therecordcorrected,1565628497.0,1015,mediaite.com,'',cpf08l,0.94,60
"Michelle Obama Is Mad at Black Voters, Not Trump Voters — Twice [in the ""Becoming"" documentary], she talks about how painful it is to her that black voters didn’t turn out to vote for Hillary Clinton, calling the decision not to vote more painful to her than those who voted for Trump.",BlankVerse,1588607732.0,1010,thedailybeast.com,'',gde4p1,0.93,193
"Cohen: fears no ""peaceful transition"" if Trump loses in 2020",KubrickIsMyCopilot,1551535717.0,1009,reuters.com,'',awi3h7,0.96,117
"Mike Pence, who enabled an HIV outbreak in Indiana, will lead US coronavirus response",coffeespeaking,1582775299.0,1012,theverge.com,'',fa62de,0.96,105
Biden says Trump should release transcript of Ukraine call so ‘the American people can judge for themselves’,progress18,1569167809.0,1009,cnbc.com,'',d7sbh2,0.96,59
A Pennsylvania mask factory scrapped a visit from Trump because it worried the event could spread the coronavirus,ravenmarie666,1589316710.0,1007,businessinsider.com,'',gik4om,0.98,72
Rep. Ilhan Omar blasts GOP over poster linking her with the 9/11 attacks,ButteryKnob,1551656822.0,1005,cnn.com,'',ax08tt,0.95,67
"Trump's Trail of Tears joke isn't his first about a Native American massacre. Last month it was Wounded Knee. He's doing it repeatedly, and intentionally. It's sad and outrageous that we have this racist goon in the highest office. And it's sad and outrageous that the Republican party supports it.",skepticalspectacle1,1549851630.0,999,huffingtonpost.com,'',apbfib,0.96,45
Political analysts say Kanye West may have committed election fraud due to large numbers of fake petition signatures,jonfla,1597146136.0,1006,mic.com,'',i7q9zo,0.97,61
The electoral map is tilting badly against Donald Trump right now,BlankVerse,1591294072.0,1004,cnn.com,'',gwmpjy,0.95,152
"Trump Has Now Made Over 15,000 False or Misleading Claims in Office, Says Washington Post",progress18,1576498347.0,999,thedailybeast.com,'',ebedol,0.96,63
Get them while supplies last!,WalterDuggan,1525142828.0,1005,i.redd.it,'',8g58js,0.94,61
Ike on the corporate tax rate.,VegaThePunisher,1509804888.0,1000,i.redd.it,'',7aqut0,0.92,137
"By undoing Obama’s nursing home regulations, Trump opened the door for the deaths we're seeing",1000000students,1590888531.0,1001,salon.com,'',gtq5e1,0.97,66
"Brian Klaas: ""I want Paul Ryan and Mitch McConnell on record responding to a question about whether they support Trump retweeting a Sandy Hook “truther” who claimed that surviving 6 & 7 year-olds from a mass slaughter were “child actors.” I want them to have to answer that question on camera.""",therecordcorrected,1519656413.0,1004,twitter.com,'',80dhyi,0.93,16
21st Century Klansmen,saltheron,1518783710.0,1001,i.imgur.com,'',7xyddm,0.83,189
Bernie supporter here: Biden is showing himself off to be a great leader and the one we need right now. I'm voting for Biden in November and am trying to recommend to any other Bernie supporters to do the same. We need someone willing to put his neck on the line and not hiding away.,grayfox2713,1591060958.0,994,self.democrats,'',guxmx7,0.91,185
This is generous,wondrousglow,1600652775.0,992,i.redd.it,'',iwr4kx,0.95,35
Guests at Trump National Golf Club disco party get coronavirus,1000000students,1585451884.0,992,latimes.com,'',fqytqt,0.98,54
"The great bromance — President Barack Obama jokes with Vice President Joe Biden in the Oval Office, Feb. 9, 2015. (Official White House Photo by Pete Souza) [1438x1500]",BlankVerse,1597854761.0,993,live.staticflickr.com,'',icr1aw,0.91,80
"Trump writes laughably false op-ed about Medicare for All: In a paranoid rant, Trump warns Americans that Democrats want to take away health care. Here's the truth.",therecordcorrected,1539208632.0,995,thinkprogress.org,'',9n3yob,0.93,73
Sandy Hook shooting: Father of murdered boy wins defamation suit against conspiracy theorists,progress18,1560872469.0,992,usatoday.com,'',c23s2a,0.98,22
Trump Named Man of the Year by ISIS,therecordcorrected,1545365955.0,993,newyorker.com,'',a86943,0.94,43
Ocasio-Cortez: Hurricane Maria response shows Puerto Ricans are 'treated like second-class citizens',ProgressiveLogic,1537111188.0,990,thehill.com,'',9gbbpr,0.92,90
New laws will only hurt law-abiding bomb owners.,VegaThePunisher,1521808131.0,993,i.imgur.com,'',86k8i8,0.88,215
Evangelical college students say they don’t want Mike Pence to be their commencement speaker - The vice president is facing backlash from students and alumni who say he doesn't represent their Christian values.,madam1,1555201554.0,989,thinkprogress.org,'',bcx7u2,0.96,25
2 George W. Bush Cabinet secretaries endorse Biden,AlexKingstonsGigolo,1598543606.0,981,axios.com,'',ihnjzz,0.96,61
"Today on Senator McCain's funeral,only one living president is not invited : Donald Trump. Till this day he didn't apologize to McCain's family or the POWs for trashing all those members in uniform who were captured and tortured by our enemies.",ihatejoemcCarthy,1535806451.0,987,self.democrats,"'In an Op-Ed in today\'s NYT ""Straining to Keep Faith with America"" Bret Stephens has trashed Trump in no uncertain terms by adding this in his piece ""John McCain knew that we are better than Trump.""\n\nTo that I like to add my own thoughts saying that maybe, I emphasize the word ""maybe"" again to say that maybe a healthy Senator McCain could put a stop to a marauding president called Trump. \n\nBut with the Republican Senator John McCain\'s death, there is nothing that can stop Trump from destroying each and every American values that this country developed over two centuries plus more.\n\nEven a Republican president Ronald Reagan\'s description of America was much different from Trump\'s vision.\n\nBy quoting a phrase from Jesus\'s Sermon on the Mount, Reagan declared that our country is like ""a shining city on a hill"".\n\nBut since Trump took over the presidency, every Americans are ""straining to keep Faith with America"", the country they love dearly unlike Trump and his followers who only think of what they can get. \n\nEven Democratic president John Kennedy\'s words on his inauguration on January 20th, 1961, ""Ask not what your country can do for you_ask what can do for your country"", have no sway over the minds of these fake ""swamp cleaners"" like Trump. \n\nTrump is more interested in finding how much money he can milk from his presidency than giving some of his assets to the countrymen who were really struggling everyday to keep their faith on America.\n\nTheir struggles to keep faith on our institutions are four hundred times more now than before Trump took office on Jan 20th, \'17.\n\nThat is the reason why we\'ve to feel sorry for John McCain\'s permanent absence from an institution, mainly the Senate where he grilled each and every Trump\'s appointees and his cabinet members to hit hard at Trump\'s illogical policies.\n\nTrump on the other hand didn\'t have the decency to go to McCain before his death or to his wife and families now to apologize saying, ""I should\'ve never said that I don\'t care for people like you who got captured at war. As you know I didn\'t go to Vietnam for my bad foot. But I really appreciate your pains and sufferings due to terrible tortures at the hands of the Vietcong guerrillas. I\'m really sorry that you endured those tortures for five plus years just to keep our country safe. May God bless your soul.""\n\nAm I really dreaming that Trump would say those kind words and apologize to John McCain or his wife Cindy or his children or to all our POWs ?  Not in a million years ! No way .'",9c2tsl,0.94,27
"David Frum: ""If Trump now reopens Govt, he visibly surrenders to Pelosi. If Trump keeps Govt closed, he bleeds support faster. Workers miss next paycheck, air travel delays, govt services fail, and economy stalls. Trump built the trap and walked into it. Pelosi just locked it behind him.""",therecordcorrected,1547742429.0,985,twitter.com,'',agzgsk,0.97,77
Republicans Projected to Pick up Seventy Seats in Prison,therecordcorrected,1533910763.0,986,newyorker.com,'',967bn6,0.96,33
"Chuck Schumer on Twitter: ""Are we executing Putin’s diplomatic and national security strategy or AMERICA’s diplomatic and national security strategy? After the last few days, it’s hard to tell.""",therecordcorrected,1528673670.0,983,twitter.com,'',8q4wg4,0.92,21
"Madness! More people are getting sick, so Trump said he wants to stop testing. Hiding the numbers won't heal nor bring back those 120000 dead...",KitchMitch,1592840579.0,984,i.redd.it,'',hduojt,0.96,88
"Biden rips Trump for golfing amid coronavirus outbreak, says president ""turns everything into a political benefit for himself""",progress18,1583841389.0,978,newsweek.com,'',fgcnne,0.91,76
"Michael McFaul: ""Trump & his proxes have ridiculed General Mattis, General McMaster, General Kelly, and now Lt. Colonel Vindman, all decorated soldiers who willingly and dutifully signed up to work for him. I never want to hear again about Trump's alleged support for our soldiers and veterans.""",therecordcorrected,1572399962.0,977,twitter.com,'',dp02h8,0.97,34
"In Last Minute Ruling, Court Blocks Trump Rules That’d Let Employers Refuse to Cover Birth Control",progress18,1547467863.0,980,lawandcrime.com,'',afv7xj,0.97,42
CNN panel aghast at Trump's angry 3 a.m. tweet: 'He was elected to be president -- not a mental patient',anutensil,1540561421.0,983,rawstory.com,'',9rkua2,0.92,59
"Trump EPA advisor claimed air is ""too clean,"" and that pollution is healthy for children's lungs.",KubrickIsMyCopilot,1509629027.0,982,newrepublic.com,'',7abgi4,0.92,67
I voted for Trump,,1556909631.0,982,self.democrats,"""I used to be a very hard right man. I wanted jobs for Americans only. I wanted punishment for people sneaking across the border, and I wanted everyone to think like me. A few days ago I took the political compass test and it turns out I'm actually more of a democrat. I've come to learn that the wealthy are hoarding the wealth and people like me a suffering. I look across the pond and see my Scandinavian cousins and their free healthcare and tuition free college and more time off and I'm dismayed. I've been lied to my whole life about who really cares about poor folks like me and now that my eyes are open, I'm coming home!""",bkc1ko,0.9,202
Federal judge blocks Kentucky's new 'fetal heartbeart' abortion law,progress18,1552746088.0,983,courier-journal.com,'',b1sxw4,0.97,69
GOP Fears Loss Of Reliable Senate Seat Amid Fractious Kansas Primary,jonfla,1590840912.0,978,npr.org,'',gtdcni,0.98,57
US intelligence agents were reportedly warned not to tell Trump findings that contradict his public comments,progress18,1549200948.0,976,businessinsider.com,'',amplch,0.97,42
"Ted Cruz & Beto O'Rourke debate tonight at 6 p.m. Central - U.S. Sen. Ted Cruz, R-Texas & Democratic opponent Beto O'Rourke will hold their 1st debate tonight at Southern Methodist University in Dallas.",anutensil,1537533160.0,970,texastribune.org,'',9hpcex,0.96,39
"Trump voter: If Jesus Christ told me Trump colluded with Russia, I’d check with Trump",anutensil,1511181613.0,975,thehill.com,'',7e8l6c,0.84,84
"West Virginia gets a taste of all Republican control of the entire government with new water quality standards opposed by advocates of clean water. The West Virginia Manufacturers Association argued that because West Virginians are heavier, their bodies can handle more pollutants.",therecordcorrected,1552358552.0,979,register-herald.com,'',b02hbe,0.98,90
Trump’s denial of his coronavirus failings will be “one of the biggest propaganda battles in American history”,Gonzo_B,1587077097.0,974,vox.com,'',g2pjlo,0.96,66
"Trump accused of another quid pro quo, this time with New York; ""He's holding New York state hostage to try to stop investigations into his prior tax fraud,"" tweeted Rep. Val Demings.",progress18,1581680435.0,967,politico.com,'',f3r0lc,0.97,62
Explosive report indicates that Donald Trump's loans from Deutsche Bank were backed by Russia,modmans2ndcoming,1578097378.0,970,m.dailykos.com,'',ejohvz,0.97,74
Fox News' Shep Smith and Andrew Napolitano now see proof of 'collusion' between Trump's team and Russia,progress18,1547127267.0,972,theweek.com,'',aej6hj,0.97,56
"Biden's war chest swells as donors, many in California, grow increasingly alarmed by Trump",BlankVerse,1591915964.0,974,latimes.com,'',h78kbz,0.98,58
"I, for One, Am Displeased About Having to Pay for Trump’s New $16 Billion Farmer Bailout",mbkthrowaway,1559052275.0,970,slate.com,'',bu0f1k,0.97,91
Trump at the UN,jaydawg69,1537928503.0,968,i.redd.it,'',9iyhjd,0.93,33
"""Mueller did not exonerate"" Trump, ""Democrats will call on AG William Barr"" to testify, says House Judiciary chair",cybersecp,1553465605.0,970,newsweek.com,'',b52bqu,0.93,104
Trump doesn’t realize mail-in is the same as absentee voting.,JeffWhoJeffsAtJeff,1594388759.0,966,i.redd.it,'',hop7g1,0.97,25
"‘Impeachable’ and ‘illegal’ aren’t interchangeable -- In a groundbreaking announcement, the House Judiciary Committee opened a far-reaching investigation into President Trump and his associates. The scope of the investigation is enormous: Obstruction of Justice. Public Corruption. Abuses of Power.",therecordcorrected,1551754704.0,965,washingtonpost.com,'',axg5r8,0.97,29
Fact-checking President Trump’s USA Today op-ed on ‘Medicare-for-All’ -- President Trump wrote an opinion article for USA Today regarding proposals to expand Medicare to all Americans in which almost every sentence contained a misleading statement or a falsehood.,therecordcorrected,1539260356.0,966,washingtonpost.com,'',9n9gq3,0.94,52
Police official accidentally debunks Trump’s MS-13 rant with a single stat: The president would have you believe Long Island is a war zone. It isn't. Suffolk County police commissioner noted that there hasn’t been an MS-13-linked homicide in more than a year.,therecordcorrected,1527122786.0,967,thinkprogress.org,'',8lohoz,0.91,43
"The US has 4.25% of the world's population but 36% of all active Covid-19 cases and 24% of all deaths attributed to the virus. We are #1 in the world and I am tired of all this #Winning, Mr. Trump. Stop the self-congratulations and the politics at the expense of human life.",Gonzo_B,1587258015.0,964,worldometers.info,'',g3yq5z,0.94,92
“Let the Voters Decide” Doesn’t Work if Trump Fires His National Security Staff So Russia Can Help Him Again,JLBesq1981,1582320722.0,964,slate.com,'',f7i2l6,0.97,39
The 25 women who have accused Trump of sexual misconduct,,1589757581.0,957,businessinsider.com,'',glpsb6,0.96,51
Maxine Waters unleashes over Trump COVID-19 response: 'Stop congratulating yourself! You're a failure',Gonzo_B,1585621783.0,958,thehill.com,'',fs4okn,0.95,20
"Trump Learned His Lesson: thanks to the obsequious Republican Senate, he can do anything he wants and get away with it",jonfla,1581512733.0,967,talkingpointsmemo.com,'',f2qxb9,0.95,62
"I hope this is clear enough. If it's not, I'll keep trying. The government awarding the G7 contract to Trump is not more of the same corruption. It's not even the same but grander. It is different in nature. Trump is reaching into the Treasury and taking your money for himself.",njmaverick,1571488552.0,966,twitter.com,'',dk3700,0.97,50
"Beto O’Rourke leads Ted Cruz by 2 among likely voters in US Senate race, new poll finds",ProgressiveLogic,1537454067.0,961,rawstory.com,'',9hfsyq,0.95,51
Relax & Take Notes.,VegaThePunisher,1528164290.0,966,i.imgur.com,'',8on2ws,0.85,157
"Two-thirds of Americans support vote-by-mail, but a majority of Republicans oppose",wenchette,1588627824.0,958,usatoday.com,'',gdkm5k,0.98,74
"""How dare that lady comedian be so vulgar!""",skepticalspectacle1,1525105248.0,961,i.imgur.com,'',8g0ojw,0.93,56
"Fed study: Trump tariffs backfired, caused job losses and higher prices",Maddoktor2,1577537390.0,955,thehill.com,'',egqeg7,0.95,53
Leary of their intentions.,VegaThePunisher,1529384905.0,957,i.imgur.com,'',8s69ba,0.92,80
"John McCain, battling cancer, tells Joe Biden to stay in politics",BlankVerse,1525563032.0,957,usatoday.com,'',8hbana,0.96,61
