Don’t let Cheeto Benito Distract the Public,SofaKingVote,1594478378.0,1178,i.imgur.com,'',hpb1vp,0.95,70
Covering a puddle,skepticalspectacle1,1542969706.0,1176,i.imgur.com,'',9znadr,0.96,33
Democrats are too dangerous to govern,skepticalspectacle1,1538940843.0,1181,i.redd.it,'',9m7zs0,0.9,111
"George Takei: ""Trump touted the economy as a reason to re-elect him. Now that there are economic storm clouds, he blames the media for stirring fears of recession. When jobs get scarcer, he’ll blame immigrants. He’ll take credit but never responsibility, because he is a coward and a phony.""",therecordcorrected,1566184309.0,1174,twitter.com,'',csbc8a,0.96,44
I made an appearance at a local Trump rally today. Let’s just say there are a lot of Karen’s “praying for me.”,smilesandotherthings,1599507396.0,1172,i.redd.it,'',ioecxi,0.94,126
"Trump Administration Considering Opening Obamacare Enrollment Amid Pandemic - As the administration backs a court fight to kill the Affordable Care Act, officials suddenly realize Americans need health insurance now.",anutensil,1584881678.0,1172,huffpost.com,'',fmzifp,0.98,55
Trump Has Now Shifted $1.7 Million From Campaign Donors To His Private Business,jonfla,1575899100.0,1169,forbes.com,'',e8a4qq,0.97,79
Republican Cries Against Voter Fraud Go Mostly Quiet After Scheme Tied to Party,progress18,1550935413.0,1167,nytimes.com,'',atwi7l,0.97,27
"Biden: ""I trust vaccines, I trust scientists, but I don’t trust Donald Trump""",Phatbrew,1600296564.0,1167,axios.com,'',iu6qpb,0.96,78
"Reminder: Russian trolls are active on reddit to create division between Biden and Bernie, like 2016.",Manny12,1585342263.0,1167,buzzfeednews.com,'',fq5fzt,0.91,223
"Adam Schiff: ""You seem confused, Mr. Mulvaney. When the law says the IRS “shall” provide tax returns upon the request of the Chairman of the Ways and Means Committee, it doesn’t mean: Unless the President fears it, Tweets about it, Or his lawyer complains about it. Shall means shall.""",therecordcorrected,1554823636.0,1172,twitter.com,'',bb99m1,0.97,85
"Elizabeth Warren Reads Full Mueller Report in Congress, Calls for Impeachment",Mynameis__--__,1557501616.0,1172,youtube.com,'',bmzkkj,0.95,108
"Adam Schiff: ""For a President to float the idea of pardons to people who may incriminate him as a way to dissuade them from cooperating only adds to the evidence of potential obstruction of justice. Actions taken with corrupt intent may be illegal, and are certainly corrosive to our democracy.""",therecordcorrected,1522612807.0,1169,twitter.com,'',88tjzn,0.93,19
"Ted Lieu: ""Let me ask White House Senior Advisor @IvankaTrump about Trump Tower Moscow. Oh wait, she blocked me, a Member of Congress, because my questions bother her. Let me correct that. She blocked me, a Member of Congress who will be in the majority, because my questions bother her.""",therecordcorrected,1543634070.0,1166,twitter.com,'',a1zegp,0.96,23
"Mitch McConnell in 2018: Democrats have a strategy of “delay, obstruct and resist.” McConnell in 2016: ""One of my proudest moments was when I looked at Barack Obama in the eye and said, ‘Mr. President, you will not fill this Supreme Court vacancy.""",skepticalspectacle1,1537889145.0,1164,twitter.com,'',9it342,0.96,53
A look back at Clinton's impeachment reveals the GOP's searing hypocrisy,ULRB90,1552155877.0,1162,cnn.com,'',az6ehp,0.96,30
Trump illegally asked Russia to help him win in 2016. He shouldn't get away with it. -- Trump's public request for Russian help in finding Hillary Clinton’s emails was a violation of US law. There are ways to hold him accountable.,therecordcorrected,1546435202.0,1158,usatoday.com,'',abtc9w,0.93,36
Nancy Pelosi has been telling DREAMer stories for 4 hours. And she’s still talking,,1518031091.0,1160,usatoday.com,'',7vylfv,0.86,30
"Tom Nichols: ""This makes zero sense. Let me simplify all this verbiage: if you are a loyal American and the emissaries of a hostile foreign power come to you offering dirt on a presidential campaign, you call the FBI. Full stop. Anything else is rationalization."" -- The Federalist: ""Facts Of The...""",therecordcorrected,1533084990.0,1156,twitter.com,'',93ka5i,0.94,41
Trump Lied - 200K Died,KyleBaxter2020,1600217420.0,1147,i.redd.it,'',itlgmb,0.96,60
NY Times is now reporting on the financial evidence of Russian bounties placed on US troops.,billcozby,1593539262.0,1150,nytimes.com,'',his94o,0.98,56
My ex-Democrat hardcore Trump fan dad might be snapping out of it,KR1735,1584755500.0,1154,self.democrats,"'I went to my parents’ house today and to my utter shock, my Fox News-addicted, Alex Jones-loving dad had CNN on TV....and was *watching* it. Dad says he’s lost faith in how Trump and the Republicans are managing the pandemic and they’re not helping out the little guy. When I asked him if he’s still voting for Trump, I got radio silence. For comparison, my mom had to plead with him to quit talking politics at Thanksgiving. \n\nDad also just got laid off from his lucrative blue collar job. He’s always been a midwestern labor guy but became very skeptical about the Mexicans coming to take his job, which was the impetus for his voting for Trump. Now that he’s without one, it seems he’s returning to his union roots. \n\nI know this is just an anecdote. But here’s to hoping he’s not the only Trump “Democrat” who’s coming to his senses.'",fm79hs,0.95,141
Now I know why I liked Nickelodeon so much as a kid.,lattesbitches,1521065978.0,1152,i.redd.it,'',84hihj,0.93,62
"Jennifer Rubin on Twitter: ""The notion R’s are entitled to D votes to break 60 without negotiating with them is bizarre. If you say take it or leave it, you have to be prepared for leave it.""",therecordcorrected,1516508302.0,1155,twitter.com,'',7rvm1i,0.88,53
"Mark Warner on Twitter: ""I think we’ve had enough of the President running the government like one of his businesses.""",therecordcorrected,1547265494.0,1149,twitter.com,'',af3owc,0.96,30
Make Sure His Legacy is Republicans Being Wiped Out at Every Elected Level for Years to Come.,SofaKingVote,1601006004.0,1142,i.imgur.com,'',izchuw,0.96,33
Please stop running for President. Please help us win back the Senate.,Druidshift,1557863036.0,1143,self.democrats,"'WE NEED THE SENATE!\n\nI REPEAT, PLEASE TO THE 22 PEOPLE RUNNING FOR PRESIDENT...WE NEED THE SENATE!\n\nBullock, If you are a popular democrat in Blood Red Montana, please run for the fucking Senate!  Please Beto, Run against Cornyn!  Please Abrams, run for the Senate in Georgia.  \n\nPlease please please Hickenlooper!  You can take out Gardener.\n\nPlease stop running for President!  The senate is more important that the white house!  We have all of our eggs in one basket!'",bonjlt,0.96,89
Trump presidency continues to devalue Trump brand as another NYC building votes to change its name,therecordcorrected,1550983447.0,1144,dailykos.com,'',au4gip,0.97,37
"Trump lost the popular election by 3 million votes. So Trump lied that 3 million+ fraudulent votes were cast against him. Then Trump launched a commission to justify his lie. He finally had to shut that down, but is now demanding Voter ID. The Republicans are openly attacking American Democracy.",skepticalspectacle1,1515112768.0,1143,independent.co.uk,'',7o7ce6,0.84,80
Trump is facing bipartisan backlash for his handling of the coronavirus' spread in the US as the CDC warns 'this might be bad',JLBesq1981,1582666897.0,1146,businessinsider.com,'',f9hsdh,0.96,78
"Trump Met With Boos, ‘Lock Him Up’ Chants At Nats Game",jonfla,1572264149.0,1141,talkingpointsmemo.com,'',do7vla,0.97,75
I was a Republican who voted for Trump in 2016. Not this time!!,mchrisus,1601069536.0,1144,i.redd.it,'',izsivy,0.96,79
Don’t Be Naive: Avoiding Calling Trump Supporters Racist Won’t Convince Them to Vote for Democrats,neroisstillbanned,1543150529.0,1138,theroot.com,'',a089yo,0.82,628
"I would rather hear a teenager’s opinion on guns, than Rick Santorum’s views on abortion.",VegaThePunisher,1524317382.0,1144,i.imgur.com,'',8dvqsd,0.89,279
"Here's a number that should terrify every Republican on the ballot this fall — 51% of registered voters said they would prefer a Congress controlled by Democrats in 2021, while just 40% preferred a Republican-controlled Congress, according to a new Wall Street Journal-NBC poll released Sunday.",BlankVerse,1591640698.0,1147,cnn.com,'',gz4suy,0.95,88
"Trump Buries Head In Sand, Again Blames… Tests For Showing Rise In COVID Cases",,1593957907.0,1142,talkingpointsmemo.com,'',hln5vb,0.95,96
Pelosi warns Trump about making 'threats' against Congress,progress18,1549542203.0,1139,nbcnews.com,'',ao3772,0.95,51
"Joe Walsh on Twitter: ""I don't want to hear any Trump supporter or any @FoxNews personality ever complain in the future about a Democrat President going soft on some brutal dictator. After your cheers today, no one will listen to you.""",therecordcorrected,1528904547.0,1139,twitter.com,'',8qtf5i,0.93,181
Rise in deaths attributed to pneumonia suggests official US coronavirus death toll is grossly undercounted,Lost_Tourist_61,1590751556.0,1133,wsws.org,'',gsr6w2,0.97,87
The GOP has become the drunken frat-boy party — and it sees no reason to sober up,therecordcorrected,1547734981.0,1137,washingtonpost.com,'',agy8bx,0.93,47
"Oklahoma teachers are running for office as Democrats, fighting to raise taxes on oil companies to fund schools",JournalistDude,1523846430.0,1137,progressiveseverywhere.org,'',8ckdha,0.94,29
Trump's Problem: He 'Doesn’t Give One S**t About Public Service',jonfla,1585746122.0,1132,huffpost.com,'',fszcu5,0.95,57
"Pelosi at war: 1) Checks Trump's schedule, sees meeting with foreign leader, knows Trump will hold a press conference. 3) Schedules her own presser ahead of his b/c she knows he will watch and stew. 4) Trump, predictably baited, melts down on live television. Advantage, Pelosi.",njmaverick,1570049568.0,1135,twitter.com,'',dcgcje,0.95,116
"Trump Is The Worst President, Expert Ranking Survey Reveals On Presidents' Day: On a scale of 0 to 100 for overall greatness, President Trump scored just over 12, coming in dead last. “His average rating is nearly 3 points lower than James Buchanan, who previously occupied the lowest rank.”",therecordcorrected,1519134738.0,1137,newsweek.com,'',7yw0hz,0.87,129
"Trump loses appeal in New York tax case, must hand over returns",progress18,1572883050.0,1134,nbcnews.com,'',drjjc1,0.97,76
Fox News co-founder Rupert Murdoch's New Zealand network pulled off the air over coverage of Nazi terrorist attacks.,KubrickIsMyCopilot,1552789348.0,1132,thinkprogress.org,'',b20fni,0.96,40
"Derek Cressman on Twitter: ""Still waiting for the explanation from the Republican Party as to why they put Michael Cohen in charge of their finances. ..,""",therecordcorrected,1551807425.0,1125,twitter.com,'',axntdd,0.98,22
"Michael Tyson was jailed for a parole violation, and became the first inmate on Rikers Island to die of COVID-19. Paul Manafort was jailed for conspiring against the US, and will serve the remainder of his sentence at home—despite his prison not having a single case of COVID-19.",1000000students,1589506717.0,1130,twitter.com,'',gjzxhf,0.98,51
The Pro-Science Party,PhilosophyThatWorks,1545102408.0,1126,i.redd.it,'',a772ea,0.95,39
"Lindsey Graham on Twitter: ""If we nominate Trump, we will get destroyed.......and we will deserve it.""",therecordcorrected,1544490561.0,1128,twitter.com,'',a51xs2,0.95,58
"Thoughts on the 2nd Amendment, from a real conservative.",VegaThePunisher,1526828954.0,1127,i.imgur.com,'',8kt68q,0.9,143
Fearless Girl 😭💕,HighKeyKaliVibe,1600678592.0,1119,i.redd.it,'',iwws60,0.98,36
"Trump Can’t Postpone the Election — Congress could push it back a few weeks, but the Constitution sets the end of the term on Jan. 20.",wenchette,1588251803.0,1125,wsj.com,'',gav9oj,0.98,121
"Brian O'Sullivan on Twitter: ""Call me crazy, but... If Trump tried to use the Ukraine to get to Biden, maybe, just maybe, he did the same fucking thing with Hillary and Russia.""",therecordcorrected,1569084668.0,1127,twitter.com,'',d7cywi,0.97,39
"Thanks to Mueller, Maddow lays out, in devastating detail, how Trump and his admin were compromised by Russia. Don't let the run time (26 mins) scare you off - it's worth every second.",skepticalspectacle1,1543806304.0,1120,youtube.com,'',a2kgta,0.93,55
"Claire McCaskill on Twitter: ""When 600 agents were making a show of arresting 680 undocumented immigrants working at Mississippi processing plants, did anyone bother to arrest the employers? Or did they leave them undisturbed in the back room counting their money?""",therecordcorrected,1565324253.0,1117,twitter.com,'',cnx777,0.97,84
A Federal Court Just Ruled That Thousands of Eligible Voters in Georgia Must Be Allowed to Vote,madam1,1541204502.0,1122,motherjones.com,'',9tpopx,0.97,23
"Barack Obama gets ‘MVP’ chants, standing ovation in Toronto at Game 2 of NBA Finals",progress18,1559561173.0,1122,washingtonpost.com,'',bw9kf4,0.94,60
"Trump Says It’s a Very Scary Time for Men, Because Women Can Vote Them Out of Office",therecordcorrected,1538653173.0,1119,newyorker.com,'',9lb3kr,0.89,61
Democratic super PAC jumps into South Carolina race against Lindsey Graham — A clear signal Democrats see this seat as winnable,wenchette,1601305946.0,1120,washingtonpost.com,'',j1dt71,0.97,50
'Grim Reaper' Mitch McConnell Admits There Are 395 House Bills Sitting in the Senate: 'We're Not Going to Pass Those',everetterice,1581781554.0,1120,newsweek.com,'',f4b35h,0.96,136
Should be reconsidered especially the pandemics gutting everyones livelihood.,masochisticstud,1595645696.0,1119,i.redd.it,'',hxfgel,0.97,85
More than 170000 have died in the #TrumpGenocideOfAmerica,GFYS2025,1597887951.0,1118,i.redd.it,'',id19dz,0.92,43
"Thank you, John Lewis!",theplantpapi,1595045078.0,1117,i.redd.it,'',htabyj,0.99,36
McCabe: 'I was fired because I opened a case against the president',progress18,1550491567.0,1116,politico.com,'',arwlcu,0.96,41
Trump’s experiences vs Mueller’s experiences,jaydawg69,1536669292.0,1112,i.redd.it,'',9ex5au,0.9,72
Biden slams Trump’s response to George Floyd protests: ‘More interested in power than principle’,progress18,1591109503.0,1109,cnbc.com,'',gv8pe0,0.96,23
GOP admits privately that Georgia is in play and that Trump and other Republicans may lose there,wenchette,1588198212.0,1110,cnn.com,'',gaiy8w,0.98,92
"Preet Bharara: ""Bob Mueller today was decent, honest, humble, measured, patriotic, apolitical & above the fray. He returned none of the bile the president and others have heaped on him. Whatever you thought of his performance, he is far better than his critics and remains an American hero. 🙏""",therecordcorrected,1564077329.0,1108,twitter.com,'',chr4d7,0.96,26
Trump Campaign Aides Had Repeated Contacts With Russian Intelligence,Anticipator1234,1487125622.0,1109,nytimes.com,'',5u4sel,0.78,108
Republican users flooding social media with fake Democrat memes supporting Voter ID laws.,skepticalspectacle1,1531940599.0,1107,i.redd.it,'',8zydi9,0.94,249
Democrat Steve Bullock leads GOP Daines in Montana's Senate contest 46-39,wenchette,1588689372.0,1102,ktvh.com,'',gdyv2f,0.98,74
GOP Lawmaker Breaks Ranks On Russia Report: 'We've Lost All Credibility',jonfla,1520944189.0,1106,huffingtonpost.com,'',843r79,0.93,10
"No, Trump isn’t putting ‘America first.’ He’s putting himself first.",therecordcorrected,1542862078.0,1109,washingtonpost.com,'',9zawiu,0.95,29
"Let’s Go,Team Joe!",Popular-Way,1592205337.0,1099,i.imgur.com,'',h9b6l4,0.93,181
Scholars Poll Ranks Donald Trump As 'Worst President Of All-Time',therecordcorrected,1531068797.0,1106,hillreporter.com,'',8x2spr,0.93,75
What the future could bring.,SofaKingVote,1597798219.0,1097,i.imgur.com,'',icdnng,0.81,207
A great weight loss method.,VegaThePunisher,1524575220.0,1100,i.imgur.com,'',8ek8wp,0.9,45
Poll: Biden notches 10-point lead over Trump in general election match-up,progress18,1591015318.0,1096,politico.com,'',gujydc,0.95,119
"New Survey Shows Young People Are Staying Liberal, Conservatives Are Dying Off",wenchette,1519942969.0,1097,nymag.com,'',819cgu,0.9,90
Donald Trump is on a search-and-destroy mission to remove anyone who might get in the way of him committing more crimes or using the federal government as a personal piggybank for himself and his friends. And he's using the coronavirus pandemic as a cover,walter1950,1586390233.0,1097,self.democrats,"'He wants to get his hands on that money diverting it to his family’s businesses and his friends. $500. Billion under his control by way of his yes men, anyone who could cause a problem with that gone!!'",fxhtfb,0.94,99
"Rudy Giuliani Just Destroyed Trump's Excuse For Not Releasing Tax Returns; ""Those Audits, They're Done""",jonfla,1594648832.0,1096,huffpost.com,'',hqfr8n,0.97,55
Yale professor warns time running out for Americans to stop Trump dictatorship.,KubrickIsMyCopilot,1581590402.0,1101,businessinsider.com,'',f385a9,0.94,178
The United States is being run by a toddler: He has tantrums. He rips up paper. He disregards facts. He believes crazy conspiracies. He’s erratic and ill-informed.,therecordcorrected,1573242853.0,1102,washingtonpost.com,'',dtkrpp,0.95,77
I am former Republican voting for Biden this year.,,1587670321.0,1091,self.democrats,"'Was **Republican** from the late-1990s to 2015, became a **Democrat** in 2016.'",g6t6wo,0.93,151
"Madeleine Albright: Trump is ""the most undemocratic president in modern American history""",therecordcorrected,1530457146.0,1094,newsweek.com,'',8vafps,0.9,77
Governors And Mayors Of Both Parties Reject Trump Guidance On Reopening Economy Soon,jonfla,1586782737.0,1099,talkingpointsmemo.com,'',g0igpp,0.98,22
Trump Reportedly Denied He Called Apple CEO ‘Tim Apple’ Despite the Fact It’s All on Tape,therecordcorrected,1552275046.0,1092,mediaite.com,'',azoe7o,0.98,69
Donald Trump is losing Cabinet officials at a record rate,progress18,1542222072.0,1092,cnn.com,'',9x2zqr,0.97,22
"To all Republicans Trump said you won’t be safe in Joe Biden’s world, Really, have you looked around lately, when’s the last time the country was so divided people took to the streets. This is Trumpworld I’ll take Bidenworld",walter1950,1595462068.0,1092,self.democrats,'',hw55nu,0.94,104
"In 2018, Trump fired the entire US pandemic response team. These were the experts with decades of experience dealing with precisely the kind of situation we are in today. Trump did not replace them. He eliminated the positions.",realplayer16,1583984558.0,1088,self.democrats,'',fha7oy,0.98,100
"Patton Oswalt on Twitter: ""Colin Kaepernick should get off his damn knees during our National Anthem and do something respectful like Tweet and play golf.""",therecordcorrected,1535861273.0,1088,twitter.com,'',9c9dsx,0.98,23
Maine Senate Poll: Sara Gideon(D) leads Susan Collins(R) 51-42,GettingPhysicl,1590672591.0,1092,projects.fivethirtyeight.com,'',gs6aq5,0.98,112
"Julia Ioffe on Twitter: ""If #Cohen is a liar and his testimony is pointless, why are they so afraid to hear it?""",therecordcorrected,1551282639.0,1083,twitter.com,'',avewkr,0.97,60
The Real Story of Unemployment over the Last Decade.,VegaThePunisher,1527942381.0,1093,i.imgur.com,'',8o07ox,0.93,167
Biden demands Trump stop retweeting unfounded coronavirus claims from 'crazy woman',,1596061596.0,1091,thehill.com,'',i0a664,0.97,45
The Badass Women of Congress Took on the Credit Reporting Industry and It Was Glorious,ClimbeRocker,1551365817.0,1084,themarysue.com,'',avrzmz,0.96,39
Poll: Barack Obama Was the Greatest President of Our Lifetime,piede,1531331699.0,1086,nymag.com,'',8y1ttt,0.88,131
Joe Biden criticises 'disgusting' Donald Trump campaign for taking aim at Tammy Duckworth,,1594210576.0,1086,stuff.co.nz,'',hng00a,0.95,88
"The Nobel Committee just revealed that Trump’s nomination for the Nobel Peace Prize was forged: Investigators have been cooperating with the F.B.I since last fall, which seems to imply that the forgeries were created and sent from the United States.",therecordcorrected,1551480686.0,1083,washingtonpress.com,'',awatfs,0.98,81
GOP War on Mail-In Ballots Appears to Be Backfiring on Republicans,wenchette,1587401299.0,1083,nydailynews.com,'',g4wcrr,0.98,54
Biden says Trump was ‘paralysed with fear’ by protests and hid ‘in his bunker’ in new campaign ad -- ‘Too scared to face the people. Too small to meet the moment. Too weak to lead.’,Admiral_Red_Wings,1591983150.0,1084,independent.co.uk,'',h7p6mx,0.97,77
White supremacist sentenced to life in prison for Charlottesville car attack,progress18,1561808895.0,1079,pbs.org,'',c6y19l,0.98,56
Campaign to draft Democratic challenger to McConnell starts raising funds.,Ghdust2,1552470588.0,1080,thehill.com,'',b0k48k,0.98,34
"Barbara Bush Blamed Trump For Heart Attack, Said She’s No Longer Republican",jonfla,1553701637.0,1083,talkingpointsmemo.com,'',b65tw0,0.96,76
Alex Cole on Twitter-- Undocumented immigrants commit crimes at a considerably lower rate than Trump's campaign staff.,1000000students,1598131806.0,1072,twitter.com,'',iequwq,0.97,23
"Adam Schiff on Twitter: ""A quick update on our national security leadership: Defense Secretary: Vacant. DHS Secretary: Vacant. UN Ambassador: Vacant. FEMA Director: Vacant. Secret Service Director: Vacant. ICE Director: Vacant. DHS Deputy: Vacant. President: Present, but unaccounted for.""",therecordcorrected,1554909404.0,1077,twitter.com,'',bbn7by,0.97,51
Double standards,apologygenerator,1535121743.0,1074,i.redd.it,'',99xz49,0.97,80
The RedCap Paradox.,VegaThePunisher,1514569899.0,1078,i.imgur.com,'',7mvt3v,0.88,126
Atlanta mayor says Trump should 'stop talking' about protests: 'This is like Charlottesville all over again',DoremusJessup,1590949067.0,1068,thehill.com,'',gu3ypb,0.98,73
"Sen. Jeff Merkley on Twitter: ...the president said, “If there is going to be peace and legislation, there cannot be war and investigation.” That’s baloney. It is Congress’ constitutional duty to serve as a check on the Executive Branch—whether the President likes it or not.",progress18,1549584616.0,1069,twitter.com,'',aoaj39,0.97,20
Charles Blow tells CNN: ‘N-word tape’ would probably make Trump’s depraved fans love him more,therecordcorrected,1534336347.0,1072,rawstory.com,'',97huhp,0.94,94
A list of controversies about trump and the military,The_Alejandro_Show,1599181713.0,1076,reddit.com,'',im6cox,0.97,62
"Conservatives Rage After Gorsuch, Roberts Deliver LGBTQ Win",wenchette,1592260657.0,1069,talkingpointsmemo.com,'',h9qke4,0.98,122
"Schiff: If senators don't allow witnesses, they are guilty of ""working with the President to obstruct the truth""",progress18,1579622548.0,1074,cnn.com,'',erwkny,0.97,82
Scott Walker ordered to hold special elections he was afraid Republicans would lose,Schickie,1521750208.0,1067,yahoo.com,'',86eqn7,0.94,31
Trump Is Now Openly Trying to Censor His Critics. He May Succeed. - His campaign’s cease & desist letter to broadcast stations is a frightening assault on free speech.,anutensil,1585272580.0,1069,slate.com,'',fpo2d0,0.97,66
The new NRA logo. Designed for us to fight back.,jakevanyahres,1518898814.0,1067,i.redd.it,'',7y94zx,0.83,228
GOP Accused of 'Greatest Cover-Up Since Watergate' as Senate Set to End First Witness-Less Impeachment Trial in US History,JLBesq1981,1580619873.0,1063,commondreams.org,'',exjda6,0.97,125
Ex-Bush ethics chief calls for Steve King expulsion after he posted meme of potential civil war,progress18,1552940853.0,1070,thehill.com,'',b2nmc7,0.96,41
Made a friend on the road in Boston this morning.,DayRowShay,1544993524.0,1062,i.redd.it,'',a6srgi,0.96,16
Joe Scarborough: ‘America’s IQ Dropped About 100 Points’ Because of ‘Extraordinary Stupid’ GOP Defense of Trump,progress18,1574338432.0,1065,mediaite.com,'',dzig5h,0.96,53
"Trump says he'll cut entitlements like Social Security and Medicare if reelected to shrink trillions in national debt, trump creates problem (tax cuts) and makes us pay for it, not the root of the problem. God forbid you rescind the 1%er’s tax cuts and loop holes.",walter1950,1583593715.0,1063,self.democrats,"'Social Security can’t, by law, add to the federal deficit. Congress did declare in 1990 that Social Security spending and its build-up with reserves are not a part of the federal budget'",fewb9b,0.94,208
Trump Howls That Bolton's Quid Pro Quo Allegation Isn’t True. But Parnas' Lawyer Says He Has More Video And Audio,jonfla,1580132663.0,1061,talkingpointsmemo.com,'',euo2mn,0.98,87
"'Obamagate' Is the Newest, Dumbest Trumpian Distraction Bait",wenchette,1589471857.0,1059,esquire.com,'',gjp2jf,0.95,101
"The Hillary Clinton emails story comes to an end: One of the worst media screw-ups in history, and nobody seems to have learned anything. The email story shows how double standards can develop and then produce shockingly unfair coverage in ways that absolutely affect the outcome of the race.",therecordcorrected,1571770673.0,1064,washingtonpost.com,'',dlmjgh,0.94,83
LBJ on the GOP,jaydawg69,1535676831.0,1056,i.redd.it,'',9bp50c,0.95,60
"Trump wants rioting, but he is terrified of massive peaceful protests. Video like THIS will defeat Trump.",23Dec2017,1591237436.0,1056,twitter.com,'',gw8b7u,0.97,54
Giuliani associate Parnas threatens to release photo every time Trump denies knowing him,progress18,1579185436.0,1055,thehill.com,'',epk4wn,0.98,54
Snake oil now available for purchase on the White House lawn,Broke_Poetry,1598404481.0,1052,i.redd.it,'',igpcn4,0.95,70
